标题,价格(元),所在地,想要人数,商品URL
一剑破万法 2.0.63全英雄全商城全皮肤 指令 魔兽争霸3冰封王座地图kk自建房，可邀好友联机 (也满赞)  注意：是地图 (非刷非号)  赠送：地图安装说明,3.0,江西,0,https://www.goofish.com/item?id=890747645366&categoryId=200928013
嗜血魔键，Handjoy嗜血魔键k5，嗜血魔剑，吃鸡王座，6 18特价！可指定安装固件版本！苹果版安卓通用版本，绝版机器便宜卖了！99成新！吃鸡外设天花板！不封号唯一保证！要求ios13.4以下系统，无需越狱！换了水蜜桃超级静音！外加消音圈！全新换的轴，别拿耍过的轴来跟我比！妥妥的5000万次击打满血...,298.0,广东,0,https://www.goofish.com/item?id=672889996494&categoryId=126920145
代找各类老地图，只有你想不到，没有我找不到。拍下发一个地图。 全支持官方平台好友联机举例:/2009保卫卢沟桥之湖山村起义/CLJ-神剑奇缘3/GZB2-混乱武林II单机版/GZB2-神雕侠侣/LT生存反击战快乐版/TD ∽幻想②∽光与暗/U9仙剑奇侠传三--刀剑如梦/《晶莹之路》/中国复仇军之攻打日本/九种兵器/五虎将后传3.0肯德基增强版/京都防御战/人品生存战2.5正式版/保卫卢沟桥纪念版/保护大虾4./倚天屠龙记Ⅲ(终).w3x/超越极限1.9/公主与巨龙/刀剑封魔录V1.80完美修订/华理TD正式A版寒霜改/吉尔尼斯之战V2.03：终焉之日/圣斗士星矢I黄金十二宫肆版./大话西游/天龙八部_九阴九阳/守护女神-2014新版/封神榜正式版/射雕英雄传/帝国的英雄/幻想未来v/幻想群侠传3./新魔兽世界1-3章/无双蜀将传/星河战队之五剑圣强化版/晶莹之路/暗黑破坏神II毁灭王座./水之TD /水浒传之曾头市/混乱武林IV 2.1/澄海3C/火影忍者之巅峰对决/秦时明月/超越命运/（新）吞食天地/沉沦之城/血腥苦工大作战/帝皇怒/极武尊/倚天屠龙记Ⅱ--神兵天降.终/好一瓶脉动/幻灵大陆 /星河战队/12诸神最终版/木叶传说外传 /NaRuTo2疾风の轨迹/木叶村的英雄们/荣耀之战 25种族 生存/忍者村大战/善良的死神/善良的死神新编/校园修神录2.4-入世重修/新八百万僵尸/十方圣碑/净天之命/仙之侠道超级版/3c带小小版本;西方世界的劫难 等。拍下发一个地图 没有的点击 我想要 沟通代找 。,7.79,湖南,92,https://www.goofish.com/item?id=685654427344&categoryId=201403106
出发吧麦芬刺客，第一大区刺客，多典藏，十几万氪度，19亿战力 典藏9套：苍龙引，大玩家，解决师，火热夏日，悠悠海滨，月上小兔，盛大公演，魔咒，敖丙直购12：小红帽和大灰狼，司书，万圣惊魂夜，梦的旅人，鹊巧儿，回归之s级猎人，造王者，罗马尼安午后，樱花学院，shoot红心，露营地，暹罗离谱家族坐骑直购7：狼，剑，张田中打地球，亲临王座，月亮，跑堂仓鼠，圣诞常青藤，还有很多直购武器，月卡剩两个月,795.0,贵州,0,https://www.goofish.com/item?id=957573555418&categoryId=202032502
纸质小说出清，有完美世界、龙族、全职法师、遮天、斗破苍穹、七 芒星、白色橄榄树、山鬼、中国异闻录、圣墟、吞噬星空、万族之劫、神印王座、十宗罪、嘿，那个转校生、书剑恩仇录、坠落、大奉打更人、碎玉投珠、如果月亮有秘密、星光的彼岸、盛世心动、炮楼[hot]等小说出清，请看准上下篇再购买 有使用痕迹，适合收藏...,20.0,广东,500,https://www.goofish.com/item?id=963036708942&categoryId=127838003
【神印王座】龙皓晨 cos 武器cos道具  生命与创造之剑 #cos #Cosplay  某音发布的「神印王座」的 生命与创造之剑视频点赞量突破一万啦。！！！！ 即日起开启拼团， 截止7月30号， 5人团20张，10人团18张，20人团15张。 截止拼团之后根据下单顺序排单制作。  定金800排单...,1999.99,广东,0,https://www.goofish.com/item?id=951780962276&categoryId=126860286
芙莉莲【4】第五人格租号ios/安卓官服130金4虚妄8真理 之下，七万累充猫耳可共享10次园丁粘土人头像【绯 白 黯 加特 dm 真相 麒麟商人 锁芯】❤️ios/安卓官服都可以❤️价格：13/h，2小时起租包白115（08:00-18:00）；包夜60（00:00-08:00）；包天200（任意时间开始24h）押金20，下号后验号无误退。[红圆]新增：气象学家-芙莉莲、心理学家”-菲伦、病患-休塔尔克、祭司-阿乌拉、“骑士”-辛美尔、“骑士”-勇者之剑❤️段位：人5屠3❤️亮点：调香摩涅莫绪涅之梦 祭司虚司犹格索托斯之使 夫人虚妄希望的残像 先知虚妄昔日的预言者 珊瑚 驯兽师克罗托 晖之羽 恶之源 苍鹭之翼  试运者 采风的仙灵  寒香舞 菖蒲  招风旗 驱魔人 夜行枭 黄金比例 纳西瑟斯 心锁 圣诞信使 日向创 黑白熊 亡灵之主 箜篌 荧 裁决之酒 赤松枫 KING  鸽子般的尤迪特 静默之戟 川上富江 赤宴 十三娘 壹圆侑子 永夜极光 中岛敦 太宰治 中原中也 芥川龙之介 明智吾郎  国王的裁缝 铁钩船长 雨燕先生 日落黄沙 墨菲斯的门廊 猎物的印记 荣誉首席 哲人石 joker crow 雨宫莲 红骑士 温室 星之王 不合时宜的危鲁弗 恒梦 溯光  破碎的芙拉吉尔 石榴碟小姐 拉拉电竞oph 蛙里奥 莎莉 伊莎贝拉 穆希卡 盛夏光影 聂莫黎 陶梦嫣 肖驰 变彩 认知启迪师oph佣兵电竞 oph古董电竞 异动指针采集速巡  司药 瑶彩 采风的仙灵 李天辰 乔苓 刘枭 华生小姐 福尔摩斯 贝克街221B归宿 乌骨 枭徒 囚徒电竞oph❤️真理之下：加特 真相 生日快乐 DM 仁慈 先知白 黯 巫医套 海盗巫医 海盗酒壶 金靴套 金翼之球 海盗船匠 假面绅士 双一 skull navi noir panther  绯   麒麟商人 锁芯85w豪华山庄：陨落的王座，一念之间，角色陈列柜，吊床摇摇椅典藏沙发❤️租号须知❤️:禁止公屏涉h/涉z/辱骂/接共享/卖号/毁号/骗钱等言论或行为。【永久禁言/封号会采取报警处理】请不要做损人不利己的事情。若禁言按时租/包天赔偿以此类推，不要发布不好的言论谢谢。不可以动骰子！！❌发号后不暂停不改时间；过时不补不退；取消预约或改时间付50%鸽费。⭕️可以加好友共享皮肤给朋友、改侧写头像天赋等，装修归宿要新建。租号默认已知本须知。,13.0,四川,307,https://www.goofish.com/item?id=801703941480&categoryId=200956005
阴阳双剑游戏账号等级500级，职业九霄琴傅，战力高达5098 万，稳居王座六34服第一。内购一折，比如冲直1000抵扣后只需100，一个服只给三个折扣，人满了就等下一个服先验号，就是先给你验证账号之后再购买， 先验号后购买，注意没给你号验证的直接删除，没给你安排一折折扣，直接删除 没给你额外道具礼包的...,555.0,安徽,4,https://www.goofish.com/item?id=937001729765&categoryId=202032502
光明王座2，，12代差4万钻到13代飞机 仓库有全套加6剑土圣魂，，装备再生满，果实满，圣骨满，圣魂满，大师天赋满，符文满，瑰环6个100万年，其他全是50万年，兵鉴武器全+10**装备首饰武器全部4属性，,6000.0,广东,0,https://www.goofish.com/item?id=899789965415&categoryId=202032502
变形金刚 布鲁可 传奇版 g1 动画 威震天 全配无损仅拿走王座带预定特典版的鸡万贴纸小精灵重涂过配件可以给ss86威震天用拼装玩具默认渣水口激光枪改造过可以插光剑剑刃当特效件用照相机加了5mm握把可以匹配其他玩具用二手物品售出不退不换闲鱼币不可用,111.0,安徽,1,https://www.goofish.com/item?id=960375167186&categoryId=126860315
"网络小说TOP榜 游戏系列网络小说合集 蝴蝶兰 齐佩甲 惊仙 [五角星]B度网盘分享链接发货，拍下后15秒内机器人自动发货[闪亮]标价包含以下全部，需要的可以直接拍[绿圆]【发飙的蜗牛】《九星天辰诀》(校对版全本)作者:发飙的蜗牛.txt《神纹道》(校对版全本)作者:发的蜗牛.txt《网游之练级专家》(校对版全本)作者:发飙的蜗牛.txt《贼胆》(校对版全本)作者:发飙的蜗牛.txt《重生之贼行天下》(校对版全本)作者:发飙的蜗牛.txt[绿圆]【果味喵作品】《九星》(校对版全本)作者:果味喵.txt《绝顶枪王》(校对版全本)作者:果味喵.txt《绝顶唐门》校对版全本)作者:果味喵.txt[绿圆]【蝴蝶蓝作品】《独闯天涯》(校对版全本)作者:蝴蝶蓝.txt《全职高手》(精校版全本)作者:蝴蝶蓝.txt《网游之江湖任务行》(精校版全本+番外)作者:蝴蝶蓝.txt《网游之近战法师》(精校版全本)作者:蝴蝶蓝.txt《星照不宣》(校对版全本)作者:蝴蝶蓝.txt[绿圆]【火星引力作品】《网游之邪龙逆天》（校对版全本）作者：火星引力.txt[绿圆]【兰帝魅晨作品】《读心高手在都市》(精校版全本)作者:兰帝魅晨.txt《高手寂寞》作者:兰帝魅晨.txt《高手寂寞2》(校对版全本)作者:兰帝魅晨.txt《过去的今》(校对版全本)作者:兰帝魅晨,txt《机械末日》(校对版全本)作者:兰帝魅晨.txt《惊仙》(校对版全本)作者:兰帝魅晨.txt《菌魔》(校对版全本)作者:兰帝魅晨.txt《兰帝魅晨系列之天堂瞬间》(精校全本)作者:兰帝魅晨.txt《兰帝魅晨系列之饮》(校对版全本)作者:兰帝魅晨.txt《王》(校对版全本)作者:兰帝魅晨.txt《我即天意》(校对版全本)作者:兰帝魅晨.txt《心兵》(校对版全本)作者:兰帝魅晨.txt《再活一万次》，作者:兰帝魅晨.txt《暂命名》(校对版全本)作者:兰帝魅晨.txt《真相堕落》(校对版全本)作者:兰帝魅晨.txt[绿圆]【雷云风暴作品】《从零开始》（校对版全本）作者：雷云风暴.txt[绿圆]【乱作品】《牧龙师》作者:乱.txt《全职法师》作者:乱.txt[绿圆]【齐佩甲作品】《超神机械师》作者:齐佩甲.txt《恶魔王族》作者:齐佩甲.txt《妙笔计划:异乡人》作者:齐佩甲.txt[绿圆]【失落叶作品】《都市邪剑仙》(校对全本)作者:失落叶.txt《斗神》(校对版全本)作者:失落叶.txt《剑王传说》(校对版全本)作者:失落叶.txt《炼神领域》(校对版全本)作者:失落叶.txt《网游之天下无双》(校对版全本)作者:失落叶.txt《网游之纵横天下》校对版全本)作者:失落叶.txt[绿圆]【无罪作品】《冰火破坏神》(校对版全本)作者:无罪.txt《剑王朝》(校对版全本)作者:无罪.txt《流氓高手》(校对版全本)作者:无罪.txt《流氓高手I》(校对版全本)作者:无罪.txt《罗浮》(校对版全本)作者:无罪.txt《通天之路》(校对版全本)作者:无罪.txt《仙魔变》(精校版全本)作者:无罪.txt《仙侠世界》(校对版全本)作者:无罪.txt《众神王座》校对版全本)作者:无罪.txt",2.88,江苏,10,https://www.goofish.com/item?id=863554425716&categoryId=201459411
王座系列旋击冰刃v.飓风战魂陀螺全新仅拆封 标价直拍主页所有出售陀螺可换一代路人陀螺，三代功能完好的破天魔煞，霹雳神驹，寒鞭熊猫。关键词:烈风天翼，黄金火焰，极地金盾，青蓝冰伞，绝地隐盾，霹雳流星，寒冰震鼓，逆流战鞭，火舞九天，爆炎泰斗，烈焰魔杖，极速剑舞，疾风双钺，遁地魔轮，地爆玄甲，狱炎魔翼，爆裂巨拳，碧影神弓，混元光盾，雷霆天书，爆雷重炮，漩涡战轮，狂涛魔玉，暗影双镰，巨岩星盾，苍穹怒锤，火雷龙棘，圣光战甲，破天巨锤，飞天法杖，裂震钢钻，旋击冰刃，火鳞神斧，火焰万蛇，龙泉霸刃， 暗影空翼 ，烈风天翼s，黄金火焰s，极地金盾,347.0,北京,0,https://www.goofish.com/item?id=949351509135&categoryId=126914167
"【剑与远征账号】内部福利号+托号扶持，帮你快速上手，264级 水晶等级，战力169M。王座之塔529层，苍翠之柱178层，光铸之阶241层，千骸之墓241层。全平台互通，可以直接登录玩。 账号带多个264级英雄，水晶等级264级，战力169M。资源丰富，可以直接玩。想体验的小伙伴点击""我想要...",19.99,四川,0,https://www.goofish.com/item?id=957495442524&categoryId=202032502
自由之刃 万魂觉醒烈焰横空 王座争霸 赤月龙城 问仙 刀枪剑 传奇 王者大冒险首充 1.6折起  1.76魂环攻速 凤凰传奇 战online 新区首充号，折扣号 送辅助脚本 轻松满魂环  感兴趣的私聊或者直接找我,16.0,浙江,0,https://www.goofish.com/item?id=678278688728&categoryId=200928012
芙莉莲【4】第五人格租号ios/安卓官服130金4虚妄8真理 之下，七万累充猫耳可共享10次园丁粘土人头像【绯 白 黯 加特 dm 真相 麒麟商人 锁芯】❤️ios/安卓官服都可以❤️价格：13/h，2小时起租包白115（08:00-18:00）；包夜60（00:00-08:00）；包天200（任意时间开始24h）押金20，下号后验号无误退。[红圆]新增：气象学家-芙莉莲、心理学家”-菲伦、病患-休塔尔克、祭司-阿乌拉、“骑士”-辛美尔、“骑士”-勇者之剑❤️段位：人5屠3❤️亮点：调香摩涅莫绪涅之梦 祭司虚司犹格索托斯之使 夫人虚妄希望的残像 先知虚妄昔日的预言者 珊瑚 驯兽师克罗托 晖之羽 恶之源 苍鹭之翼  试运者 采风的仙灵  寒香舞 菖蒲  招风旗 驱魔人 夜行枭 黄金比例 纳西瑟斯 心锁 圣诞信使 日向创 黑白熊 亡灵之主 箜篌 荧 裁决之酒 赤松枫 KING  鸽子般的尤迪特 静默之戟 川上富江 赤宴 十三娘 壹圆侑子 永夜极光 中岛敦 太宰治 中原中也 芥川龙之介 明智吾郎  国王的裁缝 铁钩船长 雨燕先生 日落黄沙 墨菲斯的门廊 猎物的印记 荣誉首席 哲人石 joker crow 雨宫莲 红骑士 温室 星之王 不合时宜的危鲁弗 恒梦 溯光  破碎的芙拉吉尔 石榴碟小姐 拉拉电竞oph 蛙里奥 莎莉 伊莎贝拉 穆希卡 盛夏光影 聂莫黎 陶梦嫣 肖驰 变彩 认知启迪师oph佣兵电竞 oph古董电竞 异动指针采集速巡  司药 瑶彩 采风的仙灵 李天辰 乔苓 刘枭 华生小姐 福尔摩斯 贝克街221B归宿 乌骨 枭徒 囚徒电竞oph❤️真理之下：加特 真相 生日快乐 DM 仁慈 先知白 黯 巫医套 海盗巫医 海盗酒壶 金靴套 金翼之球 海盗船匠 假面绅士 双一 skull navi noir panther  绯   麒麟商人 锁芯85w豪华山庄：陨落的王座，一念之间，角色陈列柜，吊床摇摇椅典藏沙发❤️租号须知❤️:禁止公屏涉h/涉z/辱骂/接共享/卖号/毁号/骗钱等言论或行为。【永久禁言/封号会采取报警处理】请不要做损人不利己的事情。若禁言按时租/包天赔偿以此类推，不要发布不好的言论谢谢。不可以动骰子！！❌发号后不暂停不改时间；过时不补不退；取消预约或改时间付50%鸽费。⭕️可以加好友共享皮肤给朋友、改侧写头像天赋等，装修归宿要新建。租号默认已知本须知。,13.0,四川,150,https://www.goofish.com/item?id=803046751750&categoryId=200956005
剧本杀转让，盒装剧本杀，城限剧本杀。店铺不干了，干了半年，很 多本都是全新的，剧本杀本转让。正版。发货前询问好。按本报价，不都是80。左右浮动。要的越多越便宜。 天环猜想如常9号晓人间落月竹笑打工人¥女打工人丧失RuaRua一夜暴富正月十五怡红院尸落之城少年僧侣和我的尸体红釉入容纱幔青梅嗅花香2般若剃心沉溺之约深渊进化论野浮士德选白玫瑰王座夜举日来自昨日的少年笼畔逐日深林半扇1995那车不是白来了吗刀光戏影山商异闻录打劫了之比惨大会以父之名恶临诡计博物馆狼鱼七号教学楼爆竹声中一岁除雾海同行疯狂外星人赛东里外黑昭议会不知者的白蝙蝠疯人院里有个碗贫农骑士大战饿了爸爸户王请留步白万锡瓜喵，是怪物我们相的昨日重逢伤1998答应我活下去嗯，好久不见新世文本类型哦买嘎开枪吧夜变之乱大话西游穹庐仙宗清风白由之毒的凉不少年恋爱ing炼金术旋命 梦毕业快乐雪城际童话爆发校园逐爱无恨（限定）下方万岁解渴王老爹挺忙岁月神偷上帝不在的那一天安然无恙为亲爱的你献上杀意我们没这么大款吧以神之名虐囚十题物语那时的我们6人科举金玉良缘探长英明不要告诉她不是玩不起迷失雪都怪谈9号旅馆新倩女幽魂朝冠不准耽误我上进斗兽场plan v分手勿语难产疯狂外星人我无法座碑迷局后来持续调酒师悬崖底下食为天假若相逢在枪口归墟子语极雷大师暴怨我爱你是故事宛若旁通陛下饶命能不能成功渡这一次活埋马斯洛刺杀小说家夜深知雪重明早人异星接触白物语怪谈事件簿人生重启馆忆苦爱凌没温暖的幸福人生诡谈洬河故事津市木枝霸天下山河赠中·病幻梦城晓人间再见请勿翻开下一页长生叹地狱邀请函零子无限剑决满月海王一方烟火殷棱桌上翻棋子了怦然心动送你一朵小红花鬼影跟踪等着你回来你麻了比海干再见美娟画元这里乐乐园如果回忆记得明月婉凉穿刺馆弗农行江德星的夏天龙案卷*2脱先大会大人我要投胎十里宠物店野爱不见嘎好人鸡仔玛门上青天蒲公英的约定空隐在少年九龙大案你心慌啊补偿性说偷不能说的秘密上坟弃点你的礼物一拜天地鬼门关空中花园兴风作浪绝代商娇畸形娃娃山间客栈自误天神一马当先泣鸡魔王去死谁杀了大光头酒中仙天下大礼 中间列 疯狂枢密院鼓楼理了被我疼爱的百种理由不知名的白蝙蝠我又又又被锁傻了咒怨蚀刻疯人院里有个碗远山逸鬼体检异山田洋子小心慌慌退休犯罪的少儿不宜上坟静宜它屹立阴缘困维眠梦不老泉枯骨仙酒中仙2滑子潘大奇密室逃亡恋歌物语双相丹但乐老骗子俱乐部1终末之2人类叫爸爸一笑中规狱中被集中营与妻书重生之我成了废少的掌上玩物老骗子俱乐部1猛鬼大厦流变1941互相看了我说我们还能做网友吗有间客栈 2贸祸山海异闻录别告诉高山上的花环那时的我们山之神盖的你的礼物再见萤火虫再从中灭绝迷人落月在逃公主疑是星河落九天不忠逃离博物馆镜子老骗子俱乐部3戏精的诞生家宴继承者们世缘那时的我们孤山槐支纪-文纪家宴继承者们年冠赛hi，朋友人间小红花俗俗·不野崩坏与献祭咒怨蚀渣人奇迹前男友的一百种死法山海分神录时子芯子已到恋爱日记侧写师献给纱的处女给你一朵小红花诡计博物馆像素别来无恙宝格丽之夜一颗柿子我们相的昨日重逢活埋以父之名龙宴2大人时代变了打针打劫幻术的H诞生的夜晚清女成长史超级灵魂师1山之神玉龙吟当海风还吹我的坟墓互相看了我说我们还能做网友吗自相情愿事件簿遇真守黑泉陪葬那时的我们碟影重重纷争11青玉赌坊你好修皮绿林鲸鱼马戏团杀人之手入水即慎雾海同行拳风吹过绿色的海食为天木乃伊天才在左我在有蝴蝶之锤归墟子语将死未死的THX七个密室千佛梦青楼2九零后才不会变老呢落椿摸鱼马卜到逃离博物馆市井狂人菜市口家宴春运为尸收税户悦悦刑案龙宴今夜没有北极星木瓯北内生试睡员飞鱼照京霜死宴殡仪馆夜闯女儿国 右边列（含红色“刺秦”、黄色加印区） 下凡神仙的悲惨生活刺秦赴国忧冤种突袭纸扎工人盲卜赌坊没头脑东不伤心我在明朝当海盗卧底模拟训练兽疫大作战前男友的100种死法亲爱的你听我解释地府办事处瞒天过海月见节十分之一苏荷solo橡皮2超作AB再见萤火虫玉龙吟杀龙头岭在花间结仇大作战春昼短2天上的星星睡着了无声回响好帅的电吧吧东海水沟寿师烧烤雕塑里的曼陀罗上钟2大湖1班刁民3空灵出人蒸汽朋克Space刺杀阿肯捉鬼森林王国之选美大赛不醉不归我要当班长先发异闻录私太监2乱入总觉分手物语家中有喜佔桃花园开在泥河之下谍川惊蛰簿甜蜜蜜沸腾世纪solar沙丘的向日葵红昭愿相安风铃木相爱是最小的共产主义大湖为边顶罪市井狂魔赏善珠光宝气2橡皮回寒夜哦畔吧漂亮无妄荒居五号市民守夜人逢山遇鬼2人间作废涂川菜市场阳关入困兽某人雨落春城山布局者盘花洞孤儿院鉴破师清女成长史<月亮沉入海底时春昼短云上昆仑返校花魁神的孩子在跳舞奔丧十六少儿不宜命定之日第八个骗人面具恶之寒消失的学号胸中恶灵血之瞳明天神叩天柱落日行童心未泯龙徽你死定了异乡录他是龙人皮灯笼审判永别了我的独角兽风尸联航班福报大富翁血案多电何似在人间璀璨星河年少不知软饭香扶桑嫂高级动物云上有个供销社刑侦档案诡计将死未死的THX亡灵序章七成熟门客红太阳幼儿园你可伍被对春运楼龙宴2扫黄我在看着你钟楼山庄冥想那子22山田洋子2双双梦幻金银岛唐白虎寻秋香剧本杀误甜蜜家园酒色元宝七色之下谁让我穿上了小能睡衣假如国夫差有如果期2群星惟双归鲸鱼马戏团过阴东郡书院前传成分生活去北极越狱地铁食神地狱收音机罪名成立神明酒局老嫂子俱乐部不龟嫁衣遗产新倩女幽魂我从云中来一口闷罐子你妈逼你结婚了吗虫儿飞探见杀意刁民2宫中二三言怪谈九官旅馆三寸弥音45义庄十五扒萱葛楼金蝉脱壳上仙求云两点半声声慢2026死者档案宛童*6天气好的时候我会去见你-交红谷约本死刑犯的独白万刃归巢跨年拿到月亮秋实秋78无尽的谎言未果的第一夜当勇者的那一生奋不读绝轨边有无1/2世界推理法则受命于天罪名昭著杀完人喝白开水被窝模糊到发光跨年拿到月亮加印无授权慌慌而终推理作家的谋杀艺术此时此刻就像水消失在水中||||是好||猎岛2滚东循环东不书院小玩具的点灯会遗物整理师囚夫成烟王者机关笼置酒·栀子花病与药未来的社会性死亡事件归途2如谕欢迎来到死后的世界雪花先放的那天风在转动点外之外崇狱寺房屋守则鞘纳库鲁湖鱼龟会馆请收91998案来愿恩无忧暗潮城限99.9，哦，部分全新0.独家《七月的少年》0.独家《我从云中来》1.航海日志星夜满2.大航海·七点整的诅咒3.火花4.红莓花下5.暮色四合6.茨林村7.布鲁克岛8.八月2：五味9.将夜：鱼跃此时海10.我要判你11.牢白12.||1~4是||13.华妃墓14.Miss玫瑰的旧时时光15.我们16.我从地狱中走来17.你这么想我也没办法18.某某3:我与周旋久19.某某3:无意奉陪20.某某121.当·囚车22.当长河度流淌时23.早桔324.被单125.彼岸26.金陵有座东君书院27.王老菊长不夜长安28.家长会29.天府攻略30.业火东原31.VIVI水系32.光华之外33.先陪陷阱34.下缺35.太叔谋36.老子有艘飞船37.归墟远点38.兔偶公馆39.半岛公事40.房屋守则41.另一个我42.明镜高悬43.民国奇探之193844.太.谲夜荒庄鬼哭村45.点妖簿46.后来·持续47.春田花花奖部48.日1落花道49.我，一个人挺好50.洞房在梳妆未知,80.0,河北,499,https://www.goofish.com/item?id=964377055293&categoryId=126860363
光明王座2，号已给客服，可以联系客服上号。三端互通，可以换帮 ，汇员满，坐骑加一个加10仓库有全套加6剑土圣魂，，装备再生满，果实满，圣骨满，圣魂满，大师天赋满，符文满，瑰环6个100万年，其他全是50万年，兵鉴武器全+10**装备首饰武器全部4属性，,3000.0,广东,0,https://www.goofish.com/item?id=950276430643&categoryId=202032502
【神印王座】龙皓晨 cos 武器cos道具  生命与创造之剑 #cos #Cosplay  某音发布的「神印王座」的 生命与创造之剑视频点赞量突破一万啦。！！！！ 即日起开启拼团， 截止7月30号， 5人团20张，10人团18张，20人团15张。 截止拼团之后根据下单顺序排单制作。  定金800排单...,1999.99,广东,0,https://www.goofish.com/item?id=949306488570&categoryId=126860286
顶级氪佬号伤心退游（名人堂第三） 龙袍翅膀大剑俱全 时装神话一套 耳环龙胆狮子俱有 护石两套 各种副本秒 异星桩88万亿 王座装备齐全 材料小号多多 边玩边出，有意者私聊。,6888.0,江苏,2,https://www.goofish.com/item?id=961382540152&categoryId=202032502
不朽之守护（0.1折）游戏充值返利！碾压市面上一切游戏代理！ 能对接游戏运营！请认准鲸鱼游戏专员商务！专员客服一对一服务！！！！       《不朽之守护》是一款二次元风格的卡牌手游，讲述冒险者在异世界中和万族共存，剑与魔法交相辉映，人族、海族、精灵、天神、恶魔等等种族争先绽放文明之光谱写史诗悲歌！冒...,7.0,广东,2,https://www.goofish.com/item?id=831512157604&categoryId=200928012
