标题,价格(元),所在地,想要人数,商品URL
杖剑传说90级秘术师账号，战力82万，牧音82级，带暗夜帝王 宠物。主属性攻击4.82万，生命26.4万，防御4.29万，速度4.14万。装备齐全，技能都在，可以直接玩。全平台互通，价格可议，同城自提，异地可换绑。喜欢的来聊。奇迹圣遗物暗魔盒（速度%暗牧核心）火王座 （高攻） 传说圣遗物黄金王之斧(速...,1200.0,江苏,0,https://www.goofish.com/item?id=942865678230&categoryId=202032502
Canon/佳能 EE17 ee28 全系列半格相机 135 胶卷胶片中古机械自动高颜值古董3D立体复古老式旁轴防水卡通宽幅傻瓜国产的相机 维修打理保养维护保养维修打理大宝剑等业务：过片卡住按快门没反应，测光不动作，红窗不弹起，光圈打不开，镜头有霉，取景器有霉，胶片仓老化漏光更换海绵，计片器不动作。...,10.0,四川,0,https://www.goofish.com/item?id=625965381277&categoryId=126864790
阴阳双剑游戏账号等级500级，职业九霄琴傅，战力高达5098 万，稳居王座六34服第一。每日充值有神宠奖励，超值必买，龙魂冲榜等活动助力提升。 账号优势：战力傲视群雄，资源丰厚，适合追求极致的玩家。日常活动参与度高，成就满满。限时活动奖励多多 内部号，每天送1000的代金 大量的材料 要求保密嘴严 一...,1000.0,重庆,1,https://www.goofish.com/item?id=903982863032&categoryId=202032502
网店代营运（美团、大众点评），对店铺进行全新装修，重新构建团 单，重写关键词，品牌帐户重新规划关键词包方向。重装后的店铺无论是在竞品关键词展示引流、促点击，增加咨询量等方面均有更好表现。美团运营助手，擅长美团的全方位运营。无论您需要项目设置、流量提升还是活动策划，我都能提供专业的建议和帮助。主要服务于：医美、轻医美、皮肤管理、祛痘、家政、保姆、私教健身等类型店铺，欢迎咨询接洽。#网店装修#店铺装修#店铺运营#网店运营#美团店铺装修#大众点评装修#网店关键词策划详情页设计网店装修网店装修设计美团店铺装修，一线设计师。2024网店装修设计平面设计logo网店装修设计美团大众点评店铺装修设计网店装修设计网店网店装修设计详情页设计网店装修装修网店装修网店网店装修！抖音店铺装修，抖店装修，抖店装修设计，抖店入口图、抖店头图、抖店轮播图、抖店详情页装修设计。一线医美设计师接单。中古首饰手镯/手链 18-68 3件包邮豹纹蛇纹金属铆钉亚克力木质宽手镯中古古着vintage千禧辣妹海淘亚文化y2k涩谷辣妹/save the queen/stq/issey miyake/三宅一生/jpg高缇耶jean paul gaultier/lazy daisy/custo Barcelona/d.i.a./garula/lgb/lb-03/d&g/犰犰/archive/14th addiction/if six was nine/algonquins/ozz on/hysteric glamour/John Galliano/share spirit/VivienneWestwood/worms online/kiss order/梦展望/mash mania/von dutch/roco nails/rote rosa/el rodeo/tosca blu/SKECHERS/roberto cavalli/think bee/desigual/redpepper/playboy/hammock/alba rosa/mezzo piano/blue moon blue/cecil mcbee/ed hardy/anna sui/morgan/miss sixty/courreges/Lacoste/Betsey Johnson/juicy couture/roxy/cocolulu/lalabobo/ma*rs/glamourous jane/tralala/dig deep/lizlisa/Paul Smith/baby phat/ghost of harlem/skinny lip/glad news/miss me/伊太利屋/津森千里/Vivienne tam谭燕玉/jamin puech/pride/dior/kachy/jungle cat/roca wear/h.naoto/qutie frash/g.o.a/cop copine/blumarine/kmrii/fotus南樱旗 TRAP BOY机械结构推牌 金属edc推块指尖陀螺解压玩具 吊坠，锆合金材质，侧面螺丝有磕主体没有任何问题，手感已调好能叮叮叮，带个锆合金的坠子已编好，原盒配件都在。包顺丰，拍下不退不换，发货前会拍详细视频。关联：推牌 指尖陀螺 TK推牌 达摩  推蛋 啪啪牌 啪啪币 麦基 老铁匠 潮玩社 亚太动力学 老吴 晨语 kts 黑镜子 亚太 辰光 老九 老荣 老王 喵家 秋迪 cooyoo ckf 凯撒 锐鲨 不锈钢洗黑  钛 锆 铜  正版 edc老曹奶盖 ACedc奶盖ppb 指尖陀螺  麦基 老铁匠  Nano 凯撒 钢火 骑士 圣剑 推蛋 不锈钢 钛合金  锆合金 黄铜 紫铜 白铜 铜马 钛马 锆马 野猪 喵家 守卫 锆rot  tor ckf edc玩具  双叶，两页  老吴  灵空 钛盾   roc modrapt   铜星    两页狗头    rot Tor 齿轮 指虎 骑士 圣剑 圣骑士 辐射 噪音 守卫 守护 大F 天使之翼 三角洲 心房 狗头 野猪 钢火 斐戈 核心 轮回 瞳 龙渊 龙吟 天歌 Ve ft 战斧 齿轮风暴 狗头棍 左轮 延光 御 逆戟 猎手 夜枭关联指尖陀螺  麦基 老铁匠 凯撒 钢火 骑士 圣剑 推蛋 钛合金  野猪 喵家 守卫 锆rot  tor ckf edc玩具  双叶，两页  脉冲 勋章，潮玩社 社长 圣剑 老吴 钢 灵空  Ai绘画国漫女神合集300g约十万张AI绘画，精挑细选的4K精品图。4K图占很大内存，买家需要考虑下内存。《秦时明月》《师兄啊师兄》《神印王座》《斗破苍穹》《天行九歌》《赘婿》《星辰变》《完美世界》《吞噬星空》《斗罗大陆》《君有云》《眷思量》《灵笼》《画江湖之不良人》等等国漫女神，Ai苏檀儿、Ai巴巴塔、Ai徐欣、Ai妖娆、Ai姑妈、Ai珍妮特、Ai月婵、Ai云曦、Ai秦怡宁、Ai天狐仙子、Ai红凰、Ai火灵儿、Ai女武神、Ai大娘、Ai柳神、Ai美杜莎、Ai萧薰儿、Ai云韵、Ai纳兰嫣然、Ai韩月、Ai紫妍、Ai雅妃、Ai小医仙、Ai青鳞、Ai柳菲、Ai南宫夕儿、Ai姜立、Ai小舞、Ai千仞雪、Ai比比东、Ai胡列娜、Ai宁荣荣、Ai朱竹清、Ai白沉香、Ai波塞西、Ai小白、Ai柳二龙、Ai阿银、Ai少司命、Ai紫女、Ai焰灵姬、Ai雪女、A原神手工冒险5-10级 |  克洛琳德 | 克洛琳德限定组合 | 克洛琳德专武赦罪 | | 初始开局关键词：钟离，八重神子，甘雨，荒泷一斗，达达利亚公子，可莉，刻晴，迪卢克，优菈尤拉，雷电将军，万叶，申鹤，宵宫 ，魈 ，神里绫华，专武，温迪温蒂，胡桃 ，夜兰夜阑，提纳里，飞雷之弦振，雾切之回光，狼的末路，松籁响起之时，冬极白星，神乐之真意，若水，薙草之稻光，贯虹之槊，三神一帝，赛诺，赤沙之杖，妮露，圣显之钥，纳西妲，流浪者，散兵，艾尔海森，迪希雅，白术，林尼，那维莱特，芙宁娜，水神，娜维娅，闲云，千织，阿雷奇诺，阿蕾奇诺，克洛琳德，赦罪，赤月之形，有乐御簾切，鹤鸣余音，裁断，最初的大魔术，若水，神乐之真意，万世流涌大典，静水流涌之辉，金流监督，莱欧斯利，护摩之杖，阿莫斯之弓i晓梦、Ai姬如雪、Ai陆林轩、Ai将臣、Ai女帝、Ai屠丽、Ai圣采儿、Ai白月魁、Ai有琴玄雅等等等等。商品具有复制性，故售出不可退，谢谢理解指尖陀螺 rt老吴 麦基 灵空 锆 铝 py 守护 圣剑 轨道炮 cy 晨语 老铁匠指尖陀螺，麦基，锆白铜勋章 白铜核 老铁匠噪音 麦基骑士 圣骑士 圣剑 老吴野猪 老王蝰蛇  斐戈 晨语CY 喵家  轨道炮 星际 tor rot  zf ft 齿爆 KTS 惊蛰老雷 老铁匠机械师 topd dz top币 topc 节奏推牌 01推牌 刘处一个朋友 老铁匠qka peitopb tope 02edc pedc 湖中剑 石中剑 湖光剑 刺客 老铁匠嘉年华 mot锆律动 矩阵音域 神域 圣域 冬眠鹅砾 七夕泡泡 情人节topb,8.0,湖北,6,https://www.goofish.com/item?id=825694490983&categoryId=202035102
"4-6倍灵符折扣赤月裁决龙城，万魂觉醒烈焰横空 王座争霸 问 仙刀枪剑传奇，王者大冒险自由之刃 寒刀折扣号自己注册，自助充值  可自由充值， 1.76魂环攻速 凤凰传奇  星王攻速同款 1、玩家自行注册账号,可绑定,账号安全  2、提供账号给客服即可开通折扣,无需个人信息  3、直充平台币即可返利等同...",142.0,浙江,0,https://www.goofish.com/item?id=683525066534&categoryId=200928012
阴阳双剑游戏账号等级500级，职业九霄琴傅，战力高达5098 万，稳居王座六34服第一。每日充值有神宠奖励，超值必买，龙魂冲榜等活动助力提升。 账号优势：战力傲视群雄，资源丰厚，适合追求极致的玩家。日常活动参与度高，成就满满。限时活动奖励多多 内部号，每天送1000的代金 大量的材料 要求保密嘴严 一...,998.0,重庆,0,https://www.goofish.com/item?id=902166683974&categoryId=202032502
神陵武装冰火平台65级剑圣号，战力19万，带异星王座装备毕业 和花篮龙袍，神话时装4件，带名刀翅膀，王座BOSS直接秒属性加成高。仓库资源丰富，装备齐全，可以直接玩。全平台互通，安卓苹果都可以玩。价格可小刀，感兴趣的来聊。,6666.0,广东,6,https://www.goofish.com/item?id=902007257968&categoryId=202032502
阴阳双剑游戏账号等级500级，职业九霄琴傅，战力高达5098 万，稳居王座六34服第一。每日充值有神宠奖励，超值必买，龙魂冲榜等活动助力提升。 账号优势：战力傲视群雄，资源丰厚，适合追求极致的玩家。日常活动参与度高，成就满满。限时活动奖励多多 内部号，每天送1000的代金 大量的材料 要求保密嘴严 一...,1000.0,重庆,0,https://www.goofish.com/item?id=903670371878&categoryId=202032502
"可租 10块钱一个小时这些皮肤免费畅玩，可小刀，[WRLJS1270]珍品无双|珍品传说2典藏|传说9史诗77限定83英雄125波肤242稀有英雄9贵族7级总项次1D366皮肤价值:182964[珍品充双|] 貂蝉馥梦鰵花[珍品传说2] 安琪拉酷洛米之心瑶“大啤之梦[荣耀典藏|] 瑶拾光映像[传说皮肤9]西施续相思后羿黄金射“手座云缨幻光神枪蔡文姬愿照福禄驟嗓启鸣野蒿朵莉亚心述手记小乔音你心动貂蝉仲夏夜之梦瑶时之祈愿[史诗皮肤77] 黄忠咱相守梦扁鹊灵蛊蚀心小乔嘖蛇刘禅鸭鸭，五险记阿轲暗夜猫娘狂铁龙之律动钟馗乐园奇纺夜阿轲化蝶舞赵怀真器灵浮梦炉孙膑茶境仙雅典娜黎明之约兰陵王暗隐猎兽者伽罗箭羽风息百里守约陌相守梦沈梦溪明团寄思西施至美乘鲤谣露娜紫霞仙子上官婉儿梁祝赵云味来纪元哎琳陌上嗓。大乔白蛇安琪拉心灵骇客亚连破空之剑妲己女外咖啡夏侯惇乘刚破浪蔡文姬夏日便利店梦奇颃趣铠曙光守护者杨戬天秀启明镜青焰无极张良千筹问战海诺心述呼记明世隐”夜落电台上官婉儿群星魔术团李白千年之狐花休兰水晶猎龙者高斩离燃音魔法刘禅矢术门将云中君往云哢巧陌里守约特工魅影蒙犴咱解令李元苦逐浪之夏阿古朵江河有灵大乔猫”日记张飞乱世虎臣刘禅电玩爆裂旋网扁鹊奇幻香踪贏政优雅恋%廉颇地狱岩魂晁星界游陕马可波罗山海玄林吟瑶山海碧波行安琪拉时之畸旅曹操幽灵船步吕布味日机甲元歌无心吕布圣诞狂欢孙尚香时之恋以刘邦德古拉伯爵鬼谷子五谷丰军宫本武藏鬼剑武藏狄平杰魔术师赵云皇.家上将白起星夜王子貂蝉圣诞恋歌小乔缤纷独角""兽嫦娥拒霜思墨子金属刚暴孙尚香蔷薇恋%人庄周高山流冰瑶遇见神鹿蔡文姬舞动绿茵孙尚香冰果甜心狄平杰鹰眼统帅甄姬冰雪圆舞曲裴擒虎李小龙妲己魅力维加斯[军限皮肤3] 蔡文姬愿照福禄驟马可波罗山海玄休吟瑶山海碧波行[内测波肤3] 哎琳女武神贏政优雅恋“人孙尚香蔷薇恋“人[限定“皮肤83]沈梦溪鸭鸭五险记刘禅鸭鸭历险记白起死霸装貂蝉馥梦繁花安琪拉酷洛米之心啊古朵布JQ”之约瑶“大咀四之梦狂铁龙之律动苏烈春野闲踪钟馗虚灵默护啊轲牝蝶舞西施续相思赵怀真器灵浮梦炉马超访嗒客孙膑茶境仙蔡文姬愿照福禄驟雅典娜黎明之约西施雪境奇遇太乙嗔。人谧流熔炉咱里守约陌相守梦老夫子陌相守梦吕唏逐霄战戟西施至美乘鲤谣哎琳女武神上官婉儿梁祝嗓启呜野萵哎琳陌上嗓亚连破空之剑孙悟空神迹守B东皇太二噬_灭天穹盘古敬我三分虞姬夏日便利店蔡文姬夏日便利店梦奇顽趣姜子牙天穹之誓周瑜熔金海岸西施玲珑珍味镜青焰无帔项减苍威无极海诺心述手记朵莉亚心动呼记上官婉儿群星魔术团刘邦剑破矢穹沈梦溪龙舞盛军高渐离燃音魔法妲己灵卜魔法嫦娥漠中纺影鬼谷子天穹祈灯云中君缝云哢巧蒙讶陌解令阿古朵江河有灵张良古海寻蹀鲁班大师探海日志杨戬潮玩骑兵扁鹊奇幻香踪瑶时之祈愿赢政优雅恋人裴擒虎擒涛扼浪晁星界游陕马可波罗山海玄休吟瑶山海碧波行嫦娥暖冬兔眠嗓启海盐诗旅元歌无心鬼谷子五谷丰年李元芳云中旅人沈梦溪大漠名商兰陵旺金庭之子狄干杰魔术师赵云皇家上将迹摩沙漠行僧嫦娥拒霜思孙尚香蔷薇恋以庄周高山流冰苏烈千军破阵项羽海滩派对钟馗驱雕正伙程咬金演武夺筹狄平杰阴阳师狄平杰万哗元夜裴擒虎李小龙鬼谷子原初探秘者老夫子醍醐杖[其他I] 庄周锦麟游梦程咬金星际陆战队露娜命运加冕李白敏锐之力关羽龙腾五里刘备汉昭烈帝王将莫邪第弋人隅张良灵野札记刘备浪漫序章戈娅致蓝誓约明世隐景韶洛都蒙猾胡桃狂想曲少司缘灵卦秘语东皇太二金福满堂姜子牙星梦巡礼典伟铁骨偃魂苍苍林猿骑王将莫邪雾都夜雨宫本武藏味来纪元米莱狄怪诞之夜艾琳女武神老夫子功夫老与杨戬埃及法老猪八戒潮玩探阴行阿古朵能喵少女云缨赤焰之缨典炜黃金武士花咻兰兔女郎露娜哥特玫瑰大乔绒语心约貂蝉步夏之忆安琪拉玩隅对对碰鬼""谷子紅陈之宴程咬金群星魔术团赵云白执事姜子牙炽热元素使嗓启画中游赵云怨炎影廉颇功夫炙烤海诺时空谍影高渐离金属""狂潮李阮芳妄想特派后羿完美运算曹操超能战警程咬金无双福将海月王牌新星孙尚香沉稳之力姬小满零食大正战沈梦溪鲨炮海盆猫刘备五事如意啐星踏雪寻梅明世隐占星师莱西奥西部游陕太乙真“人劲辣红锅赵怀真太帔少军诸葛亮掌控之力刘禅秘密基地自起乐园追猎者马可波罗激情绿茵刘邦圣殿之光迹摩拳王海月紇泉雾影刘备纽约教父李自范海呈刘备潮玩造梦师司空震启蛰后羿阿尔法小队盾山圆桌骑士元歌哗夜歌剧院哪吒次元突破孙膑味来旅行墨子进“击墨子号狂铁特工战影吕布野性能量、米菜狄契约魔法虞姬加勒比小姐王昭君幻想奇妙夜貂蝉哢域舞娘公孙离花间群小乔丁香结百里守约绝影神枪澜孤猎钟无艳海滩丽影大乔伊楚巫女晁碧铂绯影马可波罗潮玩牛仔马超幸存“者金蝉前尘韩信教廷特使孙膑归虛梦演甄姬花转人间妲己紫罗兰之誓西施归虚梦演李元若特种部队扁鹊批身博士大乔守护之力噜班大师乓乓大师孙膑天使之翼张良缤纷绘卷上官婉儿際竹墨客明世隐虻云星官露娜瓷语鉴心杨玉环霓裳曲扁鹊救世之瞳杨戬次元傲视“王昭君精灵公主蔡文姬蔷薇王座小乔五圣前夜瑶森妲己少女阿狸亚瑟死亡骑士[稀有英雄9] .。艾琳敖隐娜可露露不知舞韩真。久特蝉橘大方",10.0,广东,30,https://www.goofish.com/item?id=966265344322&categoryId=200956005
阴阳双剑游戏账号等级500级，职业九霄琴傅，战力高达5098 万，稳居王座六34服第一。每日充值有神宠奖励，超值必买，龙魂冲榜等活动助力提升。 账号优势：战力傲视群雄，资源丰厚，适合追求极致的玩家。日常活动参与度高，成就满满。限时活动奖励多多 内部号，每天送1000的代金 大量的材料 要求保密嘴严 一...,1000.0,重庆,0,https://www.goofish.com/item?id=903982391986&categoryId=202032502
4-6倍灵符折扣赤月裁决龙城，万魂觉醒烈焰横空 王座争霸 问 仙刀枪剑传奇，王者大冒险自由之刃 寒刀折扣号自己注册，自助充值  可自由充值， 1.76魂环攻速 凤凰传奇  星王攻速同款,15.0,浙江,0,https://www.goofish.com/item?id=687646736193&categoryId=200928012
战玲珑2首续0.1折冒险佣兵团万剑至尊手游折扣首冲号平台币代 金劵  奇缘幻境(首续0.1折)  金属狂潮(首续0.1折)  传奇世界之仗剑天涯H5(0.1折首发版) 剑勤四海（0.1折扣金秋版） 热血王座（BT） 无间（BT） 群雄逐鹿（送300抽） 最封神（水墨割草0.1折） 天下霸域（0.1折无...,60.0,北京,4,https://www.goofish.com/item?id=741591435253&categoryId=201406806
阴阳双剑游戏账号等级500级，职业九霄琴傅，战力高达5098 万，稳居王座六34服第一。每日充值有神宠奖励，超值必买，龙魂冲榜等活动助力提升。 账号优势：战力傲视群雄，资源丰厚，适合追求极致的玩家。日常活动参与度高，成就满满。限时活动奖励多多 内部号，每天送1000的代金 大量的材料 要求保密嘴严 一...,1000.0,重庆,0,https://www.goofish.com/item?id=903957326757&categoryId=202032502
