标题,价格(元),所在地,想要人数,商品URL
大号可调玻璃夹F夹鱼嘴夹层板托架F夹隔板夹托架鹰嘴夹厚层板支 架  一共7个 店里用的 用了没多久就换柜子了 很新,30.0,米***米,0,https://www.goofish.com/item?id=858149476329&categoryId=126864580
长120宽36高2米  感兴趣的话点“我想要”和我私聊吧～,150.0,芳***代,2,https://www.goofish.com/item?id=905719751621&categoryId=126862036
木盆定做无漆无胶。尺寸私聊报价格。(下图为客户定做样品)  感兴趣的话点“我想要”和我私聊吧～,700.0,x***g,15,https://www.goofish.com/item?id=758979371253&categoryId=201459702
玻璃醒酒器，尺寸如图。  感兴趣的话点“我想要”和我私聊吧～,20.0,北***石,0,https://www.goofish.com/item?id=829590205887&categoryId=126854614
美的浴霸九九新  感兴趣的话点“我想要”和我私聊吧～,90.0,t***x,4,https://www.goofish.com/item?id=707833389661&categoryId=126858521
公牛定时器插座（16A）3个能正常使用  一起拍可以包邮 议价出 带价来聊 售出不退不换,28.0,都***了,2,https://www.goofish.com/item?id=933122099021&categoryId=126854881
阿胶唤颜玉容茶膏，保质期3年，罐装包装。   这款茶膏以优质原料制成，无任何添加剂，即冲即溶，支持冷热双泡，满足不同需求,98.0,一***蒿,0,https://www.goofish.com/item?id=905847906792&categoryId=126854647
蒸笼 全新的 口径如图  感兴趣的话点“我想要”和我私聊吧～,10.0,桃***介,0,https://www.goofish.com/item?id=873296406125&categoryId=126854998
Hape吉他敲琴乐队敲打玩具  颜色分类:六合一酷炫吉他乐队 九成新,80.0,心***灵,0,https://www.goofish.com/item?id=620427464977&categoryId=126862844
蕉下帽檐脸基尼AL333 防紫外线骑行冰丝口罩医美全脸防护防 晒面罩 带包装带防伪实拍图盗图必究,49.9,防***帽,1,https://www.goofish.com/item?id=929610501151&categoryId=126856726
新到家的浴缸，全新包装还没拆，我家卫生间地方不够放，，价格优 惠便宜转让，哪位大神喜欢直接拉走。,280.0,格***?,0,https://www.goofish.com/item?id=932241656843&categoryId=126858513
剧本杀  几乎全新！！已自刀,18.0,好***鱼,0,https://www.goofish.com/item?id=951451470111&categoryId=126860363
全新闲置奶瓶置物架。  感兴趣的话点“我想要”和我私聊吧～,15.0,x***3,0,https://www.goofish.com/item?id=947666525805&categoryId=126864933
康乃馨双层浴袍 有黄色灰色 白色  都是品牌酒店的 量大来谈   都是字母或者绣花 无中文字体 可以日常穿着 是voco,79.0,康***货,9,https://www.goofish.com/item?id=710952729050&categoryId=126858789
老话筒  电台用的，喜欢的朋友不要错过了，二手商品售出不退不换,50.0,瀚***控,2,https://www.goofish.com/item?id=806781747956&categoryId=126860652
吉利ICON专用自喷漆补漆笔，原车调色配色，适合各种划痕修复 ！4S店师傅指导，海盐蓝23款专用补漆套装，配件齐全。轻松,23.0,巴***啦,0,https://www.goofish.com/item?id=920376926006&categoryId=126860844
奇美口风琴，孩子用了几天，几乎全新  感兴趣的话点“我想要”和我私聊吧～,40.0,独***2,0,https://www.goofish.com/item?id=941048414601&categoryId=126858868
巨霸直磨机，气动工具，少用。成色不错功能正常。6毫米夹头。  感兴趣的话点“我想要”和我私聊吧～,70.0,守***货,15,https://www.goofish.com/item?id=684935781156&categoryId=126864395
露思同款Steelcase世楷Node培训椅宝宝椅儿童学习桌 椅  带可旋转桌面，灵活方便。座椅人体工学设计，久坐不累。,600.0,广***店,3299,https://www.goofish.com/item?id=898178779618&categoryId=126860949
23年银针 50g  感兴趣的话点“我想要”和我私聊吧～,99.0,y***y,1,https://www.goofish.com/item?id=914057405004&categoryId=126854637
