标题,价格(元),所在地,想要人数,商品URL
全新冰雪奇缘爱莎女童打底裤，外贸款，适合瘦点的小仙女。卷尺量 裤长72cm。夏款，娃胖了不适合。包邮不退不换。只有一条了。全场两件包邮，不退不换，谢谢理解,10.0,江苏,0,https://www.goofish.com/item?id=658094838303&categoryId=127052006
Disney迪士尼00后电商倒闭全新当二手卖  迪士尼冰雪奇 缘魔法仙女艾莎冰雪奇缘惊喜创意装扮礼盒 还剩几个手慢无 非质量问题不退不换,85.8,福建,0,https://www.goofish.com/item?id=879082200145&categoryId=126862788
［手游源码］ 资源顺流 自己挑中哪个我给你源码，省去几百元 8.8r一个哦游戏源码，搭建教程每个源码包含详细视频教程共计整理500+源码图中没有的可以私聊要网址去找商品可以直接拍然后发对应标题或截图手游网游端游游戏源码网代下，各类游戏源码安卓苹果电脑H5|||游戏源码，不提供技术支持。源码内包含详细文本与视频教程商品可以直接拍然后发对应网址注:帮代下载，只代下载代码明文，一经售出不退不换看准再拍，拍下付款视为同意以上条款。XO三端引擎传奇手游1655互通魔域手游三网H5游戏MT3换皮MH放置RPG刚宝手游开箱子手游战神引擎传奇手游白日门传奇手游3D换装卡牌回合手游跨次元美少女海战手游横版闯关手游二次元卡牌回合手游卡牌回合手游唯美3D仙侠手游传世手游大话回合手游Q萌回合手游怀旧3D横版卡牌回合手游武侠割草动作手游万剑OLH5多区跨服版航海物语H5多区跨服代金券内购版剑与盾H5三国・兵临天下代金券内购版九州群将录代金券内购本地版九州阴阳界H5平台市内购版鬼滅之刃H5多区跨服完整版九州谕H5铁杆三国12魂系H5内购本地版九州西游动漫空间大乱斗勇者冲冲冲九州神魔录仙女管家巅峰星辰梦三年大唐西游记诗情画意英雄有闪魔道修仙精品沉默复古嘟嘟X星河战姬肉购版钢铁少女/少女战舰全明星之重返阿拉德定制版境界・死神激斗完整版情怀之诸子百家阿拉德情怀之守望先锋阿拉德死神觉醒之灵魂冲击多区跨服版一拳超人体验版少女战姬风暴之心海贼艾琳娜的夜光星云记・太古纪元剑侠情缘之荒古剑侠江湖墨迹大侠传奇世界四职业飞扬部落传世缥缈西游星辰传说之神域奇缘天书奇谈怀旧3D横版卡牌回合手游口袋黄昏,8.88,山西,5299,https://www.goofish.com/item?id=963757506210&categoryId=201409706
迪斯尼魔法发光手镯珠海长隆电影主题号角巴啦啦仙女魔法棒孩之宝 小马宝莉麦当劳玩具集合  #1迪斯尼魔法手镯仙女手镯女孩玩具儿童手环公主冰雪奇缘发光玩具。---已售出  #2珠海长隆5D电影主题号角喇叭 19元  #3奥迪双钻巴啦啦小魔仙魔法棒玩具+送小魔仙魔法杖 23元  #4孩之宝小马宝莉My Li...,19.0,湖北,2,https://www.goofish.com/item?id=936347262069&categoryId=126862783
圣斗士星失代抽 秒到帐不用等三天】 天马座 星矢 仙女座 瞬 天鹅座 冰河 智慧 纱织 凤凰座 一辉 天龙座 紫龙 AUG圣斗士星矢 UZI圣斗士星矢 圣斗士飞行器秒到账！无需等待三天！     只有果v可安排，无需自备点券诚信可靠，我想要选项有详细价格  由于转盘的特殊性，使用碎片兑换也算完成，中途出其他除指定装备，全部算赠送代抽100%包出（可指定）扫码上号，附带抽出的物品免费赠送 抽星梦奇缘AUG388,129.9,河北,200,https://www.goofish.com/item?id=963399203790&categoryId=200928013
拖地长裙，冰雪奇缘艾莎公主裙，130码女童款，蓝色亮片长裙带 披风，适合夏天穿，只穿过几次拍照，成色很好，几乎全新。裙子是网纱材质，闪闪发亮，搭配皇冠超美，喜欢的小仙女看过来！同城自提，异地可发货～不退不换,30.0,北京,0,https://www.goofish.com/item?id=929122513074&categoryId=126862725
賀曼Hallmark1994年小老鼠Cos仙履奇缘仙女教母珠 光的【瑕疵特价】  主页有同系列其他人物 譬如灰姑娘仙度瑞拉 继母                       中古vintage老货              【购买/咨询前请看清介绍】                         ★...,30.0,广东,0,https://www.goofish.com/item?id=880516425938&categoryId=126858179
蓝色雪花斗篷披风，M码适合120-130身高小女孩穿，带毛领 超保暖。艾莎公主同款，雪白雪花图案配浅蓝色底色，超级仙气。外出玩耍、表演都可以穿，搭配裙子或者冬装都很美。喜欢的小仙女赶紧下单吧，价格可聊~,13.8,四川,0,https://www.goofish.com/item?id=951713057401&categoryId=126862718
全新正品迪士尼冰雪奇缘公主鞋，银色水晶款，超级闪亮！ 尺码：26码内长15.5cm 特点：鞋面银色亮片搭配彩色水钻，蝴蝶结装饰超美，鞋底防滑耐磨 适用季节：四季可穿 适用性别：女童 全新正品，带盒子。闪亮水晶装饰，搭配艾莎公主图案，超级公主范！适合表演、拍照、日常穿着。 喜欢的小仙女赶紧联系...,39.9,福建,8,https://www.goofish.com/item?id=948952031693&categoryId=126862694
闲置玩具 非全新无盒说 正版日本东京迪士尼TOKYO DIS NEY   爱莎公主闪光仙女棒 艾莎公主魔法棒 冰雪奇缘周边 冰雪奇缘魔法棒 多种灯光模式切换见视频参考 成色一般 顶部有一处较明显小裂痕介意勿拍 内部电池仅供拍摄视频使用后期需自配 实物拍摄所见即所得 二手玩具难免蹭色掉漆浮灰缺件等瑕疵能...,35.0,上海,0,https://www.goofish.com/item?id=851613603144&categoryId=126862783
迪士尼灰姑娘贺曼辛德瑞拉 仙履奇缘 仙女教母 小老鼠 狗狗 南瓜  换装灰姑娘是hallmark的不能独立站稳，发全新带盒的原价17.95美金，淘到即赚到！  ¥：现货78包邮6个，直接拍！ 偏远地区请补差价！  尺寸：灰姑娘高10cm南瓜高5cm狗狗高2.5cm橙色老鼠高3.6cm 仙女...,78.0,广东,7,https://www.goofish.com/item?id=706906339142&categoryId=126860377
全新未拆封闪闪亮长裙，银色亮片，超级闪，适合参加活动穿，宝贝 是全场最亮的仔，带吊牌，很漂亮  新冰雪奇缘艾莎公主裙，130码，白色亮片拖地长裙，带披风设计～  裙子是夏季款的，里面是网纱的，穿上特别仙，亮片设计超级闪，适合表演拍照。纯棉里布，穿着舒服。  同城自提，异地包邮，喜欢的小仙女赶紧私聊我吧...,35.0,内蒙古,0,https://www.goofish.com/item?id=942018475037&categoryId=126916033
迪士尼冰雪奇缘吹泡泡机手持仙女魔法棒 感兴趣的话点“我想要”和我私聊吧～,10.0,辽宁,0,https://www.goofish.com/item?id=899884230874&categoryId=126862784
茶百道冰雪奇缘蝴蝶结发饰，全新现货。实物适合可爱的小仙女们。 单件不包邮，店里两件包邮非偏远。,23.8,江苏,0,https://www.goofish.com/item?id=956502410647&categoryId=126862535
爱莎公主水晶凉鞋，26码[鞋内长16.8CM]，蓝色款，蝴蝶 结装饰闪亮可爱，软底舒适，适合夏天穿，八成新喜欢的小仙女可以入，售出不退不换。,20.0,江苏,0,https://www.goofish.com/item?id=954616119846&categoryId=126918035
迪士尼冰雪奇缘艾莎公主娃娃可以再砍价，2016年珍藏系列，全 新未拆封。金色长发，蓝色水晶裙，带雪花装饰，适合3-6岁小女孩玩耍。包装盒虽有变形但内部完好，零件齐全。喜欢的小仙女可以私聊，价格可聊，同城自提，异地包邮。,50.0,北京,0,https://www.goofish.com/item?id=954349512331&categoryId=126862808
999号 14周年庆收藏集 2233花海 999号卡片编号可用于动态卡片，空间头图，评论卡片展示哔哩哔哩 个性装扮 一号tag:生日号编号 倾海之约 原神  芙宁娜 走路摇zly 涤心独舞 玉之けだま_毛玉收藏集 旅行日记 旅途风花 前十 1号 毛玉牛乳 小小魅魔收藏集 随性躺卧露露姆嬉水露露姆夏日休憩 一起泡温泉 斯黛拉好热 小才不是夸人用的 玉之けだま_Official ro姬收藏集 黎歌收藏集 典藏卡 幻星乐园收藏集 洛天依收藏集，哔哩哔哩收藏集 千璃Chili收藏集 耀月收藏集岁末欢聚 小丸official收藏集 猫大人收藏集 劉了了收藏集 归汉收藏集 嗨嗨多吃点收藏集 扇宝收藏集 画猫收藏集 中国绊爱 2233群星闪耀时摩羯座 江明月收藏集 斋藤直葵收藏集 三丽鸥收藏集 夕兔收藏集 鸽一品天才集 百变狐狐收藏集 皮卡少个丘收藏集 秋绘收藏集 夏露露Ruru收藏集 星河Sagi收藏集 全力幻想少年收藏集  画师D收藏集 真白花音收藏集 库莉姆奶油集 抖个姬灵收藏集 柯南收藏集 杠杠收藏集 鲸鱼娘西丝特收藏集无限实验室收藏集 画猫收藏集 醒爷收藏集 扇宝收藏集 T5-茨舞收藏集 鬼刀系列收藏集 萨克万收藏集 嗷金宝收藏集 洛天依收藏集 是姬拉kira收藏集 熙往收藏集 白金宝贝收藏集 Jency&pink收藏集 胶囊计划收藏集sonny brisko收藏集 铃音收藏集 夏诺雅收藏集 A-soul收藏集 薄荷miint收藏集 地下城堡收藏集 花想云裳收藏集 kieed收藏集 熙往收藏集爱上她的理由收藏集 阿里鸭Alya收藏集 画猫.历史宝藏收藏集  艾恺特AKT收藏集双生境 百目境  玄冥境 2233群星闪耀时·双子座  巨蟹座  大D特D收藏集  装扮小姐姐中华锦绣 幻星集 收藏集 世界&星星 愚者魔法师 节制&隐士 真白花音收藏集 轻纱花语 铃芽之旅收藏集 梦音茶糯收藏集 烟雾旗袍 纱耶收藏集 梦游仙境  2233奇书异闻录 女娲补天  永雏塔菲美女收藏集  洛天依收藏集 钟与花的窗棂收藏集 桃宫七七收藏集 初音未来收藏集 主播女孩超天酱收藏集 八木百货社长收藏集 鲸鱼娘收藏集 果宝收藏集 春池醉梦花花haya收藏集 纱依收藏集 千璃Chili收藏集 真百花音收藏集 可洛收藏集 是幼情呀收藏集 安晴Ankil生活集小隐藏大隐藏前十1号coser cosplay 一颗小兔娘收藏集 真白花音收藏集 大D特D收藏集 普通小狗收藏集 2233群星闪耀时收藏集 永雏塔菲美女集 耀月集 洛天依收藏集 早凉收藏集 安可星瞳扇宝收藏集 冥冥收藏集 小铃久绘收藏集 初音未来收藏集 泠鸢yousa收藏集 四禧丸子收藏集 秋绘璀璨星辰收藏集 ASOUL绽放收藏集 早稻叽月下舞会收藏集 醒醒加班收藏集 织月黛黛收藏集 朝华缘拾收藏集 RO姬偶像收藏集 斋藤直葵收藏集 中国绊爱收藏集 纱依收藏集 黎歌收藏集 猫雷收藏集 鬼刀收藏集 Vsinger收藏集 绘之音收藏集 安晴生活集 大D特D第二弹 旅行日记收藏集 主播女孩重度依赖收藏集 春池醉梦花花Haya收藏集 咩栗呜米收藏集 可爱小猪Asaki收藏集 Hiiro收藏集春晖庆典 乐正绫九周年纪念收藏集 浅川玉乃收藏集 兰音的衣柜奇缘收藏集 折原露露收藏集 幻夏恋歌收藏集 hololive0期生收藏集 星空列车与白的旅行收藏集 雪狐桑倾心慕风收藏集 雪绘Yukie收藏集 米虫尼奈收藏集 洛天依再生收藏集 陆鳐lulu收藏集 宇宙无敌美少女雫lulu收藏集 兔眠可可夏色恋忆收藏集 洛天依心律共鸣收藏集 MyGO收藏集 东雪莲收藏集 希丝奈cisne收藏集 希月萌奈收藏集 幻星乐园收藏集 毛玉收藏集 hololive ID收藏集 奈姬niki收藏集 Neuro-sama收藏集 少女乐队的呐喊收藏集 东方收藏集浮生若梦 哔哩哔哩收藏集 全图鉴出框头像 纸嫁衣收藏集，甜夕sweet收藏集，雪狐桑收藏集，一点荧惑收藏集，卡拉彼丘收藏集，兰音的衣柜收藏集，量子猫收藏集，小铃久绘收藏集，陆鳐LuLu收藏集，兔眠可可收藏集，秋蒂夏日无际收藏集，然若星辰收藏集，尘白禁区收藏集，2233幻境序曲收藏集，切茜娅收藏集，唐九夏收藏集，雪域收藏集，东雪莲收藏集，明日方舟收藏集，Mygo收藏集，饿殍收藏集，泠鸢收藏集，洛天依收藏集，薇桃杠蔻伟情缘收藏集，瑞娅Rhea收藏集，花与梦收藏集，魔女与神兵收藏集，希丝奈cisne收藏集，白蛇浮生收藏集，Ro姬偶像收藏集，希月萌奈收藏集，阳阳不想熬夜收藏集，初音未来收藏集，随一Suiii收藏集，鬼刀收藏集，主播女孩重度依赖收藏集，绫光濑收藏集 朗星集 耀光集 皓月集 真白花音收藏集 大D特D收藏集 第二弹 普通小狗收藏集 2233群星闪耀时收藏集 永雏塔菲美女集 某科学的超电磁炮T收藏集 耀月集 洛天依收藏集 早凉收藏集 安可星瞳扇宝收藏集 爱上她的理由动画收藏集 冥冥收藏集 小铃久绘收藏集 穆小冷收藏集 初音未来收藏集 岱川收藏集 泠鸢收藏集 钉宫妮妮收藏集 鎏金之夜收藏集 星月夜收藏集 雪域收藏集 天官赐福动画收藏集 2233异世集 P＋收藏集艾尔莎收藏集 知薇入梦收藏集 psplive山珍收藏集 万圣学院收藏集 雪狐桑收藏集 幻夜魔法收藏集 KK輝気收藏集 奈奈莉娅收藏集 美月收藏集 银杏星川铃阿绿收藏集 露早GOGO收藏集 梅兰芳万象承华收藏集 Minicatty收藏集 兰音Reine收藏集 星瞳梦幻童话收藏集 四禧丸子收藏集 白粥nina收藏集 Twinkle.Star收藏集 psplive海味收藏集 Akie秋绘璀璨星辰收藏集 Kieed收藏集 花丸晴琉收藏集 铃音收藏集 夏诺雅收藏集 A-SOUL绽放收藏集 早稻叽月下舞会收藏集 醒醒加班收藏集 杠杠收藏集 织月黛黛收藏集 朝华缘拾收藏集 RO姬偶像收藏集 星河Sagi收藏集 夏露露Ruru收藏集 鸽一品天才集 斋藤直葵收藏集 中国绊爱收藏集 可洛Cro收藏集 幻境之夜纱依收藏集 米诺高分少女收藏集 次元异梦咲间妮娜收藏集  装扮小姐姐生日庆典 树礼suki收藏集 黎歌Neeko收藏集 猫雷NyaRu收藏集 公主茶话会iStella收藏集 初音未来单人收藏集 岁末欢聚 岁末夜宴 胡桃 旅行日记 原神 奥特曼收藏集 百妖谱收藏集 可爱小猪Asaki收藏集 Vox Akuma收藏集 功夫熊猫收藏集 机动战士高达收藏集 鬼刀收藏集 防道少女团收藏集 咩栗呜米收藏集 四季的少女收藏集 花花haya收藏集 纸迷金醉  兔眠可可收藏集 萝莉一凡个人收藏集  Hirro收藏集春晖庆典 宇宙无敌超级美少女雫lulu收藏集 折原露露收藏集 陆鳐lulu收藏集 饿殍·明末千里行收藏集 MyGO!!!!!收藏集 东雪莲收藏集 明日方舟收藏集 唐九夏-伴你一夏收藏集 尘白禁区收藏集与繁星共舞 库莉姆Cream《约会日》，奈奈莉娅《圣娅喵喵叫》，Skrillex《OC系列》，五更妖音《永不毕业》，小铃久绘Official《绘想童话》，话梅糖_Mei《玻璃纸季节》，文宝Eleven_《星轨交映》，氵六青《香草青青》，桃几OvO《家有萌猫》，Venus Vacation PRISM收藏集，早稻叽《云朵捕获计划》甜梦收容，丝塔莉《繁星缀梦》，i御十二《恋语花誓》，北久Kyuu的绮梦《心跳梦境》，甜夕sweet《夕时神约》，狸酱lino《喵狸个咪》，传奇仙女龙dd《有龙则灵》，白桃味の蛋挞《爱我还是挞》，酸柚粥sayo《妹妹养成手册》，是幼情呀《睡眠采耳店》，伊莎蓓尔Isabel《精灵物语》，冥冥meichan《爱执欲意》，Mygo!!!!!收藏集，rurudo_るるどらいおん《箱庭少女之梦》，黎歌Neeko《幻夏恋歌》，VirtuaReal《想去海边》偶像大师收藏集 BanG Dream收藏集 RAS收藏集 瑜瑜驯养手册收藏集 洛天依·珍藏集 VirtuaReal皓月集，VirtuaReal朗星集，VirtuaReal耀光集，普通小狗·梦幻塔罗收藏集，2233·奇书异闻录，纱耶sayako收藏集，小只芋收藏集，圣斗士星矢收藏集，bml10周年收藏集，时光代理人收藏集，赘婿动画收藏集，暹罗厘普收藏集，有兽焉动画收藏集，永生动画收藏集，保卫萝卜收藏集，2233群星闪耀时·双子座，巨蟹座收藏集，大D特D收藏集，DM袋猫收藏集，装扮小姐姐中华锦绣，幻星集收藏集，ksr与他的伙伴萌收藏集，真白花音收藏集，风灵玉秀动画收藏集，铃芽之旅收藏集，狮子座收藏集，BLG信念干杯收藏集，梦音茶糯收藏集，艾恺特AKT收藏集，雾山五行收藏集，镇魂街收藏集，菌子宝宝收藏集，百变菌宝收藏集，莓可收藏集，真里子收藏集，永雏塔菲美女集，晓丹收藏集，小黄人收藏集，蜘蛛侠：纵横宇宙收藏集，江壹纯收藏集，某科学的超电磁炮T收藏集，VirtuaReal耀月集，幻星集-命运的选择，阿萨Aza收藏集，早凉收藏集，洛天依收藏集，植物大战僵尸2收藏集，安可星瞳扇宝收藏集，爱上她的理由动画收藏集，2233·群星闪耀时-处女座，泰蕾莎收藏集，司稽人间幽灵收藏集，卡拉彼丘收藏集，红蓝巴萨，Krenz光影少女收藏集，斗破苍穹收藏集，波喵喵喵收藏集，阿里鸭收藏集 海天盛筵·夏日集 思小柒UMI收藏集 2233·宅舞嘉年华2025 居居boom 尘白禁区收藏集 流光协奏 八音奇响 莎布Shub欲望时刻收藏集,100.0,广东,0,https://www.goofish.com/item?id=966572877056&categoryId=201454708
