标题,价格(元),所在地,想要人数,商品URL
前十 Riko收藏集 rikoring见习看护士                3号不正经的看护士         4号卡片编号可用于哔哩哔哩动态卡片，空间头图，评论卡片展示哔哩哔哩 个性装扮 一号tag:生日号编号 倾海之约 原神  芙宁娜 走路摇zly 涤心独舞 玉之けだま_毛玉收藏集 旅行日记 旅途风花 前十 1号 毛玉牛乳 小小魅魔收藏集 随性躺卧露露姆嬉水露露姆夏日休憩 一起泡温泉 斯黛拉好热 小才不是夸人用的 玉之けだま_Official ro姬收藏集 黎歌收藏集 典藏卡 幻星乐园收藏集 洛天依收藏集，哔哩哔哩收藏集 千璃Chili收藏集 耀月收藏集岁末欢聚 小丸official收藏集 猫大人收藏集 劉了了收藏集 归汉收藏集 嗨嗨多吃点收藏集 扇宝收藏集 画猫收藏集 中国绊爱 2233群星闪耀时摩羯座 江明月收藏集 斋藤直葵收藏集 三丽鸥收藏集 夕兔收藏集 鸽一品天才集 百变狐狐收藏集 皮卡少个丘收藏集 秋绘收藏集 夏露露Ruru收藏集 星河Sagi收藏集 全力幻想少年收藏集  画师D收藏集 真白花音收藏集 库莉姆奶油集 抖个姬灵收藏集 柯南收藏集 杠杠收藏集 鲸鱼娘西丝特收藏集无限实验室收藏集 画猫收藏集 醒爷收藏集 扇宝收藏集 T5-茨舞收藏集 鬼刀系列收藏集 萨克万收藏集 嗷金宝收藏集 洛天依收藏集 是姬拉kira收藏集 熙往收藏集 白金宝贝收藏集 Jency&pink收藏集 胶囊计划收藏集sonny brisko收藏集 铃音收藏集 夏诺雅收藏集 A-soul收藏集 薄荷miint收藏集 地下城堡收藏集 花想云裳收藏集 kieed收藏集 熙往收藏集爱上她的理由收藏集 阿里鸭Alya收藏集 画猫.历史宝藏收藏集  艾恺特AKT收藏集双生境 百目境  玄冥境 2233群星闪耀时·双子座  巨蟹座  大D特D收藏集  装扮小姐姐中华锦绣 幻星集 收藏集 世界&星星 愚者魔法师 节制&隐士 真白花音收藏集 轻纱花语 铃芽之旅收藏集 梦音茶糯收藏集 烟雾旗袍 纱耶收藏集 梦游仙境  2233奇书异闻录 女娲补天  永雏塔菲美女收藏集  洛天依收藏集 钟与花的窗棂收藏集 桃宫七七收藏集 初音未来收藏集 主播女孩超天酱收藏集 八木百货社长收藏集 鲸鱼娘收藏集 果宝收藏集 春池醉梦花花haya收藏集 纱依收藏集 千璃Chili收藏集 真百花音收藏集 可洛收藏集 是幼情呀收藏集 安晴Ankil生活集小隐藏大隐藏前十1号coser cosplay 一颗小兔娘收藏集 真白花音收藏集 大D特D收藏集 普通小狗收藏集 2233群星闪耀时收藏集 永雏塔菲美女集 耀月集 洛天依收藏集 早凉收藏集 安可星瞳扇宝收藏集 冥冥收藏集 小铃久绘收藏集 初音未来收藏集 泠鸢yousa收藏集 四禧丸子收藏集 秋绘璀璨星辰收藏集 ASOUL绽放收藏集 早稻叽月下舞会收藏集 醒醒加班收藏集 织月黛黛收藏集 朝华缘拾收藏集 RO姬偶像收藏集 斋藤直葵收藏集 中国绊爱收藏集 纱依收藏集 黎歌收藏集 猫雷收藏集 鬼刀收藏集 Vsinger收藏集 绘之音收藏集 安晴生活集 大D特D第二弹 旅行日记收藏集 主播女孩重度依赖收藏集 春池醉梦花花Haya收藏集 咩栗呜米收藏集 可爱小猪Asaki收藏集 Hiiro收藏集春晖庆典 乐正绫九周年纪念收藏集 浅川玉乃收藏集 兰音的衣柜奇缘收藏集 折原露露收藏集 幻夏恋歌收藏集 hololive0期生收藏集 星空列车与白的旅行收藏集 雪狐桑倾心慕风收藏集 雪绘Yukie收藏集 米虫尼奈收藏集 洛天依再生收藏集 陆鳐lulu收藏集 宇宙无敌美少女雫lulu收藏集 兔眠可可夏色恋忆收藏集 洛天依心律共鸣收藏集 MyGO收藏集 东雪莲收藏集 希丝奈cisne收藏集 希月萌奈收藏集 幻星乐园收藏集 毛玉收藏集 hololive ID收藏集 奈姬niki收藏集 Neuro-sama收藏集 少女乐队的呐喊收藏集 东方收藏集浮生若梦 哔哩哔哩收藏集 全图鉴出框头像 纸嫁衣收藏集，甜夕sweet收藏集，雪狐桑收藏集，一点荧惑收藏集，卡拉彼丘收藏集，兰音的衣柜收藏集，量子猫收藏集，小铃久绘收藏集，陆鳐LuLu收藏集，兔眠可可收藏集，秋蒂夏日无际收藏集，然若星辰收藏集，尘白禁区收藏集，2233幻境序曲收藏集，切茜娅收藏集，唐九夏收藏集，雪域收藏集，东雪莲收藏集，明日方舟收藏集，Mygo收藏集，饿殍收藏集，泠鸢收藏集，洛天依收藏集，薇桃杠蔻伟情缘收藏集，瑞娅Rhea收藏集，花与梦收藏集，魔女与神兵收藏集，希丝奈cisne收藏集，白蛇浮生收藏集，Ro姬偶像收藏集，希月萌奈收藏集，阳阳不想熬夜收藏集，初音未来收藏集，随一Suiii收藏集，鬼刀收藏集，主播女孩重度依赖收藏集，绫光濑收藏集 朗星集 耀光集 皓月集 真白花音收藏集 大D特D收藏集 第二弹 普通小狗收藏集 2233群星闪耀时收藏集 永雏塔菲美女集 某科学的超电磁炮T收藏集 耀月集 洛天依收藏集 早凉收藏集 安可星瞳扇宝收藏集 爱上她的理由动画收藏集 冥冥收藏集 小铃久绘收藏集 穆小冷收藏集 初音未来收藏集 岱川收藏集 泠鸢收藏集 钉宫妮妮收藏集 鎏金之夜收藏集 星月夜收藏集 雪域收藏集 天官赐福动画收藏集 2233异世集 P＋收藏集艾尔莎收藏集 知薇入梦收藏集 psplive山珍收藏集 万圣学院收藏集 雪狐桑收藏集 幻夜魔法收藏集 KK輝気收藏集 奈奈莉娅收藏集 美月收藏集 银杏星川铃阿绿收藏集 露早GOGO收藏集 梅兰芳万象承华收藏集 Minicatty收藏集 兰音Reine收藏集 星瞳梦幻童话收藏集 四禧丸子收藏集 白粥nina收藏集 Twinkle.Star收藏集 psplive海味收藏集 Akie秋绘璀璨星辰收藏集 Kieed收藏集 花丸晴琉收藏集 铃音收藏集 夏诺雅收藏集 A-SOUL绽放收藏集 早稻叽月下舞会收藏集 醒醒加班收藏集 杠杠收藏集 织月黛黛收藏集 朝华缘拾收藏集 RO姬偶像收藏集 星河Sagi收藏集 夏露露Ruru收藏集 鸽一品天才集 斋藤直葵收藏集 中国绊爱收藏集 可洛Cro收藏集 幻境之夜纱依收藏集 米诺高分少女收藏集 次元异梦咲间妮娜收藏集  装扮小姐姐生日庆典 树礼suki收藏集 黎歌Neeko收藏集 猫雷NyaRu收藏集 公主茶话会iStella收藏集 初音未来单人收藏集 岁末欢聚 岁末夜宴 胡桃 旅行日记 原神 奥特曼收藏集 百妖谱收藏集 可爱小猪Asaki收藏集 Vox Akuma收藏集 功夫熊猫收藏集 机动战士高达收藏集 鬼刀收藏集 防道少女团收藏集 咩栗呜米收藏集 四季的少女收藏集 花花haya收藏集 纸迷金醉  兔眠可可收藏集 萝莉一凡个人收藏集  Hirro收藏集春晖庆典 宇宙无敌超级美少女雫lulu收藏集 折原露露收藏集 陆鳐lulu收藏集 饿殍·明末千里行收藏集 MyGO!!!!!收藏集 东雪莲收藏集 明日方舟收藏集 唐九夏-伴你一夏收藏集 尘白禁区收藏集与繁星共舞 库莉姆Cream《约会日》，奈奈莉娅《圣娅喵喵叫》，Skrillex《OC系列》，五更妖音《永不毕业》，小铃久绘Official《绘想童话》，话梅糖_Mei《玻璃纸季节》，文宝Eleven_《星轨交映》，氵六青《香草青青》，桃几OvO《家有萌猫》，Venus Vacation PRISM收藏集，早稻叽《云朵捕获计划》甜梦收容，丝塔莉《繁星缀梦》，i御十二《恋语花誓》，北久Kyuu的绮梦《心跳梦境》，甜夕sweet《夕时神约》，狸酱lino《喵狸个咪》，传奇仙女龙dd《有龙则灵》，白桃味の蛋挞《爱我还是挞》，酸柚粥sayo《妹妹养成手册》，是幼情呀《睡眠采耳店》，伊莎蓓尔Isabel《精灵物语》，冥冥meichan《爱执欲意》，Mygo!!!!!收藏集，rurudo_るるどらいおん《箱庭少女之梦》，黎歌Neeko《幻夏恋歌》，VirtuaReal《想去海边》偶像大师收藏集 BanG Dream收藏集 RAS收藏集 瑜瑜驯养手册收藏集 洛天依·珍藏集 VirtuaReal皓月集，VirtuaReal朗星集，VirtuaReal耀光集，普通小狗·梦幻塔罗收藏集，2233·奇书异闻录，纱耶sayako收藏集，小只芋收藏集，圣斗士星矢收藏集，bml10周年收藏集，时光代理人收藏集，赘婿动画收藏集，暹罗厘普收藏集，有兽焉动画收藏集，永生动画收藏集，保卫萝卜收藏集，2233群星闪耀时·双子座，巨蟹座收藏集，大D特D收藏集，DM袋猫收藏集，装扮小姐姐中华锦绣，幻星集收藏集，ksr与他的伙伴萌收藏集，真白花音收藏集，风灵玉秀动画收藏集，铃芽之旅收藏集，狮子座收藏集，BLG信念干杯收藏集，梦音茶糯收藏集，艾恺特AKT收藏集，雾山五行收藏集，镇魂街收藏集，菌子宝宝收藏集，百变菌宝收藏集，莓可收藏集，真里子收藏集，永雏塔菲美女集，晓丹收藏集，小黄人收藏集，蜘蛛侠：纵横宇宙收藏集，江壹纯收藏集，某科学的超电磁炮T收藏集，VirtuaReal耀月集，幻星集-命运的选择，阿萨Aza收藏集，早凉收藏集，洛天依收藏集，植物大战僵尸2收藏集，安可星瞳扇宝收藏集，爱上她的理由动画收藏集，2233·群星闪耀时-处女座，泰蕾莎收藏集，司稽人间幽灵收藏集，卡拉彼丘收藏集，红蓝巴萨，Krenz光影少女收藏集，斗破苍穹收藏集，波喵喵喵收藏集，阿里鸭收藏集 海天盛筵·夏日集 思小柒UMI收藏集 2233·宅舞嘉年华2025 居居boom 尘白禁区收藏集 流光协奏 八音奇响 莎布Shub欲望时刻收藏集 Renus收藏集 无尽耀 麻辣烤兔子收藏集 池咲的美少年收藏集 守护甜心收藏集 SHUGO CHARA! 糯米SnuomiQ收藏集 SNK-女神大乱斗 夏日缤果收藏集 宫濑真寻东方集 风舞早苗录 哪吒之魔童闹海收藏集 陆鳐lulu·心电同频 四茶·异世界冒险 灵笼破局·棋局之上 赛尔号巅峰之战系列 Yuimisu收藏集 爱上火车收藏集 一杆青空2025 少女前线收藏集 相伴格里芬 2233·元素协奏-寻疆 夏梦希语-希丝奈 永雏塔菲叮咚集 完蛋！我被美女包围了！再次心动 排球少年收藏集,15.0,四川,5,https://www.goofish.com/item?id=903049671594&categoryId=126860375
冰雪魔法奇缘公主发声玩具仙女爱莎魔仙发光生日礼物圣诞节万圣节 颜色随机发,13.6,广东,0,https://www.goofish.com/item?id=945635274343&categoryId=126862783
冰雪奇缘艾莎公主裙，100码长袖款，蓝色亮片裙身配雪纺纱裙摆 ，超美的雪花图案。适合夏天穿，裙子做工精致，亮片闪亮，纱裙飘逸。全新未拆封，吊牌在。喜欢的小仙女可以联系我，价格好商量～不退不换哦。,70.0,广东,0,https://www.goofish.com/item?id=963013735557&categoryId=126916033
艾莎正版冰雪奇缘连衣裙，蓝色亮片设计，超仙气飘逸。裙子配披风 ，一套都是正版授权。面料是柔软的网纱，闪闪发亮，穿上特别好看。裙摆大摆设计，走路带风，拍照效果超赞。适合参加生日派对、表演、拍照穿着。喜欢的小仙女赶紧下手啦～ 同城自提优惠，异地包邮，欢迎私聊咨询具体尺码和价格。,21.0,安徽,0,https://www.goofish.com/item?id=960405139129&categoryId=126916033
退圈出言情小说 9.9一本！ 每本书都带塑封袋 保存完好！有《深渊女神》《因为我是仙女呀》《老婆粉了解一下》《蜜汁炖鱿鱼》《小月牙》《江南丝雨》等多本热门小说！都是正版实体书 保存完好！喜欢的小姐妹可以私聊我看书状态！,9.9,浙江,0,https://www.goofish.com/item?id=962814793048&categoryId=127838003
栗织堂霜花缘2齐胸衫裙汉服诃子公主汉元素冰雪钉珠刺绣亮片 冰 雪奇缘 汉服 仙女  柯子裙M码 底衣Xl码（对大胸妹子友好） 披风均码  三件套打包出，真全新 （标牌未拆封） 送冰雪奇缘大蝴蝶结发带,178.0,湖南,0,https://www.goofish.com/item?id=772325708167&categoryId=201452825
