标题,价格(元),所在地,想要人数,商品URL
迪士尼动画电影大合集国语版，百度网盘发货，稀缺资源，所有迪士 尼动画电影都包含，全部都是超清级品质，直接拍不伤眼，可以自己看，也可以给孩子看，拍下后自动发货   包含钟楼怪人，圆梦巨人，亚当斯一家，小鹿斑比，小飞侠，仙女奇缘，泰山系列s史努比，狮子王，忍者神龟，奇幻森林，木偶奇遇记，猫狗大战，里约大冒...,2.8,福建,280,https://www.goofish.com/item?id=926734325165&categoryId=126864806
灵剑奇缘之御剑破天（买断版） 上线送20W代金券+1000钻石充值卡*100+1000元宝充值卡*100赠送海量道具：点券*200000+春秋*5+听羽*5+萌萌哒*5+萌星物语*5+紫虚龙君*5+逐日*5+金龙*5+龙之守护*5+龙腾盛世*5+未来战士*5+离子风暴*5+机甲头像*5+机甲气泡*5+黄金圣龙5+金天圣羽*5+小金龙*5+龙吟定天*5+破魔*5+皇图霸业*5+龙的传人*5+蚀天*5+八荒游龙*5+银龙圣翼*5+玄晶女君*5+御龙明珠*5+青霄*5+云烟细棉*5+戮力同舟*5+绿云清芳兰*5+碧艾木灵*5+轻枝阿紫鸣*5+沉魄*5+屈艳班香*5+风雨端阳*5+万花之主碎片*200+碧瑶仙女碎片*200+青玉幻兽*200+星域紫鳞*200+圣绝*200+死神碎片*200+将星天雷碎片*200+共工碎片*200+装备寻宝券*50+战纹寻宝券*50+觉醒寻宝券*50+至尊神豪全能大力丸*50+仙品普攻增伤大力丸*50虚拟商品，发货后不退不换,2.0,广东,8,https://www.goofish.com/item?id=937286641071&categoryId=201409706
舞儿芭蕾 共38part打包发 01 芭蕾基本功软度前腿、后腿、竖叉02 芭蕾舞蹈基本功腿部控制训练＿舞儿芭蕾03 芭蕾舞蹈基本功足踝训练（脚背）04 芭蕾基本功膝关节辅助训练05 芭蕾基本功颈部肩部腰部06 芭蕾舞蹈基本功踢腿爆发力训练附音乐﹣舞儿芭蕾07 芭蕾基本功小跳中跳大跳打击技巧分解教学＿舞儿芭蕾08 芭蕾基本功软度小胯、横叉、旁腿＿舞儿芭蕾09 芭蕾基本功训练把杆动作32种分解教学＿舞儿芭蕾10 芭蕾基本功十种连接分解教学＿舞儿芭蕾11芭蕾舞蹈核心稳定性功能性训练＿舞儿芭蕾12 芭蕾舞蹈开绷直辅助训练|舞儿芭蕾13 芭蕾旋转技巧分解教学（9种旋转）＿舞儿芭蕾14 零基础芭蕾旋转技巧教学双脚转和平转＿舞儿芭蕾15 零基础芭蕾足尖入门（初级）＿舞芭蕾16 舞蹈解剖学教学分解视频＿舞儿芭蕾17 芭蕾独舞《蓝鸟》基础版＿舞儿芭蕾18 芭蕾舞考级一级教学方法﹣﹣北京舞蹈学院＿舞儿芭蕾19 芭蕾舞考级二级教学方法适用学生跟练和老师教学20 北京舞蹈学院芭蕾舞考级三级教学方法分解21 芭蕾引导启发课程22 芭蕾外开辅助功能训练23 芭蕾舞蹈表现力天鹅臂、天鹅颈、天鹅背24 芭蕾舞蹈热身25 舞儿芭蕾﹣芭蕾独舞《樱桃萝卜》分解教学16课时26 15分钟学芭蕾独舞《艾斯米拉达》第一版27 第二版：芭蕾《艾斯米拉达》28 15分钟学芭蕾独舞《唐吉可德》29 芭蕾独舞《巴黎的火焰》分解教学30 芭蕾独舞《仙女娃娃》分解教学31 15分钟学芭蕾独舞《睡美人》32 芭蕾独舞《帕基塔》分解教学33 舞儿芭蕾﹣芭蕾独舞《葛蓓莉亚》分解教学﹣芭蕾独舞葛蓓莉亚34 舞儿芭蕾﹣芭蕾舞蹈群舞冰雪奇缘1分解教学原创﹣冰雪奇缘1教学35 舞儿芭蕾﹣芭蕾群舞《冰雪奇缘2》﹣群舞冰雪奇缘236 芭蕾《西班牙女郎》徐嘉阳37 芭蕾群舞（天鹅湖）38 芭蕾群舞（ D 大调卡农）送【380首】芭蕾舞基础训练音乐芭蕾钢琴伴奏基训【芭蕾舞者必备】所有资料仅个人分享，知识产权归作者所有如有侵权请联系删除,1.0,北京,0,https://www.goofish.com/item?id=964157963510&categoryId=201459411
迪士尼动画电影大合集国语版，百度网盘发货，稀缺资源，所有迪士 尼动画电影都包含，全部都是超清级品质，直接拍不伤眼，可以自己看，也可以给孩子看，拍下后不退换货，看好下单   包含钟楼怪人，圆梦巨人，亚当斯一家，小鹿斑比，小飞侠，仙女奇缘，泰山系列s史努比，狮子王，忍者神龟，奇幻森林，木偶奇遇记，猫狗大战...,2.18,山东,0,https://www.goofish.com/item?id=955309821207&categoryId=126864806
绝版Paco帕高Elle仙女奇缘女香5ml 全新正品Q版小香水5ml edp，有盒无喷头，小样无塑封。   都是自己收集的各种可爱美貌的Q，全新正品未用过，如有用过会注明。出坑回血，基本每款就一个没有多余。3个Q包邮非偏远。勿刀！勿刀！勿刀！,58.0,北京,0,https://www.goofish.com/item?id=765420576416&categoryId=126860278
仙女日常奇缘 感兴趣的话点“我想要”和我私聊吧～,300.0,北京,3,https://www.goofish.com/item?id=771963456926&categoryId=201459411
1981年《仙女奇缘》（上下）原名：儿女英雄传。八十年代原版 老书收藏，品好见图，保真保老，可收藏研究，最低价28包邮出售，喜欢的可直接拍。,28.0,河南,1,https://www.goofish.com/item?id=660550968717&categoryId=126862192
民国连环画《仙女奇缘》 封面彩色，内页套色，很有质感，极具民国印刷品高级气质，内容也同样精彩，价格不贵，大众消费,180.0,山东,1,https://www.goofish.com/item?id=932698233898&categoryId=126862193
仙女奇缘二美梦成真 特别完整制作 9新 播放流畅不卡顿，版本自鉴，有喜欢的朋友可以拍，包邮。售出概不退换 凡选购本小店二个单品以上，第二个单品再优惠5元。,29.9,广东,0,https://www.goofish.com/item?id=721667031750&categoryId=126864808
10元一本 10本包邮 73:爱跳舞的孩子 5本 74:小仙女闪闪的魔法故事 4本 75:迪士尼公主永恒经典故事（拼音版）8本 76:冰雪奇缘 珍爱双语绘本 6本 77:深见春夫 想的美 & 睡得香 系列 6本 78:迪士尼公主系列  8本 79:小学...,10.0,山东,1,https://www.goofish.com/item?id=952147403843&categoryId=127832004
灵剑奇缘之御剑破天（买断版） 上线送20W代金券+1000钻石充值卡*100+1000元宝充值卡*100赠送海量道具：点券*200000+春秋*5+听羽*5+萌萌哒*5+萌星物语*5+紫虚龙君*5+逐日*5+金龙*5+龙之守护*5+龙腾盛世*5+未来战士*5+离子风暴*5+机甲头像*5+机甲气泡*5+黄金圣龙5+金天圣羽*5+小金龙*5+龙吟定天*5+破魔*5+皇图霸业*5+龙的传人*5+蚀天*5+八荒游龙*5+银龙圣翼*5+玄晶女君*5+御龙明珠*5+青霄*5+云烟细棉*5+戮力同舟*5+绿云清芳兰*5+碧艾木灵*5+轻枝阿紫鸣*5+沉魄*5+屈艳班香*5+风雨端阳*5+万花之主碎片*200+碧瑶仙女碎片*200+青玉幻兽*200+星域紫鳞*200+圣绝*200+死神碎片*200+将星天雷碎片*200+共工碎片*200+装备寻宝券*50+战纹寻宝券*50+觉醒寻宝券*50+至尊神豪全能大力丸*50+仙品普攻增伤大力丸*50虚拟商品，发货后不退不换,2.0,广东,21,https://www.goofish.com/item?id=934189790638&categoryId=200928013
DVD电影《仙女奇缘之爱丽丝梦游仙境》 碟片非全新，闲置在家低价处理给有需要的有缘人，碟面保护的非常好，有轻微的划痕小花及使用痕迹，播放时偶尔出现卡顿或无法播放都不在退保范围内（所有碟片售出后不可以任何理由退或换货，介意勿拍 ，介意勿扰 ），需各位朋友看好再下单，谢谢。 售价:...,28.0,广东,0,https://www.goofish.com/item?id=809839131287&categoryId=126864806
32号大隐藏 瑜瑜驯养手册收藏集 大隐藏轻喃试探tag：40原黄豆粉收藏集 付喃喃收藏集 魔法天使小陌降临收藏集 小丸Official猫猫集 真红爱莉收藏集 池咲的美少女收藏集 丝塔莉繁星缀梦收藏集 云朵捕捉计划收藏集 灵笼收藏集 早椰恋恋收藏集 夕时神约收藏集 兰音的衣柜奇缘收藏集 2233元素协奏收藏集 妹妹养成手册收藏集 菠萝赛东收藏集 有棵里里收藏集 狸酱lino收藏集 墨清弦七周年收藏集 传奇仙女龙dd收藏集 李滇滇个人收藏集 北田龙马收藏集 是幼情呀收藏集 伊莎蓓尔精灵物语收藏集 为热爱干杯收藏集 别当欧尼酱了收藏集 Ave Mujica收藏集 局长的教育手册收藏集 秋绘收藏集 小紫才没有摸鱼收藏集 闪耀日记收藏集 洛天依收藏集 凉哈皮收藏集 以爱生花青鸟集 2025嘉然的画册收藏集 魔卡少女樱收藏集 五维介质收藏集 余多多收藏集 少女乐队的呐喊收藏集 幻塔收藏集 醒醒加班收藏集 乐正绫收藏集 rurudo箱庭少女之梦收藏集 深空之眼三周年收藏集 噗噗夏露露收藏集 战舰少女R收藏集 五更百鬼收藏集 知薇入梦收藏集 2233少女日记收藏集 绘之音收藏集 初音未来征稿集 东方收藏集 浮生若梦 普通小狗收藏集 幻星乐园收藏集 坂坂白收藏集 阿梓从小就很可爱收藏集 尤菲黎娅的人间之旅收藏集 蔚蓝档案2025收藏集 米塔收藏集 纸嫁衣收藏集 织月黛黛收藏集 奈姬收藏集 黎歌收藏集 冥冥收藏集 紫罗兰永恒花园收藏集 鬼刀收藏集 饿殍明末千里行收藏集 MyGO收藏集 明日方舟收藏集 2024拜年纪收藏集 初音未来收藏集 来岁昭昭 时间未来 花季庆生洛天依收藏集 蝶变 吟游四方 无限共鸣 大哉乾元 向往光明 陆鳐收藏集 主播女孩重度依赖收藏集 希丝奈收藏集 尘白禁区收藏集 折原露露收藏集 星瞳收藏集 永雏塔菲美女集 真白花音收藏集 泠鸢收藏集 大D特D收藏集 黎歌收藏集 可爱小猪Asaki收藏集 咩栗呜米收藏集 小猫女仆降临收藏集 有兽焉收藏集 黑泽诺亚收藏集 安晴收藏集 纸上的魔法使收藏集 小狗蛇点点收藏集 Ro姬收藏集 人格解体收藏集 鹿乃收藏集 装扮小姐姐收藏集 小铃久绘收藏集 鲸鱼娘收藏集 雪糕收藏集 浅川玉乃收藏集#bilibili #bilibili,104.0,山西,2,https://www.goofish.com/item?id=966962236485&categoryId=126860296
冰雪魔法奇缘公主发声玩具仙女爱莎魔仙发光生日礼物圣诞节万圣节 颜色随机发了，介意勿拍！白菜价不议价！包邮，亏本出啦！,13.5,天津,25,https://www.goofish.com/item?id=959478250335&categoryId=126862788
八个99包邮仙女魔法棒玩具女孩子发光激光剑巴啦公主小魔仙女童 啦拉爱莎儿童 一个15整套八个打包99，六一儿童节礼品奖品，女孩礼物铭乐欣魔法奇缘8882品牌有标签实体店版本 标价就是卖价不议价不退换商场撤柜清仓处理所有产品全新未拆封未使用，找毛病的绕行，卖的是玩具不是工艺品,15.0,上海,39,https://www.goofish.com/item?id=924389378503&categoryId=126862783
手帐神器 迪士尼公主系列灰姑娘中性笔，20 支装，笔身印有可 爱公主图案，笔头颜色鲜艳。笔芯都能正常使用，适合学生做笔记、手帐、绘画、设计 笔头顺滑，书写流畅。喜欢的小伙伴可以私聊，同城自提，异地满32包邮！灰姑娘出自迪士尼经典动画电影《灰姑娘》 ，影片讲述了灰姑娘辛德瑞拉在仙女教母的帮助下，参加王子的舞会并最终收获爱情的故事。,12.0,江西,0,https://www.goofish.com/item?id=923820379086&categoryId=126864001
迪士尼冰雪奇缘限定款三层首饰收纳礼盒，超多精美配饰！雪花造型 装饰，带施华洛世奇水晶，可以DIY组合各种发饰、项链。全新未拆封，送礼自用都很棒。礼盒包装完整，带艾莎和雪宝图案，蓝色系超少女心。喜欢的小仙女赶紧下单吧～,135.0,山东,15,https://www.goofish.com/item?id=953093418707&categoryId=126862788
爱莎魔法棒仙女棒发光音乐艾莎公主冰雪奇缘皇冠女孩儿童玩具套装 艾莎仙女棒五件套：魔法棒、皇冠、一对耳环、戒指  超美超好看，质量特别好，收到货破损包赔！  24～48小时发货！关注我优先发货！  感兴趣的话点“我想要”和我私聊吧～,25.9,广东,56,https://www.goofish.com/item?id=674008931162&categoryId=126862783
灰姑娘 仙女教母 仙履奇缘仙女教母 cos 神仙教母 cos 出 z，衣服质量很棒，去迪士尼被夸了一路，演职人员给了万圣趴的贴纸还有好多糖。 万圣节期间 顺丰到付 裙子是松紧深陷 170 斤以下可以，尺码比较大，90 斤以下的可能有点宽松 四件套（包括裙撑），6  0元一天，7  ...,60.0,安徽,37,https://www.goofish.com/item?id=743382153689&categoryId=126860285
梦幻奇缘真丝渐变钉珠印花桑蚕丝裙2020夏季气质仙女连衣裙潮 短裙 颜色分类: 如影、尺码: 2 胸围：86厘米 肩宽：37厘米 腰围：76厘米 臀围：86厘米 裙长：87厘米,25.0,北京,0,https://www.goofish.com/item?id=945641462182&categoryId=126860581
116号大隐藏 夕时神约收藏集 大隐藏旖旎欲梦tag：40原黄豆粉收藏集 付喃喃收藏集 魔法天使小陌降临收藏集 小丸Official猫猫集 真红爱莉收藏集 池咲的美少女收藏集 丝塔莉繁星缀梦收藏集 云朵捕捉计划收藏集 灵笼收藏集 早椰恋恋收藏集 夕时神约收藏集 兰音的衣柜奇缘收藏集 2233元素协奏收藏集 妹妹养成手册收藏集 菠萝赛东收藏集 有棵里里收藏集 狸酱lino收藏集 墨清弦七周年收藏集 传奇仙女龙dd收藏集 李滇滇个人收藏集 北田龙马收藏集 是幼情呀收藏集 伊莎蓓尔精灵物语收藏集 为热爱干杯收藏集 别当欧尼酱了收藏集 Ave Mujica收藏集 局长的教育手册收藏集 秋绘收藏集 小紫才没有摸鱼收藏集 闪耀日记收藏集 洛天依收藏集 凉哈皮收藏集 以爱生花青鸟集 2025嘉然的画册收藏集 魔卡少女樱收藏集 五维介质收藏集 余多多收藏集 少女乐队的呐喊收藏集 幻塔收藏集 醒醒加班收藏集 乐正绫收藏集 rurudo箱庭少女之梦收藏集 深空之眼三周年收藏集 噗噗夏露露收藏集 战舰少女R收藏集 五更百鬼收藏集 知薇入梦收藏集 2233少女日记收藏集 绘之音收藏集 初音未来征稿集 东方收藏集 浮生若梦 普通小狗收藏集 幻星乐园收藏集 坂坂白收藏集 阿梓从小就很可爱收藏集 尤菲黎娅的人间之旅收藏集 蔚蓝档案2025收藏集 米塔收藏集 纸嫁衣收藏集 织月黛黛收藏集 奈姬收藏集 黎歌收藏集 冥冥收藏集 紫罗兰永恒花园收藏集 鬼刀收藏集 饿殍明末千里行收藏集 MyGO收藏集 明日方舟收藏集 2024拜年纪收藏集 初音未来收藏集 来岁昭昭 时间未来 花季庆生洛天依收藏集 蝶变 吟游四方 无限共鸣 大哉乾元 向往光明 陆鳐收藏集 主播女孩重度依赖收藏集 希丝奈收藏集 尘白禁区收藏集 折原露露收藏集 星瞳收藏集 永雏塔菲美女集 真白花音收藏集 泠鸢收藏集 大D特D收藏集 黎歌收藏集 可爱小猪Asaki收藏集 咩栗呜米收藏集 小猫女仆降临收藏集 有兽焉收藏集 黑泽诺亚收藏集 安晴收藏集 纸上的魔法使收藏集 小狗蛇点点收藏集 Ro姬收藏集 人格解体收藏集 鹿乃收藏集 装扮小姐姐收藏集 小铃久绘收藏集 鲸鱼娘收藏集 雪糕收藏集 浅川玉乃收藏集#bilibili #bilibili,66.0,山西,1,https://www.goofish.com/item?id=966732581396&categoryId=126860296
舞儿芭蕾 共38part打包发 01 芭蕾基本功软度前腿、后腿、竖叉02 芭蕾舞蹈基本功腿部控制训练＿舞儿芭蕾03 芭蕾舞蹈基本功足踝训练（脚背）04 芭蕾基本功膝关节辅助训练05 芭蕾基本功颈部肩部腰部06 芭蕾舞蹈基本功踢腿爆发力训练附音乐﹣舞儿芭蕾07 芭蕾基本功小跳中跳大跳打击技巧分解教学＿舞儿芭蕾08 芭蕾基本功软度小胯、横叉、旁腿＿舞儿芭蕾09 芭蕾基本功训练把杆动作32种分解教学＿舞儿芭蕾10 芭蕾基本功十种连接分解教学＿舞儿芭蕾11芭蕾舞蹈核心稳定性功能性训练＿舞儿芭蕾12 芭蕾舞蹈开绷直辅助训练|舞儿芭蕾13 芭蕾旋转技巧分解教学（9种旋转）＿舞儿芭蕾14 零基础芭蕾旋转技巧教学双脚转和平转＿舞儿芭蕾15 零基础芭蕾足尖入门（初级）＿舞芭蕾16 舞蹈解剖学教学分解视频＿舞儿芭蕾17 芭蕾独舞《蓝鸟》基础版＿舞儿芭蕾18 芭蕾舞考级一级教学方法﹣﹣北京舞蹈学院＿舞儿芭蕾19 芭蕾舞考级二级教学方法适用学生跟练和老师教学20 北京舞蹈学院芭蕾舞考级三级教学方法分解21 芭蕾引导启发课程22 芭蕾外开辅助功能训练23 芭蕾舞蹈表现力天鹅臂、天鹅颈、天鹅背24 芭蕾舞蹈热身25 舞儿芭蕾﹣芭蕾独舞《樱桃萝卜》分解教学16课时26 15分钟学芭蕾独舞《艾斯米拉达》第一版27 第二版：芭蕾《艾斯米拉达》28 15分钟学芭蕾独舞《唐吉可德》29 芭蕾独舞《巴黎的火焰》分解教学30 芭蕾独舞《仙女娃娃》分解教学31 15分钟学芭蕾独舞《睡美人》32 芭蕾独舞《帕基塔》分解教学33 舞儿芭蕾﹣芭蕾独舞《葛蓓莉亚》分解教学﹣芭蕾独舞葛蓓莉亚34 舞儿芭蕾﹣芭蕾舞蹈群舞冰雪奇缘1分解教学原创﹣冰雪奇缘1教学35 舞儿芭蕾﹣芭蕾群舞《冰雪奇缘2》﹣群舞冰雪奇缘236 芭蕾《西班牙女郎》徐嘉阳37 芭蕾群舞（天鹅湖）38 芭蕾群舞（ D 大调卡农）送【380首】芭蕾舞基础训练音乐芭蕾钢琴伴奏基训【芭蕾舞者必备】另外免费送：1、欧阳春晓5套（直角肩少女背、体态矫正、减脂、普拉提等）2、雪君爵士舞零基础到进阶最新410节所有资料仅个人分享，知识产权归作者所有如有侵权请联系删除,9.99,湖南,0,https://www.goofish.com/item?id=844395823768&categoryId=201459411
迪士尼爱莎公主魔法棒仙女棒冰雪奇缘艾莎女孩儿童发光音乐玩具 感兴趣的话点“我想要”和我私聊吧～,40.0,福建,35,https://www.goofish.com/item?id=822102503689&categoryId=126862783
儿童玩具： 抽拉式水枪，长50厘米左右，10元。 冰雪奇缘泡泡机，10元。 仙女魔法棒泡泡机，10元。 小鸭照相机泡泡机，10元， 一起要可以包邮。 感兴趣的话点“我想要”和我私聊吧～,10.0,上海,0,https://www.goofish.com/item?id=849948452834&categoryId=201459411
电话收藏卡-仙女奇缘拼图卡1套12张 感兴趣的话点“我想要”和我私聊吧～,22.0,广东,0,https://www.goofish.com/item?id=784189942627&categoryId=126862252
儿童冰雪魔法棒发光棒奇缘公主雪花棒玩具艾莎仙女棒女孩 是在剧场演出买的有三档变色 ，现便宜处理,20.0,江苏,35,https://www.goofish.com/item?id=897138345035&categoryId=126862783
连体泳衣，黑色保守遮肚款，M码适合90-100斤妹子穿，平角 设计显瘦又舒适。前拉链设计方便穿脱，面料是高级感的菱形纹理，适合温泉游泳馆穿着。,20.0,福建,0,https://www.goofish.com/item?id=959643713545&categoryId=126866531
rosepeach加颗桃「Elsa」原创小众欧若拉法式少女蕾 丝网纱仙女叠戴项链 全新的 饰品一件不包邮 两件包邮,27.9,山东,0,https://www.goofish.com/item?id=953151479784&categoryId=126862549
天剑奇缘  内部号 折扣号 爱仙 九歌行 心剑奇缘 通神 逆 天级 蜀剑苍穹 仙女放开我 先点我想要，拍单后联系商家下载游戏，玩家自行注册账号，游戏方授权开通内部折扣号，游戏里每笔充值都可以使用折扣打折，只需付折后价，内部折扣永久有效，可以一直使用！  1、自助折扣，是指在游戏内直接打折，无需充值代金...,1.88,北京,188,https://www.goofish.com/item?id=908009389633&categoryId=201409706
陈松龄天涯歌女，月儿弯弯照九洲，仙女奇缘，我爱上英雄梦境成真 ，爱到一仟年，磁带专辑全新未拆，（收藏品相）一套走，不单出 感兴趣的话点“我想要”和我私聊吧～,1080.0,广东,0,https://www.goofish.com/item?id=771608936092&categoryId=126862149
爱莎公主儿童水晶高跟拖鞋，银色钻片装饰，带水晶花朵点缀，超级 闪亮。 29码内长18cm，适合夏季穿着，轻微穿着痕迹。韩版时尚款，半拖设计，外穿舒适。 喜欢的小仙女赶紧下手，价格可聊～,20.0,江苏,0,https://www.goofish.com/item?id=960035460421&categoryId=126912150
新款半脸公主儿童古风面具化妆舞会舞台表演道具男女孩玩具批发 9.99元包邮全新 小孩成人都可以,9.99,浙江,12,https://www.goofish.com/item?id=666088833243&categoryId=126918142
马克斯周末爱莎公主裙，110码全新，带披肩可拆卸，超仙的蓬蓬 纱裙。裙子是亮片上身配网纱裙摆，后背露背设计，搭配同款珍珠项链更美。洗过一次就没穿过，适合生日派对或者拍照，喜欢的小仙女赶紧下手。 拍下不退不换，非偏远包邮,80.0,河南,1,https://www.goofish.com/item?id=933024490351&categoryId=126862710
魔法奇缘仙女棒29 感兴趣的话点“我想要”和我私聊吧～,23.0,辽宁,0,https://www.goofish.com/item?id=836799005126&categoryId=126862783
儿童冰雪魔法棒发光棒奇缘公主雪花棒玩具艾莎仙女棒女孩 装电池有音乐，有三档发光色彩，可以搭配爱莎蓝色公主服，很漂亮。  之前观看《冰雪奇缘》剧场购买的，现在闲置便宜专卖。,15.0,福建,20,https://www.goofish.com/item?id=819965929768&categoryId=126862783
[hot]全新【清仓出】女童连衣裙爱莎春秋洋气公主裙小女孩冰 雪奇缘儿童夏季艾莎仙女裙 店铺清仓特价，面料柔软舒适，不易起球不掉色！ 【颜色】蓝色 粉色 【尺码】90码～140码 （可按身高拍大一码） 全新包邮，喜欢直接拍哦[托腮],29.9,广东,13,https://www.goofish.com/item?id=709442714767&categoryId=126916033
正款迪士尼书包+全新的艾莎铅笔盒一套 带标签喜欢的小仙女赶紧下单，价格可小刀，同城自提，异地可发顺丰。,30.0,河北,0,https://www.goofish.com/item?id=949536865812&categoryId=126862779
爱莎公主裙 女童高端表演长裙 蝴蝶翅膀套装 蓝色网纱裙+透明蝴蝶翅膀适合小女孩表演、拍照、生日派对穿着翅膀可拆卸，搭配裙子效果超美裙子胸前一点黄，带纱看得不是很明显。,48.44,辽宁,0,https://www.goofish.com/item?id=965361614699&categoryId=126862725
巴黎迪士尼公主马克杯，小美人鱼杯子，海洋奇缘杯子，奇妙仙女小 仙女杯子。全新正品，图案可爱，适合收藏或日常使用。包邮，物流周期大约一个月。#Disney/迪士尼 全新，正品园区代购  有需要的朋友可以联系我哦，闲置出清，先到先得！,200.0,上海,0,https://www.goofish.com/item?id=866113613426&categoryId=126854539
2025新款爱莎公主裙，蓝色网纱蓬蓬裙，适合夏天穿。裙子是高 端定制款，内衬纯棉，外层是闪闪发亮的网纱，穿上特别仙气。适合表演、生日会穿，做工精致，面料轻盈。喜欢的小仙女赶紧下手，价格可以聊，同城自提更优惠~,60.0,陕西,0,https://www.goofish.com/item?id=951108664568&categoryId=126916033
Colleedoll歌莉儿美人鱼公主娃娃，多关节活动海洋系列 ，带皇冠和蝴蝶翅膀装饰，绿色长发配银色鱼尾裙，做工精致，适合收藏和换装。九五新，喜欢的小仙女可以私聊。同城自提，外地包邮。,10.0,海南,0,https://www.goofish.com/item?id=944256148016&categoryId=126860283
迪士尼正版艾莎五层抽屉首饰礼盒，型号6131，超多精美配饰随 心搭配～  内含串珠项链、手链、戒指、发饰等多种款式，蓝色系宝石配色，带艾莎和雪宝图案。送精美礼品袋，适合送礼自用！  全新未拆封，包装完整，送礼体面大方。喜欢的小仙女赶紧下单，价格可聊～,182.0,广东,0,https://www.goofish.com/item?id=946294473042&categoryId=126914029
女童仙女裙，冰雪奇缘，适合4-5岁。两件包邮 感兴趣的话点“我想要”和我私聊吧～,12.0,浙江,299,https://www.goofish.com/item?id=949068564899&categoryId=126916033
爱莎公主裙女童高端表演长裙，130码，带蝴蝶翅膀套装，蓝色网 纱裙摆，搭配蓝色蝴蝶翅膀，超级梦幻！适合生日派对、舞台表演、拍照用，效果超赞～ 裙子是蓝色网纱面料，搭配蓝色蝴蝶翅膀，整体效果很漂亮，适合120-130cm的小朋友穿。,48.0,广东,0,https://www.goofish.com/item?id=956458265886&categoryId=126862725
冰雪魔法奇缘公主发声玩具仙女爱莎魔仙发光生日礼物圣诞节万圣节 随机发颜色,13.8,广东,0,https://www.goofish.com/item?id=945028515621&categoryId=126862783
万代眼镜厂Qposket仙女白裙艾莎手办迪士尼冰雪奇缘els a玩具摆件 ================= 购买注意事项，请完整阅读 点点关注，老粉购买一般随单会有送小礼品 ①默认普通快递包邮，不包运损，怕压加钱发顺丰 ②到货建议均录制开箱视频，从完整运单号开始录制，无视频不售后 ③日版，代理，祖国...,115.0,四川,1,https://www.goofish.com/item?id=953175102381&categoryId=126860378
海洋奇缘2莫阿娜连衣裙，红色斜肩款，带白色流苏装饰，贝壳点缀 ，全新。150码，裙子是白色和红色拼接设计，上半部分白色配金色装饰，下半部分红色带有波利尼西亚传统花纹。适合表演和拍照，喜欢的小仙女赶紧下单吧～同城自提，异地包邮。,30.0,山东,0,https://www.goofish.com/item?id=932955304253&categoryId=126916033
