标题,价格(元),所在地,想要人数,商品URL
前十 洛天依收藏集 11号普卡5元一张卡片编号可用于动态卡片，空间头图，评论卡片展示哔哩哔哩 个性装扮 一号tag:生日号编号 倾海之约 原神  芙宁娜 走路摇zly 涤心独舞 玉之けだま_毛玉收藏集 旅行日记 旅途风花 前十 1号 毛玉牛乳 小小魅魔收藏集 随性躺卧露露姆嬉水露露姆夏日休憩 一起泡温泉 斯黛拉好热 小才不是夸人用的 玉之けだま_Official ro姬收藏集 黎歌收藏集 典藏卡 幻星乐园收藏集 洛天依收藏集，哔哩哔哩收藏集 千璃Chili收藏集 耀月收藏集岁末欢聚 小丸official收藏集 猫大人收藏集 劉了了收藏集 归汉收藏集 嗨嗨多吃点收藏集 扇宝收藏集 画猫收藏集 中国绊爱 2233群星闪耀时摩羯座 江明月收藏集 斋藤直葵收藏集 三丽鸥收藏集 夕兔收藏集 鸽一品天才集 百变狐狐收藏集 皮卡少个丘收藏集 秋绘收藏集 夏露露Ruru收藏集 星河Sagi收藏集 全力幻想少年收藏集  画师D收藏集 真白花音收藏集 库莉姆奶油集 抖个姬灵收藏集 柯南收藏集 杠杠收藏集 鲸鱼娘西丝特收藏集无限实验室收藏集 画猫收藏集 醒爷收藏集 扇宝收藏集 T5-茨舞收藏集 鬼刀系列收藏集 萨克万收藏集 嗷金宝收藏集 洛天依收藏集 是姬拉kira收藏集 熙往收藏集 白金宝贝收藏集 Jency&pink收藏集 胶囊计划收藏集sonny brisko收藏集 铃音收藏集 夏诺雅收藏集 A-soul收藏集 薄荷miint收藏集 地下城堡收藏集 花想云裳收藏集 kieed收藏集 熙往收藏集爱上她的理由收藏集 阿里鸭Alya收藏集 画猫.历史宝藏收藏集  艾恺特AKT收藏集双生境 百目境  玄冥境 2233群星闪耀时·双子座  巨蟹座  大D特D收藏集  装扮小姐姐中华锦绣 幻星集 收藏集 世界&星星 愚者魔法师 节制&隐士 真白花音收藏集 轻纱花语 铃芽之旅收藏集 梦音茶糯收藏集 烟雾旗袍 纱耶收藏集 梦游仙境  2233奇书异闻录 女娲补天  永雏塔菲美女收藏集  洛天依收藏集 钟与花的窗棂收藏集 桃宫七七收藏集 初音未来收藏集 主播女孩超天酱收藏集 八木百货社长收藏集 鲸鱼娘收藏集 果宝收藏集 春池醉梦花花haya收藏集 纱依收藏集 千璃Chili收藏集 真百花音收藏集 可洛收藏集 是幼情呀收藏集 安晴Ankil生活集小隐藏大隐藏前十1号coser cosplay 一颗小兔娘收藏集 真白花音收藏集 大D特D收藏集 普通小狗收藏集 2233群星闪耀时收藏集 永雏塔菲美女集 耀月集 洛天依收藏集 早凉收藏集 安可星瞳扇宝收藏集 冥冥收藏集 小铃久绘收藏集 初音未来收藏集 泠鸢yousa收藏集 四禧丸子收藏集 秋绘璀璨星辰收藏集 ASOUL绽放收藏集 早稻叽月下舞会收藏集 醒醒加班收藏集 织月黛黛收藏集 朝华缘拾收藏集 RO姬偶像收藏集 斋藤直葵收藏集 中国绊爱收藏集 纱依收藏集 黎歌收藏集 猫雷收藏集 鬼刀收藏集 Vsinger收藏集 绘之音收藏集 安晴生活集 大D特D第二弹 旅行日记收藏集 主播女孩重度依赖收藏集 春池醉梦花花Haya收藏集 咩栗呜米收藏集 可爱小猪Asaki收藏集 Hiiro收藏集春晖庆典 乐正绫九周年纪念收藏集 浅川玉乃收藏集 兰音的衣柜奇缘收藏集 折原露露收藏集 幻夏恋歌收藏集 hololive0期生收藏集 星空列车与白的旅行收藏集 雪狐桑倾心慕风收藏集 雪绘Yukie收藏集 米虫尼奈收藏集 洛天依再生收藏集 陆鳐lulu收藏集 宇宙无敌美少女雫lulu收藏集 兔眠可可夏色恋忆收藏集 洛天依心律共鸣收藏集 MyGO收藏集 东雪莲收藏集 希丝奈cisne收藏集 希月萌奈收藏集 幻星乐园收藏集 毛玉收藏集 hololive ID收藏集 奈姬niki收藏集 Neuro-sama收藏集 少女乐队的呐喊收藏集 东方收藏集浮生若梦 哔哩哔哩收藏集 全图鉴出框头像 纸嫁衣收藏集，甜夕sweet收藏集，雪狐桑收藏集，一点荧惑收藏集，卡拉彼丘收藏集，兰音的衣柜收藏集，量子猫收藏集，小铃久绘收藏集，陆鳐LuLu收藏集，兔眠可可收藏集，秋蒂夏日无际收藏集，然若星辰收藏集，尘白禁区收藏集，2233幻境序曲收藏集，切茜娅收藏集，唐九夏收藏集，雪域收藏集，东雪莲收藏集，明日方舟收藏集，Mygo收藏集，饿殍收藏集，泠鸢收藏集，洛天依收藏集，薇桃杠蔻伟情缘收藏集，瑞娅Rhea收藏集，花与梦收藏集，魔女与神兵收藏集，希丝奈cisne收藏集，白蛇浮生收藏集，Ro姬偶像收藏集，希月萌奈收藏集，阳阳不想熬夜收藏集，初音未来收藏集，随一Suiii收藏集，鬼刀收藏集，主播女孩重度依赖收藏集，绫光濑收藏集 朗星集 耀光集 皓月集 真白花音收藏集 大D特D收藏集 第二弹 普通小狗收藏集 2233群星闪耀时收藏集 永雏塔菲美女集 某科学的超电磁炮T收藏集 耀月集 洛天依收藏集 早凉收藏集 安可星瞳扇宝收藏集 爱上她的理由动画收藏集 冥冥收藏集 小铃久绘收藏集 穆小冷收藏集 初音未来收藏集 岱川收藏集 泠鸢收藏集 钉宫妮妮收藏集 鎏金之夜收藏集 星月夜收藏集 雪域收藏集 天官赐福动画收藏集 2233异世集 P＋收藏集艾尔莎收藏集 知薇入梦收藏集 psplive山珍收藏集 万圣学院收藏集 雪狐桑收藏集 幻夜魔法收藏集 KK輝気收藏集 奈奈莉娅收藏集 美月收藏集 银杏星川铃阿绿收藏集 露早GOGO收藏集 梅兰芳万象承华收藏集 Minicatty收藏集 兰音Reine收藏集 星瞳梦幻童话收藏集 四禧丸子收藏集 白粥nina收藏集 Twinkle.Star收藏集 psplive海味收藏集 Akie秋绘璀璨星辰收藏集 Kieed收藏集 花丸晴琉收藏集 铃音收藏集 夏诺雅收藏集 A-SOUL绽放收藏集 早稻叽月下舞会收藏集 醒醒加班收藏集 杠杠收藏集 织月黛黛收藏集 朝华缘拾收藏集 RO姬偶像收藏集 星河Sagi收藏集 夏露露Ruru收藏集 鸽一品天才集 斋藤直葵收藏集 中国绊爱收藏集 可洛Cro收藏集 幻境之夜纱依收藏集 米诺高分少女收藏集 次元异梦咲间妮娜收藏集  装扮小姐姐生日庆典 树礼suki收藏集 黎歌Neeko收藏集 猫雷NyaRu收藏集 公主茶话会iStella收藏集 初音未来单人收藏集 岁末欢聚 岁末夜宴 胡桃 旅行日记 原神 奥特曼收藏集 百妖谱收藏集 可爱小猪Asaki收藏集 Vox Akuma收藏集 功夫熊猫收藏集 机动战士高达收藏集 鬼刀收藏集 防道少女团收藏集 咩栗呜米收藏集 四季的少女收藏集 花花haya收藏集 纸迷金醉  兔眠可可收藏集 萝莉一凡个人收藏集  Hirro收藏集春晖庆典 宇宙无敌超级美少女雫lulu收藏集 折原露露收藏集 陆鳐lulu收藏集 饿殍·明末千里行收藏集 MyGO!!!!!收藏集 东雪莲收藏集 明日方舟收藏集 唐九夏-伴你一夏收藏集 尘白禁区收藏集与繁星共舞 库莉姆Cream《约会日》，奈奈莉娅《圣娅喵喵叫》，Skrillex《OC系列》，五更妖音《永不毕业》，小铃久绘Official《绘想童话》，话梅糖_Mei《玻璃纸季节》，文宝Eleven_《星轨交映》，氵六青《香草青青》，桃几OvO《家有萌猫》，Venus Vacation PRISM收藏集，早稻叽《云朵捕获计划》甜梦收容，丝塔莉《繁星缀梦》，i御十二《恋语花誓》，北久Kyuu的绮梦《心跳梦境》，甜夕sweet《夕时神约》，狸酱lino《喵狸个咪》，传奇仙女龙dd《有龙则灵》，白桃味の蛋挞《爱我还是挞》，酸柚粥sayo《妹妹养成手册》，是幼情呀《睡眠采耳店》，伊莎蓓尔Isabel《精灵物语》，冥冥meichan《爱执欲意》，Mygo!!!!!收藏集，rurudo_るるどらいおん《箱庭少女之梦》，黎歌Neeko《幻夏恋歌》，VirtuaReal《想去海边》偶像大师收藏集 BanG Dream收藏集 RAS收藏集 瑜瑜驯养手册收藏集 洛天依·珍藏集 VirtuaReal皓月集，VirtuaReal朗星集，VirtuaReal耀光集，普通小狗·梦幻塔罗收藏集，2233·奇书异闻录，纱耶sayako收藏集，小只芋收藏集，圣斗士星矢收藏集，bml10周年收藏集，时光代理人收藏集，赘婿动画收藏集，暹罗厘普收藏集，有兽焉动画收藏集，永生动画收藏集，保卫萝卜收藏集，2233群星闪耀时·双子座，巨蟹座收藏集，大D特D收藏集，DM袋猫收藏集，装扮小姐姐中华锦绣，幻星集收藏集，ksr与他的伙伴萌收藏集，真白花音收藏集，风灵玉秀动画收藏集，铃芽之旅收藏集，狮子座收藏集，BLG信念干杯收藏集，梦音茶糯收藏集，艾恺特AKT收藏集，雾山五行收藏集，镇魂街收藏集，菌子宝宝收藏集，百变菌宝收藏集，莓可收藏集，真里子收藏集，永雏塔菲美女集，晓丹收藏集，小黄人收藏集，蜘蛛侠：纵横宇宙收藏集，江壹纯收藏集，某科学的超电磁炮T收藏集，VirtuaReal耀月集，幻星集-命运的选择，阿萨Aza收藏集，早凉收藏集，洛天依收藏集，植物大战僵尸2收藏集，安可星瞳扇宝收藏集，爱上她的理由动画收藏集，2233·群星闪耀时-处女座，泰蕾莎收藏集，司稽人间幽灵收藏集，卡拉彼丘收藏集，红蓝巴萨，Krenz光影少女收藏集，斗破苍穹收藏集，波喵喵喵收藏集，阿里鸭收藏集 海天盛筵·夏日集 思小柒UMI收藏集 2233·宅舞嘉年华2025 居居boom 尘白禁区收藏集 流光协奏 八音奇响 莎布Shub欲望时刻收藏集,5.0,吉林,0,https://www.goofish.com/item?id=955083400892&categoryId=126860375
【全新现货】炫丽星星水晶流星锤施同款汽车后视镜吊坠 新款炫彩 色星星雪花挂件  非冰雪奇缘雪花 小仙女包包挂件 送自己送女友女同学女士生日礼物节日情人节奥运礼物   品名:炫丽星星流星锤  ～炫彩色   直径约6cm     赠送:水晶链+丝带    非偏包邮，签收24小时内凭图售后，质量问题包邮退换...,65.0,浙江,0,https://www.goofish.com/item?id=660020555512&categoryId=126860909
130cm全新艾莎公主裙，130码，适合夏季穿着。上身白色雪 纺面料配蓝色网纱，胸前雪花刺绣点缀，泡泡袖设计超仙气。裙摆多层网纱蓬松，内里棉质舒适。短裙款式，搭配皇冠更显公主范。喜欢的小仙女赶紧私聊，价格可聊~,37.0,河南,0,https://www.goofish.com/item?id=933117114969&categoryId=126916033
爱莎公主斗篷，蓝色雪花图案，带毛边设计。几乎全新，只穿过一次 。斗篷上有漂亮的雪花印花，白色毛边很仙，中间是丝绒面料，外面是网纱。搭配裙子或者外套都很好看，适合秋冬季节穿。喜欢的小仙女赶紧私聊我吧～,48.0,上海,2,https://www.goofish.com/item?id=959058732147&categoryId=126862718
110码爱莎公主蓝色连衣裙，超仙的多层纱裙设计，上身点缀闪亮 亮的亮片，裙摆有爱心刺绣花纹，泡泡袖很公主。裙子内衬全棉，穿着舒服不扎皮，适合夏天穿。喜欢的小仙女赶紧私聊我吧 不议价,29.0,湖北,0,https://www.goofish.com/item?id=932720457419&categoryId=126916033
冰雪奇缘爱莎公主裙，蓝色款，带全套配件。适合150cm左右的 小女孩穿，送披纱和精美赠品。裙子是蓬蓬纱的，穿上特别好看。配套有辫子、手套、项链、头链、斗篷，都是蓝色系的，搭配起来很完整。喜欢的小仙女可以私聊我看看，价格可以聊~作为    生日礼物      孩子就试穿了一次，,69.0,浙江,0,https://www.goofish.com/item?id=942014099245&categoryId=126862725
原创冰雪奇缘爱莎公主皇冠仙女棒套装艾莎发饰发箍儿… 感兴趣的话点“我想要”和我私聊吧～,30.0,江苏,0,https://www.goofish.com/item?id=948251544831&categoryId=126916091
闲置迪士尼公主仙女棒魔法棒 冰雪奇缘公主发光权杖 新旧看图  不包邮，不包邮！ 和其他闲置一起买，满50元江浙沪包邮  售后不退不换,10.0,上海,46,https://www.goofish.com/item?id=775456262650&categoryId=126862783
colorpop专场  可小刀 truly  madly  deeply  配色甜妹风 仙女盘 60 冰雪奇缘Elsa眼影盘出了蓝色其他均日常 仅试2色 如图 55 日落盘 用的比较多 绝美的眼影盘啊懂货的来50 最后就是闪片啦 他家巨美的单色眼影 15,15.0,河南,118,https://www.goofish.com/item?id=689867128119&categoryId=126860280
s925通体银项链冰雪女王珍珠耳钉套装， 项链配珍珠吊坠气质高级感，适合日常佩戴喜欢的小仙女欢迎私聊～偏远地区➕5元运费，不议价,76.0,江苏,0,https://www.goofish.com/item?id=964434539869&categoryId=126862549
紫色爱莎公主凉鞋，带雪花亮片装饰，超级闪亮。鞋面是柔软的紫色 绒面，搭配银色蝴蝶结，内里印有可爱的爱莎图案。鞋底防滑，适合夏天穿。只穿过一次，几乎全新。喜欢的小仙女赶紧来问价，同城自提优惠哦～,40.0,福建,1,https://www.goofish.com/item?id=945294031492&categoryId=126918035
"paco rabanne Elle 帕高仙女奇缘女香 50m l¥358,          80ml¥458",358.0,广东,0,https://www.goofish.com/item?id=667255836049&categoryId=126860278
冰雪奇缘带仙女棒 仙女棒还能用但是不是很灵敏 不退不换不售后,15.0,江苏,0,https://www.goofish.com/item?id=898569059251&categoryId=126862783
迪士尼商店正品公主礼裙，蓝色梦幻纱裙，灯笼袖设计，适合冰雪奇 缘艾莎主题装扮。裙子是渐变蓝配色，上身收腰设计，裙摆飘逸，做工精致。只穿过一次，喜欢的小仙女赶紧下手，价格可聊～,47.89,江西,0,https://www.goofish.com/item?id=931985721139&categoryId=126862710
紫色水晶公主头饰，带流苏纱幔，超仙美腻～ 银色水晶皇冠搭配紫色水晶爱心装饰，配上飘逸的紫色纱幔，适合表演、拍照、派对。全新未使用，做工精致，水晶闪亮，纱幔柔美。  喜欢的小仙女赶紧下手吧！同城自提,3.0,广东,10,https://www.goofish.com/item?id=933476821379&categoryId=126916091
魔法奇缘 仙女棒 全新未拆封  颜色：炫彩粉  宁波同城自提可减5元,40.0,浙江,0,https://www.goofish.com/item?id=939242393739&categoryId=126862783
迪士尼买的冰雪奇缘魔法棒，带LED灯光效果，三档闪光模式，小 女孩的最爱。有使用痕迹。腾地方，低价出。,19.0,山西,0,https://www.goofish.com/item?id=954530217182&categoryId=126862783
艾莎冰雪公主裙140码，蓝色星星纱裙，只穿过一次，几乎全新， 已全面清洁好了。裙子是长袖设计，外面是网纱刺绣雪花，里面是全棉的，穿着舒服。春秋季节都能穿，适合生日或者表演。喜欢的小仙女赶紧私聊我吧，价格可以聊。,59.0,江苏,0,https://www.goofish.com/item?id=920662288917&categoryId=126916033
爱莎公主款女童运动鞋，37码内长23，超轻防滑底，鞋面炫彩镭 射，内里柔软舒适～  全新未穿，适合秋冬季节，鞋底纹路防滑，穿着安全。29元包邮，不退不换哦～  喜欢的小仙女赶紧下单吧！,29.0,河北,128,https://www.goofish.com/item?id=933630585131&categoryId=126862698
绝版 迪士尼Disney 15周年限定 发声 米奇手持魔法棒 氛围灯 激光灯 仙女棒 冰雪奇缘   日本带回 正版！！  价格私聊  售出不退,45.0,山东,0,https://www.goofish.com/item?id=906347219348&categoryId=126862783
