标题,价格(元),所在地,想要人数,商品URL
直出雪松s42有平角领结 穿二未下水  有购买记录以前叫兔姬舍 现在是兔缝缝家啦！爽快的包邮 h入h出拍下给裙子实拍借tag借三坑汉服洛丽塔lo常服借天使街道，天国少女，bbd，ap机械云，占星猫，安妮的早餐，森女想去海边，古董人偶，梦见鲸鱼岛，三叶亭，小花园，报纸娃娃，笼中梦天使柄爱神乐章阿尔克纳之梦安妮的包裹猫与情书提拉米苏拿破仑加冕海市蜃楼美兰妮里雾诗借楼姜饼屋报纸娃娃bbd古典人偶天使街道油画柄林擒少女人形师泰迪sp俄罗斯套娃午茶熊爱神你别睡没烦恼古董人偶天使街道小熊玩具你别睡爱神乐章天使柄占星猫人偶派对兔耳洛可可人形师bbd复活者小甜茶笼中梦安徒生的低喃丝茉茉小甜猫洛可可舞曲梦见鲸鱼岛毒蘑菇十一月颂歌四时之约小心愿晨曦少女茶色猫最后的晚餐喵借lolita软妹jskopkcbnt发带手袖头冠天使柄腐烂草莓天使街道天国少女中村十字和平之春小白云渐变云机械云贝壳阿尔克纳之梦cla系梦回凡尔赛简知花嫁凡尔赛茶会款花嫁月光女神纯色占星猫天国少女baby AP玫瑰博物馆花葬夜蔷薇丛油画睡美人天使的街道白雪姬各种jskOP sk，天国少女、babydoll、 人形师、占星猫、星夜船、精灵王国、人形夜、白雪姬、星月草莓、天使街道、梦回凡尔赛、轮回之境、虎斑猫、星夏夜、天使的摇篮曲、小星辰、旅人赞歌、梦见鲸鱼岛鲸梦、精灵之语、抱猫、魍魉梦华寻、鲸落之屿、浮梦鲸、十六夜颂歌、白昼梦、机械云、渐变云、天国少女、中村十字、中村奶茶、蓬巴杜、安妮的早餐、阿尔克纳之梦、时光书局、烫金星座、古董娃娃、药箱、龙骨墓园、白皇后安塞尔的低喃、安娜波尔卡、塞壬悲歌、查尔斯工坊、夕日云、春时花宴、山鬼、付邮送免费送【长川手作形物语bbd中古vintage虎斑猫三花背带朵莉的小草莓纯色doll感椿蕾空气蛹摇篮曲lo围裙手作围裙pinkhouse日牌apbaby古典人形淑女的喫茶时间艾莉兔摇篮曲店员服奶油可可爱与正义momo萌熊咩咩小厨娘奶味泡芙樱桃派nonono初代人偶bodyline喵酱 白/水/茶无本关东关西札幌襟 借熊之工作室／逗酱工作室／tiny garden 小花园／古典玩偶Puppets and Doll官方店／Alice girl原创工作室／婴梵塔Infanta洋装工作室／钻石甜心DiamondHoney Lolita原创设计店／with PUJI原创自制轻洋装／NyaNya原创Lolita洋装店／魔法茶会lolita洋装工作室／古典玩偶／Classical Puppets婚纱定制／SIKA LOLITA南鹿鸣原创洋服设计／Neo Ludwing新路德维希原创独立设计师品牌／豹了个猫／TinyGarden小花园／桃乐丝之夜DorisNightLolita洋装馆／甜心贩售机／Honeyhoney lolita洋装贩售／第二城堡CastleToo／PUPPET NIGHT／草莓巫女原创lolita设计工作室／九歌lolita原创品牌／Fairydream Lolita／ZJstory原创设计／织锦园lolita原创／Neverland星芙颂原创设计店：不止lolita／小熊星座洋服lolita 原创设计／炭团洋服社／真空城堡／仲夏物语原创设计／Elpress L 原创Lolita洋装／SweetDreamer Vintage／JS洋装贩售(Jewelry in Sunrise)／麋鹿森林洋服设计／MilkyWay银河星空XDoKira／Eieyomi咿哟咪洋装／omouteien／YourHighness／莉莉丝之眼／安妮的包裹（厂原／临时停车场／南十字宇宙洋服社／AA lolita喵派独立设计／贩梦者原创lolita洋装馆／榛果可可花束BacioBouquet／四月安Lolita [The Ann of April]／幻之风原创lolita洋装／悠兰达复古洋装店／告白气球家小伊书妮蔻心0／Bramble Rose洋装店Narcissus滞水之影／伊丽娅 yilia lolita洋装工作室／QuaintLass 卿灵洋装／DearCelinne原创设计Lolita洋服店／ BOGUTA少女牌自主设计工作室／lullaby摇篮曲／PrettyRockBaby少女品牌／南瓜猫LOLITA／Mumu洋装工作室／GloryKingdom独立洋装设计／吸吸猫Lolita原创洋装／钦花社／cat猫罐头lolita洋装设计／LdA天使之泪／圆点点小姐lolita洋服社(不止一家店铺)／ichigoMikou原创Lolita洋装设计／长耳朵与尖耳朵／Mary玛丽小姐原创洋装店／CEL洋装设计Lolita／星辰猫lolita原创设计／十一月联夜 Lolita洋装店／Dolls Party／奶酪可可洋服社／Precious Clove ／PINK UP lolita少女洋装 借laaagkki anglebabydoll软妹常服科幻换jk软妹洛丽塔lo 袜lo鞋安可工作室森女部落布衣酱没烦恼很幸福蜜糖宝宝家借熊家熊之工作室你别睡别睡森女想去海边森女部落三扣三三哥家熊姨星彩虹安可原创逗酱芋头先生没烦恼梗豆中牌优马春日制服部星野森林来信山吹少女心事小椿树莓红茶冰淇淋s1g1b1l1玫森大小姐兰格泷岛海电竞少女小熊的裙雪松温柔一刀波b1s1g1l1暮雨清风借 夏服 中间服 冬服 盛夏服 护奶裙 无领西 毛衣 衬衣 领结  格裙 日制 校供熊家熊之工作室你别睡别睡森女想去海边森女部落三扣三三哥家熊姨星彩虹安可原创逗酱芋头先生没烦恼布衣酱 借xd大刀退坑科幻甜心兔兔小天使蜜桃熊软芙芙许愿星小心愿小猫咪梅露露绵阳泡芙糖果超甜告白奶糕结缘狂响深海之约甜心童话可可星小心柚小甜柚小奶糖咩咩兔甜美可爱Lolita 借小奶糕黑莓糕糕樱花草莓腐烂草莓牛奶团子珀尔公主芙拉小姐啵啵熊星月草莓斑点狗奶油甜酒小爱神丘比特哈利露鸭三周年前任限定蓝三花猫爱丽丝姐姐大头娃娃镭射款掉队小熊咕噜噜原创设计厚底鞋芭蕾猫猫绵阳泡芙小艾达软软猫有点圆（全新）白糖少女初恋Lolita 码借梅露露 人形师 占星猫 天使柄 爱神乐章 古董人偶 小熊玩具 猫猫与情书 轻飘飘占星猫 天使街道  辛波斯卡 塞壬悲歌 塞壬之吻 皇冠熊 沉汐之冠 天使街道 天使柄  爱神乐章 星月草莓 水母贝壳 婴梵塔 小白云 人形师 融心巧克力 草莓酱的野餐 彩虹诗 肥啾 睡美人 凡尔赛 摇篮曲 樱花草莓 占星猫 洛可可 提拉米苏 摇篮曲 占星猫 摇篮曲 凡尔赛少女 梦回凡尔赛  安妮的早餐 小裁缝 lo鞋 jk鞋jks  jk制服借桃子派对森女想去海边 三扣三 eggsshop 蛋蛋家 林小宅向日宅物 没烦恼很幸福小模特同款 大喜自制 陆小团团花吉 最小的海 瘦竹竿 馨帮帮 爱爱丸 阔色 蛋挞家 你别睡别睡 小树家 大sim小sim 万事都如意 miss qiuqiu秋家 卷卷家 朴正义 渔不二 萌量不足 蜜糖宝宝家 么宁 安小落 苏安家 乌77 圆脸小羊羊 黄不烦 奶兔星球 MLZ 安可工作室 恩妮软萌 肉完 宋黛 范智乔 古屋兔丸 荒野家 波豆狗 媌老板 空气猫日记 ruibbit 酱果 古啦啦啦 岛屿日记 like a doll 港妹潮人馆 PPHOME 玩味少女装 kumayes Offbeat Nancy 阿姨家熊姨家二懵家 梗豆物语告白气球家爱丽丝 虎斑猫三段虎斑猫切替小奶糕咕咕甜品小奶糕 可爱鬼 咕咕甜品 甜心汪汪 熊熊又饿了 可爱鬼 生日派对 爆米花 天使柄 侦探熊 软绵绵 莓熊物语 忘兔约定 爱丽丝 星月草莓 樱花草莓 三岁半 俄罗斯套娃 芙拉小姐 爱丽丝姐姐 爱丽丝妹妹 牛奶团子 奶油甜酒 童话味蕾 钻石甜心 霜糖甜心 猫与情书 洋娃娃与千纸鹤 甜心救援队 虎斑猫  渐变云 啵啵熊 瑞本兔 古董人偶 天国少女 bbd 葡萄汽水 咩嘢 沙华 山吹 冰淇淋 小红帽 树莓红茶 小椿 抹茶威化 爱晚 丢丢 温柔一刀 线性代数 大粉格子 辣妹 电子歌姬 星野 森林来信 温眠  情人节限定 白桃香  小熊的裙 山楂树 魔法少女 电竞少女 白溟 金鱼姬 烟灰 碳灰 玉桂狗 美乐蒂 羊羊幼稚园 xd出 大刀出 退坑出 白菜JK 洛丽塔 借laaagkki anglebabydoll软妹常服科幻换jk软妹洛丽塔lo 袜lo鞋安可工作室森女部落布衣酱没烦恼很幸福蜜糖宝宝家借熊家熊之工作室你别睡别睡森女想去海边森女部落三扣三三哥家熊姨星彩虹安可原创逗酱芋头先生没烦恼梗豆中牌优马春日制服部星野森林来信山吹少女心事小椿树莓红茶冰淇淋s1g1b1l1玫森大小姐兰格泷岛海电竞少女小熊的裙雪松温柔一刀波b1s1g1l1暮雨清风借 夏服 中间服 冬服 盛夏服 护奶裙 无领西 毛衣 衬衣 领结  格裙 日制 校供熊家熊之工作室你别睡别睡森女想去海边森女部落三扣三三哥家熊姨星彩虹安可原创逗酱芋头先生没烦恼布衣酱 借xd大刀退坑科幻甜心兔兔小天使蜜桃熊软芙芙许愿星小心愿小猫咪梅露露绵阳泡芙糖果超甜告白奶糕结缘狂响深海之约甜心童话可可星小心柚小甜柚小奶糖咩咩兔甜美可爱Lolita 借小奶糕黑莓糕糕樱花草莓腐烂草莓牛奶团子珀尔公主芙拉小姐啵啵熊星月草莓斑点狗奶油甜酒小爱神丘比特哈利露鸭三周年前任限定蓝三花猫爱丽丝姐姐大头娃娃镭射款掉队小熊咕噜噜原创设计厚底鞋芭蕾猫猫绵阳泡芙小艾达软软猫有点圆（全新）白糖少女初恋Lolita 码借梅露露 人形师 占星猫 天使柄 爱神乐章 古董人偶 小熊玩具 猫猫与情书 轻飘飘占星猫 天使街道  辛波斯卡 塞壬悲歌 塞壬之吻 皇冠熊 沉汐之冠 天使街道 天使柄  爱神乐章 星月草莓 水母贝壳 婴梵塔 小白云 人形师 融心巧克力 草莓酱的野餐 彩虹诗 肥啾 睡美人 凡尔赛 摇篮曲 樱花草莓 占星猫 洛可可 提拉米苏 摇篮曲 占星猫 摇篮曲 凡尔赛少女 梦回凡尔赛  安妮的早餐 小裁缝 lo鞋 jk鞋jks  jk制服借桃子派对森女想去海边 三扣三 eggsshop 蛋蛋家 林小宅向日宅物 没烦恼很幸福小模特同款 大喜自制 陆小团团花吉 最小的海 瘦竹竿 馨帮帮 爱爱丸 阔色 蛋挞家 你别睡别睡 小树家 大sim小sim 万事都如意 miss qiuqiu秋家 卷卷家 朴正义 渔不二 萌量不足 蜜糖宝宝家 么宁 安小落 苏安家 乌77 圆脸小羊羊 黄不烦 奶兔星球 MLZ 安可工作室 恩妮软萌 肉完 宋黛 范智乔 古屋兔丸 荒野家 波豆狗 媌老板 空气猫日记 ruibbit 酱果 古啦啦啦 岛屿日记 like a doll 港妹潮人馆 PPHOME 玩味少女装 kumayes Offbeat Nancy 阿姨家熊姨家二懵家 梗豆物语告白气球家爱丽丝 虎斑猫三段虎斑猫切替小奶糕咕咕甜品小奶糕 可爱鬼 咕咕甜品 甜心汪汪 熊熊又饿了 可爱鬼 生日派对 爆米花 天使柄 侦探熊 软绵绵 莓熊物语 忘兔约定 爱丽丝 星月草莓 樱花草莓 三岁半 俄罗斯套娃 芙拉小姐 爱丽丝姐姐 爱丽丝妹妹 牛奶团子 奶油甜酒 童话味蕾 钻石甜心 霜糖甜心 猫与情书 洋娃娃与千纸鹤 甜心救援队 虎斑猫  渐变云 啵啵熊 #JK,170.0,天津,0,https://www.goofish.com/item?id=647387527511&categoryId=126860572
【全网最低价｜价值¥139】Kreepsville666美国 正品哥特蜘蛛抓夹复古发夹[闪亮]实物视频已上传[闪亮]原包装袋在[闪亮]非全新，轻微使用痕迹[闪亮]不议价，这东西原价就要一百多—————————分割线(请忽略)—————————#配饰 #饰品控看过来 #炸街吸睛配饰  借亚文化  哥特  朋克  金属  摇滚  暗黑  机能  工业  赛博朋克  废土  异教  部落  女巫  吸血鬼  恋物  sence  EMO  医疗风  复古  中古  古着  嬉皮  视觉系 原宿  涩谷  gal  gyaru  Y2K  日牌  欧美  精灵风  新中式 PUNK RAVE  Devil Fashion  Eva Lady's  DARK IN LOVE  Killstar  Widow  Lip Service  Tripp NYC  RQBL  Alchemy Gothic  Widow  Kreepsville666  Banned  Restyle  Avelina De Moray  DraculaClothing  New Rock  Demonia  Trickz N' Treatz  Darker Wavs  Delias  Current Mood  Sugar thrillz  Club Exx  Jaded London  imgia  Namilia  Dollskill  Cyberdog  Cyber Store  Balenciaga巴黎世家  Rick Owens  Vivienne Westwoosd西太后  Jean Paul Gaultier高缇耶  Alice Auaa  Yohji Yamamoto山本耀司  Vivienne Tam谭燕玉   Alexander McQueen麦昆  Save The Queen  Junya Watanabe  Diesel  SEX POT  H.naoto  Mad Punks  ACDC RAG  Qutie Frash  H.jelly  D.I.A  Putumayo  Ozz Croce  Ozz oneste  Ogetto  Gouk  Angelic Pretty(ap)  EmilyTemple cute(etc)  milk  Baby Doll  Bodyline  Putumayo  PINK HOUSE  ALGONQUINS  H.anarchy  HELLCATPUNKS  Deorart  中央町战术工艺  IIIMIII  Serpentia  熠先生的蒸汽大陆  双头燕品牌店  颓废元素  血液供给BLOOD SUPPLY  吉儿朋克专门店Punk  G L P洛丽塔哥特朋克  瞄准你的心脏  酒肉市集 恐怖小丑  摇滚骷髅党  坏血统  星恶EvilStar  骸骨会  咕噜噜GURURU原创设计  转校生Transfer  堕落天使PUNKCAT  洛丽塔王国  怪糖饰物集  MORBID  DIET GRRRL  Strange Sugar  Broken bone  断片小说 Embryo Online  TAROTAROT OFFICIALARKM  mss studio  PERSONSOUL 灵魂人类  CFIERCE  nit alcove  ARIADNAw  DEMARCATION  3KM三公里  OPEN AESTHETIC  NEONPOND天池秘境   SCCREBEL  西子瓦 She's warm  Atmarati  Ttsunami  badtaste坏品味西部  MICHICAT  SEExSAW西所  湿尾巴  SCCREBEL  ChaosAngel  Dotyears  DoublePunch  Wrong Solution  LAPAPA  HunGras  WhyNotDance  2th Desire  前置表达PreExpressivity  Jeffrey Campbell  AZ43 WOMAN STUDIO  UBORYA  notdetailed旗舰店  我是饼干I'm cookie  沉没SINKing  PUNKMOMMY  Mooreyu,79.99,福建,0,https://www.goofish.com/item?id=964534159904&categoryId=126862535
低于原价出白霜光有角有尾无骨，哪吒魔童系列敖光龙爹属性同人棉 花娃娃30cm。⭐️图片为实拍tag哪吒之魔童降世 哪吒之魔童闹海 哪吒之魔童系列 敖光 敖丙 哪吒 藕饼 棉花娃娃棉花娃娃衣 20cm 25cm 28cm 30cm 一摊菜桃叽 赤雪 绛雪 峦霞 cakie 薄莓 cygle 妮蓓蒂 莲玄 星莹 山鬼谣 夜火离歌 阿duang 阿翎 coral 日向夏 小雪兔 湘妃 月亮Unina kalopsia 织梦 期序 琉月 殊影 苍苍 美美酱 初泉 小银啾 莓糕糕 小蛋糕 嚞锦 衔梦 告白 阿谕 快快显灵 盐澄洛穗 洛憓 纯爱 闪闪晶 不坠星 椿山 柠月 沐莜莜 苍苍 果果兔 水银咪 青蚺sp 刀刀 湘妃 青姌 药理酱 莓露可 昭昭如愿 告白 月泱 病理酱 阿Duang 布丁酪酪 嚞锦 木栾 爱祈 耐冬 阿莉娅 埃斯佩拉 昙阙 露娜 阿玙 凝凝 阿谕 韵山鵑 莉莉亚斯 瑛桃 牙灵灵 艾俪娅 金酒酒 暙绘锦 贪婪好好吃饭饭 好想吃草莓蛋挞 好想吃蛋挞，香蕉不拿拿   超级菠萝包 番茄炒菠萝DDaphnee 春不语ss 一摊菜桃叽 20cm普体、25cm特体  30cm长腿绝美娃 小团娃 薄巧小咪 樱狐 苍苍 绛雪 小蝠喵 半月酒 月斟 灰狼林克 蝎蝎 Arko 果川莓 纳巴纳sp 惘 瑞文·克劳福德 巴弗羚  蝴蝶面  达木 福瑞体棉花娃娃半月酒 月斟 灰狼林克 蝎蝎 Arko 白隐原版 生石灰娃衣 夏弥尔 挽栖星 霁蓝 绒绒莓、芋泥菓、妮琪、爱丽丝、墨吟暙、冬寅、tesoro、见椿鸢、见椿鸾、葡塔、莓果茶会、瓜饼、椛予、melynda、耳、山河图 、山河图 小缝挞挞 洗云大全套 枕霜大全套泪烟 苍苍 小锦鲤 美神 洗云 枕霜 月下樱藤金饼糖 小狗备忘录 奶酪宝宝 雾桃洛可可 雾桃洛可可SP 铃兰挽春 小兔茶话会 小兔糕点师 微醺梦境 午后甜茶 莓果千层塔 miega 不加甜可可 超级大月亮 葡萄冻 生巧冻 okbond 小括号 hihi 小贝壳 巧可喵 番尼小镇 番尼小镇队长系列娃衣 番尼小镇动物集市 枕霜娃衣，洗云娃衣棉花娃娃 骨董洋火家 小鸡为什么要过马路 废菜几 日山鹅鹅 豆乳实验室 碳水画和物 金饼糖 来吃三碗饭 小兔茶会 午后甜茶 小兔糕点师 退坑娃衣 白菜娃衣 娃衣福袋来吃三碗饭 豆乳实验室 黄油曲奇饼泡芙庄园 白桃汽水 一只废菜几 吹泡克林碳酸起泡 娃爸衣橱 大右加餐 骨董洋火店枕霜 洗云 午后甜茶 雾桃洛可可 小兔茶会 微醺梦境 莓果千层塔 白熊花田 兔兔小偶像 熊熊糖果罐 云间茶话 月下藤樱 稚蔷薇郁香小絮 小兔糕点师废菜几学步鞋番尼小镇队长系列sp海盐奶酪 万重瑶光 月姝 月蕸 小昙花 吻冬 衔声 怜宵 月泱 水银咪 汞咪 慢慢 晚山茶 海珊瑚 炽迴 蓁蓁 coral 信子 汐枳 忧兰 殊影 寒宵 嚞锦 渐落 棉花娃娃 棉花娃娃娃衣20cm 娃衣 男娃女娃都可 20cm棉花娃娃娃衣 崽崽芝士酥警班学员部小猫 吃一块芝士家的 星冕SP娃衣20cm毛绒公仔衣服男娃衣服换装裸娃常规体仅衣服无娃娃棉花娃娃 20cm  粉红属性系列 无生无亡 旺旺叉烧熊熊一夏幽灵龙露馅汤圆理欺负五难哄 张子犬犬 海陆空 光与夜之恋 脏病 怜 东洋苹果派 格瑞尔 奶盐雪芙 猎物豹豹，棉花娃娃 娃衣 20cm 小漏 小咘sp芍药 花生豆 灼野 修修 修黑 呜拾 斐哩 青霜 叉烧猫 柒呼呼 黑狼臣臣 karu 一哈金 余悸 修黑 熊熊一夏 白鼬臣臣 今时 麦次郎 金小麦 pafu 生菅包 今时 晚星 理豹五 给理豹豹 司霜序 心里有礼 齐小七低卡限定日落胶片 天之川喵喵餐厅蓝莓一号 蓝莓二号 吠舍 今时 白鼬臣臣熊熊一夏 叉烧猫 玫理猫 小头vow 余悸 晚星 日山鹅鹅鲜奶胡萝卜 难哄 巫师一年级 乳酪小熊 风月浪漫谭卫衣 胡萝卜小狗 玫瑰信约 小玫瑰 蓝莓一号 三期毛线帽 熊猫春日裙 棉花小羊 抹茶牧场 Cheese 日山鹅鹅 小松子 可爱豹击 乳酪小熊 黑莓小熊 神明猫又珍妮日记 小羊裁缝 马戏宝宝 冬眠白熊 系统预警 陨石边牧Ocol 芍药 无生 难哄 克洛里斯 无雪 小咘 阿辞 屿雾 奶醪 墟烬 花生豆 丸菜 巫师一年级 黄油曲奇饼hp系列魔法袍 无面 伊恩 阿兰朵 乌冽 眠厄 伊凡，伊索 黑狼臣臣 佐久早圣臣 赛博神明祂 兔面 斯塔夏 月下重影 requiem安魂曲 血乌 古董少爷 中国结 无属性 粉红系列 粉红头发粉红眼睛 可爱 棉花娃娃 20CM 现货 男娃女娃都可陨石边牧Ocol 芍药 无生 难哄 克洛里斯 无雪 小咘 阿辞 屿雾 奶醪 墟烬 花生豆 丸菜 巫师一年级 黄油曲奇饼hp系列魔法袍 无面 伊恩 阿兰朵 乌冽 眠厄 伊凡，伊索 黑狼臣臣 佐久早圣臣 赛博神明祂 兔面 斯塔夏 月下重影 requiem安魂曲 血乌 古董少爷 不知春 左心室陷阱 爱乖 爱呜 诺恩 爱碎 小慬娃 纳西莎 月幕序曲 缪卡 辞川 临烟 阿尔西 小野 修黑 余悸 红药 米桃 绝先生 灼野 江蓠沈教授 妄言气球波波家 鸠车小竹马 碳酸起泡 日山鹅鹅 吹泡克林 酥仔仓库 珍妮日记 荒野果茶 秋山小年糕 鲜奶胡萝卜不加甜可可 豆花博物馆 花间心事 快去睡觉鸭 小羊牧场 BalaBalaBoom小芭杯杯 十月汀 48hours便利店 夏日系列 蜜糖吐司HoneyToast 好好吃饭娃衣铺 花间少女 秋山奶糕家 QQ草莓奶冻 猪么么原创娃衣设计 咕噜小铺 醉墨凉烟 满杯云朵 Miega原创娃屋 多亿点乐乐园,110.0,江苏,0,https://www.goofish.com/item?id=965555019839&categoryId=202035401
颤动！老鼠喜欢的东西 鼠君 免日本代购费 ——以下为煤炉原商品信息的中文翻译，供参考——【商品描述】咕噜咕噜！老鼠先生喜欢的东西 老鼠君带标签全新未使用的奖品。获得后放入袋子保管。发送照片中的实物，但作为娱乐奖品，请理解获得时的划痕及缝制个体差异等情况后再购买。发货时会防止淋湿，通过ゆうゆうメルカリ便（匿名配送）寄送。压缩至可放入邮箱的程度。 可直接购买。————————————————【商品信息】预计日本岛内发货天数：1 ~ 2 天——————————————————宝子们下单前请看这里↓↓↓——【重要规则】（下单即视为同意以下规则）：1.本店商品均为日本mercari平台出售的二手商品，代购成功后不可退款。2.商品标价【不包含税费和运费】，需另行补款。（详细请咨询客服）【购买流程】您下单支付商品费用→我家日本代购→煤炉卖家发货→宝贝到我家日本仓→您支付税费运费→宝贝日本直邮到您家【运费及关税说明】1.支持中通、顺丰、EMS，详细查看下方运费表。2.EMS税费自理，海关抽检。3.中通、顺丰：本店代缴税（税金不到50元免税，详细税率咨询客服）。【退换货规则】参考下方详情图整套流程完善，宝子们可以放心来找我切煤啦～————————————————【我家优势】1.日本煤炉Mercari平台官方合作2.6000㎡日本仓库，百人仓管高效发货3.新店期间代购费全免4.1V1客服每天10:00-24:00在线守候感兴趣点击右下角【聊一聊】❗,34.0,北京,0,https://www.goofish.com/item?id=965408679471&categoryId=126860294
蜡笔小新 链条式拉链包 三种款式 免日本代购费 ——以下为煤炉原商品信息的中文翻译，供参考——【商品描述】❌不可议价或请求降价❌不允许单独出售■■商品内容■■★小新带链拉链袋・山鳄先生・咕噜咕噜海绵・风间同学尺寸：约89×121毫米（不含滑块和链条）※为了确认内容物和拍摄，仅开封过一次。※虽然是全新商品，但存放在家中，请对挑剔或追求完美的人士慎重考虑。※没有吸烟者或宠物。■■邮寄方式■■我将通过Mercari快递进行发货。 包邮※商品将以简易包装发出。※我们会尽量在3天内发货，由于孩子的计划或天气等原因，可能会延迟发货。如果延迟，我们会再次与您联系。#クレヨンしんちゃん#鱷山先生#布里布里泽蒙#风间君带链条的拉链盒————————————————【商品信息】预计日本岛内发货天数：2 ~ 3 天——————————————————宝子们下单前请看这里↓↓↓——【重要规则】（下单即视为同意以下规则）：1.本店商品均为日本mercari平台出售的二手商品，代购成功后不可退款。2.商品标价【不包含税费和运费】，需另行补款。（详细请咨询客服）【购买流程】您下单支付商品费用→我家日本代购→煤炉卖家发货→宝贝到我家日本仓→您支付税费运费→宝贝日本直邮到您家【运费及关税说明】1.支持中通、顺丰、EMS，详细查看下方运费表。2.EMS税费自理，海关抽检。3.中通、顺丰：本店代缴税（税金不到50元免税，详细税率咨询客服）。【退换货规则】参考下方详情图整套流程完善，宝子们可以放心来找我切煤啦～————————————————【我家优势】1.日本煤炉Mercari平台官方合作2.6000㎡日本仓库，百人仓管高效发货3.新店期间代购费全免4.1V1客服每天10:00-24:00在线守候感兴趣点击右下角【聊一聊】❗,18.0,北京,0,https://www.goofish.com/item?id=965690346891&categoryId=126860291
日版 夏目友人帐 一番赏 猫老师和刚出炉的面包～ニャンコ先生 と焼きたてパン～  日本带回，全新日版～非代理版～  ☆A赏 咕噜咕噜的猫老师公仔              もぐもぐニャンコ先生ぬいぐるみ ☆B赏 猫老师和椒盐面包毛绒玩具             ニャンコ先生とプレッツェルぬいぐるみ ☆...,15.0,上海,0,https://www.goofish.com/item?id=675105216237&categoryId=126862807
造景贴纸 小清单返额全额给 你自己下单，我不赚钱 适用于所有上了小清单的品，预估返额*0.7（扣除手续费）是实际到手返额流程：1️⃣你告诉我品，我挂小清单，你下单2️⃣确认收货7天后，带订单截图找我（要求看到订单号）3️⃣加绿泡转账给你自己下单与代下单的区别↓1️⃣代下单：无需等待7天，无脑付款，但比自己下单略贵，不包售后（折痕不售后！）2️⃣自己下单：比代下单便宜一点，订单在你号上，售后找客服更方便，需要等确认收货7天总结：愿意等7天的宝子推荐自己下单，嫌麻烦的宝子推荐代下单目前适用品牌： 肉团小狗 纸先生 纸间童话 利胜 雀麦 雀食利害 白茄子 三脚喵 大麦洛洛 纸泡 菠萝碎碎念 方盒工坊 纸次方 时空工坊 口袋山丘 萌火慢炖 凌晨文创 咔咔呜 咕噜咕噜 奶油兔 艺蓝 妍莜 嘉嘉简简 咔咔呜 悦禧 新屿言 朝釉 纸眠岛 森游 天空岛 寻踪 黑包 等等,1.0,广东,0,https://www.goofish.com/item?id=955314057808&categoryId=126916166
南怀瑾肚脐贴，花椒、桂圆肉、艾绒，这个比例刚刚好最好吸收的状 态！！一名中医大夫的真心推荐，我自己用了一段时间了，肚脐贴上这个散剂很舒服，胃肠就开始咕噜，睡眠也深，建议每一位女性都买上，跟自己的先生一起贴。,35.0,山东,98,https://www.goofish.com/item?id=656821807304&categoryId=201459411
