标题,价格(元),所在地,想要人数,商品URL
《骆驼草：陈村作品集》 PDF，度盘。是陈村在1979-1980’s写的短篇小说，并收了两个中篇。我主要是为了看《一天》和《蓝色》，看完以后…啊这…很震撼，是比较早征用“张三”的人，也是比较早使用废话文学和歌词文学的大能，充分继承了“一棵是枣树，另一棵也是枣树”的优良传统，人鲁子只这一句，陈先生是通篇废话叨咕噜。看《FFF》的时候脑门青筋直跳，熟悉的男作家男导演男画家那股子膻味扑鼻：这就是古早垃圾话搞那啥意识流文学是吗？要不是看在这是写于1983年的份上，我就把这文档玉碎了。,2.0,上海,0,https://www.goofish.com/item?id=964688492793&categoryId=202036301
梁实秋120周年诞辰纪念版《快乐就是哈哈哈哈哈》，中国友谊出 版公司正版，全新未拆封。随书赠送精美海鸥书签4张，收录梁实秋先生经典散文随笔，教你解锁人生快乐密码，做一个浪漫有趣的人。纸张品质好，印刷清晰，全国包邮，偏远地区补邮费，喜欢的朋友私聊聊价格。快乐就是哈哈哈,14.9,黑龙江,0,https://www.goofish.com/item?id=946105394987&categoryId=127838003
有趣的数学绘本全套7本，包括《小邋遢波比分类》《皮斯王子来动 物村做客》《坐上火车去旅行》《咕噜噜先生请客》《糖糖的一天》《青蛙呱呱探索世界》《小乔治快乐的一天》，适合3-6岁宝宝阅读。全新未拆封，包装完好。每本都是精美图画，讲述有趣的数学概念和生活场景，让孩子在玩耍中学习数学知识。内容生动有趣，图文并茂，帮助孩子培养数学思维。非偏远地区包邮，同城自提更优惠，喜欢的宝妈欢迎私聊～,10.0,山东,0,https://www.goofish.com/item?id=963008331644&categoryId=127832004
东湖之森·洛嘉森乐园单次畅玩卡  一大一小单次畅玩票。 包含:四大游乐项目：大王花、鳄鱼海湾、梦幻沼泽、猛犸森林 ➕四大戏水活动：咕噜水溪蒙眼接水、摸鱼大比拼、赶走鳄鱼先生、水枪大作战（自带工具） ➕主题小游戏：黄金小矿工（每周六14:00）、瓜瓜挑战赛（每周六16:00） 可参加森林奇遇派队...,45.9,湖北,3,https://www.goofish.com/item?id=948519450373&categoryId=201956102
东湖之森·洛嘉森乐园门票一大一小 单次畅玩票。 包含:四大游乐项目：大王花、鳄鱼海湾、梦幻沼泽、猛犸森林➕四大戏水活动：咕噜水溪蒙眼接水、摸鱼大比拼、赶走鳄鱼先生、水枪大作战（自带工具）➕主题小游戏：黄金小矿工（每周六14:00）、瓜瓜挑战赛（每周六16:00）可参加森林奇遇派队活动注意⚠️入园必湿身，请自备换洗衣物！仅限一名18岁以下儿童和一名成年人使用，仅游玩当日且单次有效周一到周五营业时间15:00-20:30,45.0,湖北,0,https://www.goofish.com/item?id=959150854263&categoryId=201956102
南怀瑾肚脐贴桂圆花椒艾绒艾草贴 花椒、桂圆肉、艾绒，这个比例刚刚好最好吸收的状态！一名中医大夫的真心推荐，我自己用了一段时间了，肚脐贴上这个散剂很舒服，胃肠就开始咕噜，睡眠也深，建议每一位女性都买上，跟自己的先生一起贴。  现在脾虚胃寒的人非常多，出现肥胖，胃口差，消...,35.0,山东,98,https://www.goofish.com/item?id=772407616995&categoryId=201459223
赖晓珍的好品格童话全8册  金鼎奖获奖作家 当当网正版购入，9.5新，应该是拆封未读。 江浙沪包邮，其他地区加运费先联系。个人闲置不退不换，介意勿拍。搬家打包卖。   大野狼咕噜咕噜 坏脾气的星星 偷影子的小精灵 蝴蝶女王与屎壳郎 孔雀先生的秘密 爱哭的小威 狐狸奶奶的魔法饼干 小...,46.8,上海,0,https://www.goofish.com/item?id=942698095219&categoryId=127832004
九九新童书，适合2—8岁。斯凯瑞金色童书，《忙忙碌碌镇》《好 忙好忙的小屁孩》《倒霉的弗兰伯先生》《斯凯瑞的空气大书》《呼啦呼啦飞起来》《咕噜咕噜转》《忙啊忙啊忙什么》超级棒超级好玩的一套书，大开本，不单出，七本60元。包邮二手 彩绘本，全七册不单发，蒲公英童书馆斯凯瑞金色童书益智经典：呼,60.0,天津,0,https://www.goofish.com/item?id=842040391926&categoryId=127832004
有趣的数学绘本+有趣的科学绘本 8+8共16本。有趣的数学绘本包含:《坐上火车去旅行（减法）》，《青蛙呱呱探索世界（对比）》，《波斯王子来动物村做客（图形）》，《小乔治郁闷的一天（大小）》，《小邋遢波比（分类）》，《糖糖的一天（时间）》，《咕噜噜先生请客（加法）》，《水...,4.0,辽宁,0,https://www.goofish.com/item?id=935688177473&categoryId=127832004
佐敦、牛造的场、印象城100代金劵 山姆店午餐[火] 【注意：仅限山姆店使用】 周一、周二、周三、周四、周五 佐敦，泰心动、你好牛、春字号 2F：牛造的场、领蟹祥记、味福记、酒拾烤肉、椒爱 水煮鱼、蛙先生、小柴米、渔乡米坊、爱撒娇咕噜 鱼、 、瞪眼牛煎包、泰小美、天津卫、喜...,49.9,江西,0,https://www.goofish.com/item?id=886801268400&categoryId=201403407
宜嘉 markson 同人本 本子 1.先生by九夫人 ¥70（已出） 2.MARK AND JACKSON by菠萝咕噜棠+覃川+爱搞基的joy+兔子柠+莱茵 ¥50 3.六周年联合本Virtual Reality by甜酒129I+BAMMICUTIE+...,60.0,浙江,2,https://www.goofish.com/item?id=762172372006&categoryId=126860292
我妈妈上班去了，我们吵架了，美国姨妈的礼物，鲁拉鲁先生的自行 车数字爷爷的数字。乐园欢的。礼物世界第一的帽子上学不再丢三落四，月亮捉迷藏我也行呀，勇敢的胆小鬼，谁要一只便宜的犀牛咕噜和鲤鱼旗恐龙我爱幼儿园。变变变，请不要生气。迟到的理由。7元一本，10本包邮,7.0,山东,1,https://www.goofish.com/item?id=951640293729&categoryId=127832004
精装绘本，鲁拉鲁先生，爱打嗝的斑马，咕噜咕噜汪，大头鱼洗 系列等6.5元一本，满十本包邮 自取5元一本不议价，书比较重，五新以上，  超人兔系列7本个别有破损25包邮 鲁拉鲁先生的院子(精) 乌鸦面包店5本20包邮 均为京东或者当当购买正版,6.0,辽宁,0,https://www.goofish.com/item?id=898367422781&categoryId=127832004
布朗先生糟糕的一天 大灰狼咕噜 不退不换运费自理 感兴趣的话点“我想要”和我私聊吧～,8.0,北京,0,https://www.goofish.com/item?id=929020662617&categoryId=127832004
［卡片合集］JK制服Lolita假毛鞋子赠送的卡片    中 牌制服馆沙华烟灰小椿兔吉舍兔缝缝兔姬舍咩嘢森林来信白兔先生极夜之歌森林来信水果糖小椿桃子梅了咕噜噜三叶亭withpuji鬼鬼家御茶家春日制服部落深夜幻镜御茶家啦啦酱西西酱告白气球双子兔芙拉小姐深海医院萌款明信片  ●都是标价一件不包邮！！0...,0.88,云南,99,https://www.goofish.com/item?id=679305472113&categoryId=126864096
南怀瑾肚脐贴桂圆花椒艾绒艾草贴 花椒、桂圆肉、艾绒，这个比例刚刚好最好吸收的状态！一名中医大夫的真心推荐，我自己用了一段时间了，肚脐贴上这个散剂很舒服，胃肠就开始咕噜，睡眠也深，建议每一位女性都买上，跟自己的先生一起贴。  现在脾虚胃寒的人非常多，出现肥胖，胃口差，消...,35.0,山东,98,https://www.goofish.com/item?id=733239580996&categoryId=201459223
聪明小孩玩出来，点点大搜索几乎全新，形状变变变有两个地方坏了 ，整体影响不大，已经粘好。 咕噜咕噜转和忙忙碌碌镇，精装的大开本九九新。 乐乐趣揭秘恐龙，揭秘汽车两本九九新 吃梦先生，生气梦，恐惧梦,4.0,辽宁,0,https://www.goofish.com/item?id=861976813365&categoryId=127832004
小学2年级和3年级的课外必读书，孩子比较爱惜，九成新。图片里 面的所有书都有，一共39本。还有中国民俗故事，中国古代贤哲故事，中国古代神话，生气汤，没头脑和不高兴，亲爱的汉修先生，泼普先生的企鹅，凯文不会飞，小猪稀里咕噜，一起长大的玩具，屁屁超人，格林童话，安徒生童话，一千零一夜，伊索寓言，我和小姐姐...,100.0,河南,0,https://www.goofish.com/item?id=706080865018&categoryId=127812005
斯凯瑞金色童书故事经典:忙啊忙啊忙什么、呼啦呼啦飞起来、热热 闹闹的世界、迷迷糊糊的侦探、好忙好忙的小屁孩、忙忙碌碌镇、咕噜咕噜转、倒霉的弗兰伯先生、会唱歌的圣诞树、农夫猪和绿皮龙、最受欢迎的故事、幸运的蚯蚓爬爬忙忙碌碌镇,158.0,江苏,296,https://www.goofish.com/item?id=897311397464&categoryId=127832004
原价主出次换」中牌制服馆格裙jk竹取m短带平角领结 原价不包 邮出  全新习惯性拆定有吊牌尸体 褶子状态很好物流到货的当天确认退一半邮费不换温柔一刀小椿山楂树其他都可以问问注：交易请看我主页的个人简介--购买须知借tag借三坑汉服洛丽塔lo常服借天使街道，天国少女，bbd，ap机械云，占星猫，安妮的早餐，森女想去海边，古董人偶，梦见鲸鱼岛，三叶亭，小花园，报纸娃娃，笼中梦天使柄爱神乐章阿尔克纳之梦安妮的包裹猫与情书提拉米苏拿破仑加冕海市蜃楼美兰妮里雾诗借楼姜饼屋报纸娃娃bbd古典人偶天使街道油画柄林擒少女人形师泰迪sp俄罗斯套娃午茶熊爱神你别睡没烦恼古董人偶天使街道小熊玩具你别睡爱神乐章天使柄占星猫人偶派对兔耳洛可可人形师bbd复活者小甜茶笼中梦安徒生的低喃丝茉茉小甜猫洛可可舞曲梦见鲸鱼岛毒蘑菇十一月颂歌四时之约小心愿晨曦少女茶色猫最后的晚餐喵借lolita软妹jskopkcbnt发带手袖头冠天使柄腐烂草莓天使街道天国少女中村十字和平之春小白云渐变云机械云贝壳阿尔克纳之梦cla系梦回凡尔赛简知花嫁凡尔赛茶会款花嫁月光女神纯色占星猫天国少女baby AP玫瑰博物馆花葬夜蔷薇丛油画睡美人天使的街道白雪姬各种jskOP sk，天国少女、babydoll、 人形师、占星猫、星夜船、精灵王国、人形夜、白雪姬、星月草莓、天使街道、梦回凡尔赛、轮回之境、虎斑猫、星夏夜、天使的摇篮曲、小星辰、旅人赞歌、梦见鲸鱼岛鲸梦、精灵之语、抱猫、魍魉梦华寻、鲸落之屿、浮梦鲸、十六夜颂歌、白昼梦、机械云、渐变云、天国少女、中村十字、中村奶茶、蓬巴杜、安妮的早餐、阿尔克纳之梦、时光书局、烫金星座、古董娃娃、药箱、龙骨墓园、白皇后安塞尔的低喃、安娜波尔卡、塞壬悲歌、查尔斯工坊、夕日云、春时花宴、山鬼、付邮送免费送【长川手作形物语bbd中古vintage虎斑猫三花背带朵莉的小草莓纯色doll感椿蕾空气蛹摇篮曲lo围裙手作围裙pinkhouse日牌apbaby古典人形淑女的喫茶时间艾莉兔摇篮曲店员服奶油可可爱与正义momo萌熊咩咩小厨娘奶味泡芙樱桃派nonono初代人偶bodyline喵酱 白/水/茶无本关东关西札幌襟 借熊之工作室／逗酱工作室／tiny garden 小花园／古典玩偶Puppets and Doll官方店／Alice girl原创工作室／婴梵塔Infanta洋装工作室／钻石甜心DiamondHoney Lolita原创设计店／with PUJI原创自制轻洋装／NyaNya原创Lolita洋装店／魔法茶会lolita洋装工作室／古典玩偶／Classical Puppets婚纱定制／SIKA LOLITA南鹿鸣原创洋服设计／Neo Ludwing新路德维希原创独立设计师品牌／豹了个猫／TinyGarden小花园／桃乐丝之夜DorisNightLolita洋装馆／甜心贩售机／Honeyhoney lolita洋装贩售／第二城堡CastleToo／PUPPET NIGHT／草莓巫女原创lolita设计工作室／九歌lolita原创品牌／Fairydream Lolita／ZJstory原创设计／织锦园lolita原创／Neverland星芙颂原创设计店：不止lolita／小熊星座洋服lolita 原创设计／炭团洋服社／真空城堡／仲夏物语原创设计／Elpress L 原创Lolita洋装／SweetDreamer Vintage／JS洋装贩售(Jewelry in Sunrise)／麋鹿森林洋服设计／MilkyWay银河星空XDoKira／Eieyomi咿哟咪洋装／omouteien／YourHighness／莉莉丝之眼／安妮的包裹（厂原／临时停车场／南十字宇宙洋服社／AA lolita喵派独立设计／贩梦者原创lolita洋装馆／榛果可可花束BacioBouquet／四月安Lolita [The Ann of April]／幻之风原创lolita洋装／悠兰达复古洋装店／告白气球家小伊书妮蔻心0／Bramble Rose洋装店Narcissus滞水之影／伊丽娅 yilia lolita洋装工作室／QuaintLass 卿灵洋装／DearCelinne原创设计Lolita洋服店／ BOGUTA少女牌自主设计工作室／lullaby摇篮曲／PrettyRockBaby少女品牌／南瓜猫LOLITA／Mumu洋装工作室／GloryKingdom独立洋装设计／吸吸猫Lolita原创洋装／钦花社／cat猫罐头lolita洋装设计／LdA天使之泪／圆点点小姐lolita洋服社(不止一家店铺)／ichigoMikou原创Lolita洋装设计／长耳朵与尖耳朵／Mary玛丽小姐原创洋装店／CEL洋装设计Lolita／星辰猫lolita原创设计／十一月联夜 Lolita洋装店／Dolls Party／奶酪可可洋服社／Precious Clove ／PINK UP lolita少女洋装 借laaagkki anglebabydoll软妹常服科幻换jk软妹洛丽塔lo 袜lo鞋安可工作室森女部落布衣酱没烦恼很幸福蜜糖宝宝家借熊家熊之工作室你别睡别睡森女想去海边森女部落三扣三三哥家熊姨星彩虹安可原创逗酱芋头先生没烦恼梗豆中牌优马春日制服部星野森林来信山吹少女心事小椿树莓红茶冰淇淋s1g1b1l1玫森大小姐兰格泷岛海电竞少女小熊的裙雪松温柔一刀波b1s1g1l1暮雨清风借 夏服 中间服 冬服 盛夏服 护奶裙 无领西 毛衣 衬衣 领结  格裙 日制 校供熊家熊之工作室你别睡别睡森女想去海边森女部落三扣三三哥家熊姨星彩虹安可原创逗酱芋头先生没烦恼布衣酱 借xd大刀退坑科幻甜心兔兔小天使蜜桃熊软芙芙许愿星小心愿小猫咪梅露露绵阳泡芙糖果超甜告白奶糕结缘狂响深海之约甜心童话可可星小心柚小甜柚小奶糖咩咩兔甜美可爱Lolita 借小奶糕黑莓糕糕樱花草莓腐烂草莓牛奶团子珀尔公主芙拉小姐啵啵熊星月草莓斑点狗奶油甜酒小爱神丘比特哈利露鸭三周年前任限定蓝三花猫爱丽丝姐姐大头娃娃镭射款掉队小熊咕噜噜原创设计厚底鞋芭蕾猫猫绵阳泡芙小艾达软软猫有点圆（全新）白糖少女初恋Lolita 码借梅露露 人形师 占星猫 天使柄 爱神乐章 古董人偶 小熊玩具 猫猫与情书 轻飘飘占星猫 天使街道  辛波斯卡 塞壬悲歌 塞壬之吻 皇冠熊 沉汐之冠 天使街道 天使柄  爱神乐章 星月草莓 水母贝壳 婴梵塔 小白云 人形师 融心巧克力 草莓酱的野餐 彩虹诗 肥啾 睡美人 凡尔赛 摇篮曲 樱花草莓 占星猫 洛可可 提拉米苏 摇篮曲 占星猫 摇篮曲 凡尔赛少女 梦回凡尔赛  安妮的早餐 小裁缝 lo鞋 jk鞋jks  jk制服借桃子派对森女想去海边 三扣三 eggsshop 蛋蛋家 林小宅向日宅物 没烦恼很幸福小模特同款 大喜自制 陆小团团花吉 最小的海 瘦竹竿 馨帮帮 爱爱丸 阔色 蛋挞家 你别睡别睡 小树家 大sim小sim 万事都如意 miss qiuqiu秋家 卷卷家 朴正义 渔不二 萌量不足 蜜糖宝宝家 么宁 安小落 苏安家 乌77 圆脸小羊羊 黄不烦 奶兔星球 MLZ 安可工作室 恩妮软萌 肉完 宋黛 范智乔 古屋兔丸 荒野家 波豆狗 媌老板 空气猫日记 ruibbit 酱果 古啦啦啦 岛屿日记 like a doll 港妹潮人馆 PPHOME 玩味少女装 kumayes Offbeat Nancy 阿姨家熊姨家二懵家 梗豆物语告白气球家爱丽丝 虎斑猫三段虎斑猫切替小奶糕咕咕甜品小奶糕 可爱鬼 咕咕甜品 甜心汪汪 熊熊又饿了 可爱鬼 生日派对 爆米花 天使柄 侦探熊 软绵绵 莓熊物语 忘兔约定 爱丽丝 星月草莓 樱花草莓 三岁半 俄罗斯套娃 芙拉小姐 爱丽丝姐姐 爱丽丝妹妹 牛奶团子 奶油甜酒 童话味蕾 钻石甜心 霜糖甜心 猫与情书 洋娃娃与千纸鹤 甜心救援队 虎斑猫  渐变云 啵啵熊 瑞本兔 古董人偶 天国少女 bbd 葡萄汽水 咩嘢 沙华 山吹 冰淇淋 小红帽 树莓红茶 小椿 抹茶威化 爱晚 丢丢 温柔一刀 线性代数 大粉格子 辣妹 电子歌姬 星野 森林来信 温眠  情人节限定 白桃香  小熊的裙 山楂树 魔法少女 电竞少女 白溟 金鱼姬 烟灰 碳灰 玉桂狗 美乐蒂 羊羊幼稚园 xd出 大刀出 退坑出 白菜JK 洛丽塔 借laaagkki anglebabydoll软妹常服科幻换jk软妹洛丽塔lo 袜lo鞋安可工作室森女部落布衣酱没烦恼很幸福蜜糖宝宝家借熊家熊之工作室你别睡别睡森女想去海边森女部落三扣三三哥家熊姨星彩虹安可原创逗酱芋头先生没烦恼梗豆中牌优马春日制服部星野森林来信山吹少女心事小椿树莓红茶冰淇淋s1g1b1l1玫森大小姐兰格泷岛海电竞少女小熊的裙雪松温柔一刀波b1s1g1l1暮雨清风借 夏服 中间服 冬服 盛夏服 护奶裙 无领西 毛衣 衬衣 领结  格裙 日制 校供熊家熊之工作室你别睡别睡森女想去海边森女部落三扣三三哥家熊姨星彩虹安可原创逗酱芋头先生没烦恼布衣酱 借xd大刀退坑科幻甜心兔兔小天使蜜桃熊软芙芙许愿星小心愿小猫咪梅露露绵阳泡芙糖果超甜告白奶糕结缘狂响深海之约甜心童话可可星小心柚小甜柚小奶糖咩咩兔甜美可爱Lolita 借小奶糕黑莓糕糕樱花草莓腐烂草莓牛奶团子珀尔公主芙拉小姐啵啵熊星月草莓斑点狗奶油甜酒小爱神丘比特哈利露鸭三周年前任限定蓝三花猫爱丽丝姐姐大头娃娃镭射款掉队小熊咕噜噜原创设计厚底鞋芭蕾猫猫绵阳泡芙小艾达软软猫有点圆（全新）白糖少女初恋Lolita 码借梅露露 人形师 占星猫 天使柄 爱神乐章 古董人偶 小熊玩具 猫猫与情书 轻飘飘占星猫 天使街道  辛波斯卡 塞壬悲歌 塞壬之吻 皇冠熊 沉汐之冠 天使街道 天使柄  爱神乐章 星月草莓 水母贝壳 婴梵塔 小白云 人形师 融心巧克力 草莓酱的野餐 彩虹诗 肥啾 睡美人 凡尔赛 摇篮曲 樱花草莓 占星猫 洛可可 提拉米苏 摇篮曲 占星猫 摇篮曲 凡尔赛少女 梦回凡尔赛  安妮的早餐 小裁缝 lo鞋 jk鞋jks  jk制服借桃子派对森女想去海边 三扣三 eggsshop 蛋蛋家 林小宅向日宅物 没烦恼很幸福小模特同款 大喜自制 陆小团团花吉 最小的海 瘦竹竿 馨帮帮 爱爱丸 阔色 蛋挞家 你别睡别睡 小树家 大sim小sim 万事都如意 miss qiuqiu秋家 卷卷家 朴正义 渔不二 萌量不足 蜜糖宝宝家 么宁 安小落 苏安家 乌77 圆脸小羊羊 黄不烦 奶兔星球 MLZ 安可工作室 恩妮软萌 肉完 宋黛 范智乔 古屋兔丸 荒野家 波豆狗 媌老板 空气猫日记 ruibbit 酱果 古啦啦啦 岛屿日记 like a doll 港妹潮人馆 PPHOME 玩味少女装 kumayes Offbeat Nancy 阿姨家熊姨家二懵家 梗豆物语告白气球家爱丽丝 虎斑猫三段虎斑猫切替小奶糕咕咕甜品小奶糕 可爱鬼 咕咕甜品 甜心汪汪 熊熊又饿了 可爱鬼 生日派对 爆米花 天使柄 侦探熊 软绵绵 莓熊物语 忘兔约定 爱丽丝 星月草莓 樱花草莓 三岁半 俄罗斯套娃 芙拉小姐 爱丽丝姐姐 爱丽丝妹妹 牛奶团子 奶油甜酒 童话味蕾 钻石甜心 霜糖甜心 猫与情书 洋娃娃与千纸鹤 甜心救援队 虎斑猫  渐变云 啵啵熊 #JK,136.0,天津,9,https://www.goofish.com/item?id=624495001150&categoryId=126860572
王一博属性叶先生，已截团 王一博白画日记 10cm 王一博10cm娃 王一博 借tag：白画日记 啵奥豹 好运来 击宝 小旋风 咖啡豆 啵灵灵 蜜瓜包 咖啡豆 小旋风 福蛋  蜜瓜包 猪猪空 啵粒橙 蝴蝶杰 奶油猪 咕噜仔 珍猪丸 啵古力 小趴菜 momo 小茶...,85.0,湖南,14,https://www.goofish.com/item?id=925907557578&categoryId=202035401
【佛挂】挂个诡秘之主娃柜 有些想跑路，因为娃口较多+有点收藏癖，直接整柜挂下，可按角色属性拼盘是按角色属性拼盘而不是角色属性单拆的意思不单拆啦，主要是想断舍离跑路随缘佛系挂，目前还会继续买喜欢的诡娃，主要是蒙属性和蚂蚁体复数娃不需要的话我可以自留一只收藏个别蒙娃有h收，大多原价叠邮左右，整柜出会直接自刀1k。标价无异议，整柜在五位，欢迎有意向和预算的宝和我聊pvo后续也有可能改变主意不出下架了（。有小部分订单娃，包里不含，到手再出诡秘属性娃：阿蒙属性：泡泡蒙努蒙努蒙x2小浣蒙干脆面x2掌中小鸦x2小鸦脆面x2蒙咕x2蒙啾鸦哒鸦头报时小蒙x2没逝小蒙x2光辉小错  有mkm属性蚂蚁鸦黑棉乖乖蒙指偶蒙cuter阿蒙什蒙x2布偶蒙蒙蒙豆鼠鼠我鸦x2深情鸦x3葡萄鸦x2哎鸦  有mkm属性404鸦定金口袋小蒙   有mkm属性蒙→蒙↑特洛伊环游蒙蒙x2蒙鼠我惹瘟疫蒙蒙肠x2错误章鱼肠蒙蒙远山咩噗蒙子Error蒙仔蒙仔spx2芝麻酥x2普罗咩咩x2蛾子蒙蒙蒙羊x2deceiver邮差蒙蒙鸦鸦蒙小核蒙鸦鸦团定金x2趴趴鸦定金x2领居二侄子x2pvo嘤定金  有mkm属性偷心小乌鸦x2时之砂x3屑屑你鸦大蒙蒙蒙谷海军x2造属性：当当当当x2观心格里高定金x3克属性：昨日重现克叽不煮努克努克克努克努qq肠qq屑小瑞兔奶糖小梅软糖小曼咖啡糖克仔qq糖克仔扣扣糖小夏太妃糖酒心糖泰斯十克橘猫克集吧猫口袋小克  有mkm属性黄宝石开摆小克提线小格提线小格sp数调闪耀小愚TT小愚立耳咕噜甜冰肠巧克哩x2divinerx2身是客x2炸夏球咩噗周橘子周斯帕罗先生愚游蝶梦马甲之主梅豆糕坏猫克叽寄几克克肠sp刚起床原版克克肠生气肠屑屑肠喵喵虫灰雾之下百奇兔兔疯狂小格兔伦属性：小伦舒芙蕾x2嗷呜小伦+复数数调苹狗努伦努伦魔狼来了红属性：小犬座红天使cuter梅迪奇orion猎人红红红豆馅饼梅道理有底气数调猎火燎原门属性：没门领航之门融星小门gentle门海盐芝士其余属性：晴天奥奥闪耀小奥数调（流了）隐星小雅审判小休阳光小戴小埃抖露埃血旺怀特伯爵小埃同学困困小佛流汗佛豆小尼霉豆烈焰大人千金狗王疑心暗诡重启乌乌fortuna生椰奥奥动脉血诡秘属性娃衣：欺诈师error先生外套蒙什恶作剧乌鸦10g廷根克诡秘侍者魔术师tag：诡秘之主 诡秘 棉花娃娃 阿蒙 克莱恩 伦纳德 梅迪奇 门先生 亚当 白造 天尊 达尼兹 埃姆林 奥黛丽 塔罗会 5664,2.0,广东,12,https://www.goofish.com/item?id=963245970106&categoryId=202035401
咕噜猫猫酱的陆沉 兔子先生 标价为不包 不包任何瑕疵 有兔子背包和特典 均全新未拆  和隔壁六六小豆丁链接一起出,40.0,辽宁,0,https://www.goofish.com/item?id=943381174387&categoryId=126860292
