标题,价格(元),所在地,想要人数,商品URL
拓普康，Hiper II G等GNSS，箱子，有破损，凑合能 用。,38.0,拓***器,8,https://www.goofish.com/item?id=764133422921&categoryId=126854048
#自行车配件 #骑行装备   喷雾运动水杯夏天健身户外骑行杯儿童上学喷水水壶 1、双层隔热保冷，持久性很强！ 2、大容量,26.0,北***元,5,https://www.goofish.com/item?id=864132643945&categoryId=126866877
全新闲置联塑明线双盒子。低价出售  感兴趣的话点“我想要”和我私聊吧～,3.0,t***d,1,https://www.goofish.com/item?id=864884470093&categoryId=126856363
转卖一台300ml热熔点胶机！300×300×100行程的机 器！二手点胶机！单工位点胶机！功能正常！有保修！,800.0,点***商,22,https://www.goofish.com/item?id=774592140579&categoryId=126864635
鹰图INOXTO水袋户外便携折叠大容量储水囊折叠水袋带1米吸 管防尘盖  颜色：白色 两种尺寸： 1.5L 2L  赠送,34.9,食***7,169,https://www.goofish.com/item?id=772049411429&categoryId=126856841
悦美信美白祛斑套盒 专业美白祛斑 美容院拓客化妆品套盒   悦美信美白祛斑套盒 专业美白祛斑 美容院拓客化妆品套盒 悦美,307.0,大***计,648,https://www.goofish.com/item?id=919465783385&categoryId=126860006
白色弹力椅套，出售，有1200个，八层新，  感兴趣的话点“我想要”和我私聊吧～,3.0,沈***心,10,https://www.goofish.com/item?id=927996236861&categoryId=126858623
新款高尔夫Tit衣服包杂物包户外旅行golf大容量衣物包独立 装鞋,189.0,宝***品,3,https://www.goofish.com/item?id=800012976988&categoryId=126866200
#DJI/大疆 DJI大疆御mini3pro桨叶 6030  F螺旋桨叶 迷你mini 3，mini4pro 桨叶原厂 ,28.0,凌***点,0,https://www.goofish.com/item?id=937175473308&categoryId=202153327
天堂电动摩托车雨衣双人款，加大加厚长款，全身防暴雨设计。带护 脸+遮脚功能，可拆卸双帽檐，适合男女通用。无异味，不漏雨，,45.0,小***儿,0,https://www.goofish.com/item?id=939485262660&categoryId=126860465
仿古老旧交椅头把交椅主人椅一对，全榫卯结构。牛毛纹清晰，包浆 醇厚细腻温润。细节到位，规格尺寸：长62厘米，宽42厘米，,1200.0,仿***具,9800,https://www.goofish.com/item?id=905201873298&categoryId=126866845
路亚钳还有七把，十元一把。打包优先私聊。  感兴趣的话点“我想要”和我私聊吧～,10.0,一***亚,3,https://www.goofish.com/item?id=838157186101&categoryId=126856699
捡漏【卡式炉气罐250克】进口气便携式卡式炉气罐户外卡磁炉丁 烷液化气燃气气体小气瓶煤气罐  商超同款，撤柜捡漏，全部清,19.85,冰***蓝,227,https://www.goofish.com/item?id=693937834382&categoryId=126856754
特价[hot]宝宝餐椅安全带[hot]  通用儿童固定带便携式外出绑带婴儿就餐辅助腰带 妈妈带娃好帮手[火] 一岁内宝宝,5.9,我***贝,2,https://www.goofish.com/item?id=908173880206&categoryId=126860918
适合大疆DJI MIC专用胸麦话筒防噪毛衣  麦克风支架防风毛套  全新独立小包装！一个11.5，两个20 蓬松柔软，真,11.5,哎***了,41,https://www.goofish.com/item?id=776519280956&categoryId=126864994
保时捷718卡钳罩Macan迈凯/帕拉梅拉/卡宴等保时捷改装 专用刹车卡钳罩卡钳盖 专车专用卡钳罩，合金材质。  真正的,115.0,浙***的,6,https://www.goofish.com/item?id=726116549023&categoryId=126860659
美国精神航空 边疆航空 达美航空 美联航 美国航空 西南航空  阿拉斯加航空 阿联酋航空 北欧航空 西班牙伏林航空 夏威,100.0,煮***了,42,https://www.goofish.com/item?id=838317931863&categoryId=201457306
车载狗窝狗笼dodopet坐车神器后备箱笼子大中小型宠物安全 座椅猫笼可折叠 移动狗窝  S码 51*33*33 CM适,193.0,宠***限,14,https://www.goofish.com/item?id=794256511505&categoryId=126854753
田岛鲤鱼钳10寸25厘米，日本田岛品牌原装正品实体店样品没包 装了清仓处理捡漏的来,29.0,昂***萄,7,https://www.goofish.com/item?id=810826249021&categoryId=126864591
工具断水龙反牙丝取丝器头水管取器断头出丝锥滑螺丝…4分管用  感兴趣的话点“我想要”和我私聊吧～,4.3,黑***堇,0,https://www.goofish.com/item?id=730907362996&categoryId=126864411
