标题,价格(元),所在地,想要人数,商品URL
全新多特瑞精油周边产品   收纳包  风琴化妆包  陶瓷茶具4个 陶瓷茶具套组1组,10.0,瑞***尹,4,https://www.goofish.com/item?id=953305003727&categoryId=126860040
出一款腕力桌，颜色为黑红色拼接，非常抢眼，适合用于腕力训练或 比赛。桌面坚固耐用，配有25公斤的重量，让你的锻炼更加有挑,398.0,五***铺,5,https://www.goofish.com/item?id=934245400070&categoryId=126866611
日本狮王休足去浮肿足贴休足时间脚贴足底贴清凉解压缓解疲劳日本 游玩带回亲测好用 6贴35元 12贴59元 西工区可自提,35.0,家***贝,16,https://www.goofish.com/item?id=923231509563&categoryId=126860160
特步高端速干跑步帽。特步国人竞速帽，都是全新都有透气孔，LO GO有夜光。轻薄透气材质， 看清楚了拿图问价格，拿图问价格,58.0,哈***错,27,https://www.goofish.com/item?id=944906432250&categoryId=126866600
理发店转灯超亮节能LED户外防水美发店挂墙式六角复古宫灯小蛮 腰,101.67,t***n,0,https://www.goofish.com/item?id=922674155840&categoryId=126862056
凯芙拉风筝线2号八股编织  感兴趣的话点“我想要”和我私聊吧～,150.0,电***珀,42,https://www.goofish.com/item?id=903343055407&categoryId=126912132
科颜氏星穹铁道联名福袋（试用装）内含金盏花爽肤水3ml、高保 湿霜3ml、金盏花洁面3ml，另送2张透卡  全新未使用，,11.0,茂***皮,1,https://www.goofish.com/item?id=943249464352&categoryId=126860277
"AUPU奥普铝框平板灯，30*60平板灯ZTLD1124C， 24w,色温5700k，嵌入式LED集成吊顶灯具，正品",36.0,1***8,85,https://www.goofish.com/item?id=962402328232&categoryId=126858396
德高瓷砖胶，防水，美缝，腻子粉，批发与施工  感兴趣的话点“我想要”和我私聊吧～,108.0,德***工,0,https://www.goofish.com/item?id=711329097837&categoryId=126912086
古董的日本千住焊锡丝，本土版本  实物如图，库存时间久了，成色外观一般般，对于焊锡来说算得上古董级别的了，整卷1公斤，用,90.0,m***4,1,https://www.goofish.com/item?id=951877864470&categoryId=126856176
大连底播海参即食，少量余货甩卖营城子纯海水自家养殖，不是网箱 、吊笼货，今年鲜参贩子价格压得低，所以自己试着做点即食自己,140.0,大***农,0,https://www.goofish.com/item?id=870171987004&categoryId=201458016
"全新包邮 粉色高级感云朵棉睡衣女春秋款 
舒适亲肤家居服套装
换季了，这款刚好合适
有码数可选，颜色就粉色",25.0,K***酱,9,https://www.goofish.com/item?id=967020740748&categoryId=126860514
启迪蘑菇钉玩具，红色底板配白色网格板，  底板完好，钉子齐全，适合小朋友锻炼动手能力。闲置出，价格可聊，同城自提更优惠！,25.0,小***铺,2,https://www.goofish.com/item?id=944175307504&categoryId=126862882
乔司西瓜，西瓜巨好巨甜。支持现摘  感兴趣的话点“我想要”和我私聊吧～,15.0,T***6,37,https://www.goofish.com/item?id=943675060529&categoryId=126916217
VDW机用镍钛锉，混号21mm一板，混号25mm一板，两板3 00送另4支（蓝21，2支；蓝25，1支；白25，1支）。,300.0,D***n,2,https://www.goofish.com/item?id=963113462937&categoryId=126864529
IKEA宜家木头人，关节灵活可调，适合摆动展示，全新急出！小 木偶高约31cm，底座7cm，适合居家装饰或艺术创作~,10.0,橙***飞,12,https://www.goofish.com/item?id=914338261150&categoryId=126920133
刚洗出来的清水大朵白鹅绒   一两装，全新未使用，适合填充羽绒服或羽绒被，羽绒睡袋，羽绒枕等，绒朵大而白，品质优良。自家,38.0,羽***心,150,https://www.goofish.com/item?id=941352780003&categoryId=201451903
宁桥牌8寸多功能卡簧钳  扩张钳子  工业级内卡外卡  轴用 卡环 挡圈开口钳 共有8把，全部都要40元,6.0,眼***1,15,https://www.goofish.com/item?id=906161284846&categoryId=126864491
生苗芽菜神器，出口不做了有大量现货，有要的联系标价就是卖价  感兴趣的话点“我想要”和我私聊吧～,3.0,宁***7,4,https://www.goofish.com/item?id=817742885442&categoryId=126864773
花生枯花生麸花生饼 花肥专用版 5块/一斤 5斤起包邮 榨油 坊现榨花生枯，营养丰富，肥力十足，拿来种花种菜效果都好，还,5.0,菡***苑,0,https://www.goofish.com/item?id=959132712976&categoryId=126860556
