标题,价格(元),所在地,想要人数,商品URL
新疆烤奶皮，高钙无蔗糖的健康零食。外酥里软，奶香浓郁，格子纹 路超好看。一包独立包装，方便携带。喜欢的小伙伴赶紧下单  ,25.0,卖***柴,1,https://www.goofish.com/item?id=946857404302&categoryId=201451122
【涂鸦智能】全屋智能解决方案 北京时间2021年3月18日21点30分，Tuya正式挂牌纽约证券交易所，成为全球IoT云,100.0,涂***厂,10000000,https://www.goofish.com/item?id=640468513563&categoryId=201418804
汉佰草纤本家热敷包腰带10斤，20斤，40斤，杜仲肾包，实体   汉佰草纤本家热敷包腰带10斤，20斤，40斤，杜仲肾包,103.0,T***9,22,https://www.goofish.com/item?id=792316166397&categoryId=126866092
轮滑平花训练杯防风桩子个路障脚标溜冰鞋障碍桩角标障碍物道具绕 花桩10个10元包邮！ 20个20元包邮！ 30个25元包,10.0,文***发,35,https://www.goofish.com/item?id=613559320563&categoryId=126866269
厂家直销床垫，纯天然棕垫，环保3E棕垫 厂家直销订做高档床垫，席梦思床垫，纯天然棕垫，环保3E棕垫，儿童棕垫！     ,400.0,福***厂,1380,https://www.goofish.com/item?id=595811565255&categoryId=127052040
补光灯  感兴趣的话点“我想要”和我私聊吧～,8.0,欧***汁,15,https://www.goofish.com/item?id=936169035475&categoryId=126854160
德商必酷be quiet! 机箱风扇   德商必酷be quiet! 必酷SHADOW WINGS 2 WHITE PW,105.0,M***选,2,https://www.goofish.com/item?id=832201869863&categoryId=126856294
薄壳巴旦木新货纸皮巴旦木杏仁干果坚果休闲零食大礼包   新货薄壳奶油巴旦木罐装大颗粒杏仁零食小吃休闲炒货坚果大礼包  5,12.9,紫***-,28,https://www.goofish.com/item?id=707773085197&categoryId=201458024
深山新鲜巴戟天，鸡肠薯，需要的联系，不包邮。  感兴趣的话点“我想要”和我私聊吧～,28.0,淘***宝,278,https://www.goofish.com/item?id=585459330127&categoryId=201451324
日式哈雷复古头盔夏季巡航摩托机车半盔瓢盔男女电动车安全小盔体  感兴趣的话点“我想要”和我私聊吧～,107.0,海***m,0,https://www.goofish.com/item?id=865881654488&categoryId=126856228
【50米/卷有夜光】户外超长50米全夜光+反光绳野营风绳加粗 天幕固定防风帐篷绳现货   看清喔，这个是直径5mm粗的，,46.0,东***米,58,https://www.goofish.com/item?id=726638724285&categoryId=126856956
"打气筒 
如图，带一个金属针。",3.0,议***复,0,https://www.goofish.com/item?id=963916554254&categoryId=126866317
宜婴山茶花纸尿裤，拉拉裤！清货价，不接急单！不接急单！！S. M.L.XL.XXL.XXXL 两包一箱，70包邮！两箱4,35.0,抗***仔,70,https://www.goofish.com/item?id=896032513467&categoryId=126864956
"放哈敦煌蜜语杏干100克，塞上驼铃沙枣100克，飞将珍果杏仁 100克，甄选敦煌李广杏，原生态古法工艺
满50元包邮，无",9.9,放***邮,200,https://www.goofish.com/item?id=963997042152&categoryId=201454121
缅甸花梨木茶盒  尺寸：23.5-21.5-5 生磨，无漆无蜡,168.0,红***发,5,https://www.goofish.com/item?id=725055850745&categoryId=126862398
璐璐凯帝行李箱女24寸新款男士结实耐用26拉杆箱20寸旅行密    型号；c520 行李箱   不同款式尺寸不同价  全,259.0,品***店,499,https://www.goofish.com/item?id=884465851439&categoryId=126862775
"国产蓝色防静电袋～ 

有3种大小规格尺寸～

规格尺寸：1）300*305㎜、2）313*455㎜、3）400*400",20.0,H***l,6,https://www.goofish.com/item?id=824457503732&categoryId=201451003
飘逸杯家用泡茶壶大容量分离杯茶水壶玻璃茶壶新款功夫茶具全套装  感兴趣的话点“我想要”和我私聊吧～,18.8,努***乐,2,https://www.goofish.com/item?id=947275421979&categoryId=126854589
宝骏510原装多功能方向盘，带真皮包裹，带音量调节和巡航控制 按键。拆车件，成色如图，功能完好。适配宝骏510车型，安装,228.0,五***件,0,https://www.goofish.com/item?id=954029670845&categoryId=126916093
正品molten摩腾战术板 篮球足球排球手球战术板！摩腾教练 指挥盘指挥板！全新正品！,239.0,乖***贝,12,https://www.goofish.com/item?id=697174183613&categoryId=126866321
