标题,价格(元),所在地,想要人数,商品URL
比亚迪升级15.6寸旋转屏中控屏专用黑色垫圈    上新黑色垫圈+全套加长螺丝   比亚迪宋plus屏幕垫圈    原车,44.91,小***车,60,https://www.goofish.com/item?id=796437372336&categoryId=126864356
不锈钢商用切片机，手动电动两用！适合奶茶店切水果蔬菜土豆片， 切片均匀省力。可以切土豆片、柠檬片、水果片，切片厚度可调。,367.68,x***9,0,https://www.goofish.com/item?id=966998408537&categoryId=201455605
大众途锐仪表台下护板支架 老途锐仪表台护板 脚窝灯底座 仪表 台下饰板护罩支架,280.0,途***件,10,https://www.goofish.com/item?id=697626114663&categoryId=126860921
单联三齿3脚电位器 B10K音量电位器花柄长20MM 适用: 功放/音响/音响调节音量  单价：1.2/个（不包邮） （,1.2,t***c,2,https://www.goofish.com/item?id=739121174663&categoryId=126856610
服务内容：羽毛球陪练  深圳南山传奇附近，羽毛球陪练，改动作，  主打一个耐心负责。  陪练 陪打 喂球 都可以   1,100.0,复***主,0,https://www.goofish.com/item?id=896676902360&categoryId=201459012
启辰D50带灯LED门槛条迎宾踏板灯踏板发光装饰脚踏板  整套价格包邮，一套 4 片装，一门一片贴在门槛漆面位置上，不锈,38.0,闲***货,100,https://www.goofish.com/item?id=814848743618&categoryId=126860708
石榴榨汁机手动石榴榨汁神器柠檬榨汁器挤压土豆泥神器榨石榴汁机  感兴趣的话点“我想要”和我私聊吧～,21.55,连***吖,0,https://www.goofish.com/item?id=798489688030&categoryId=126854970
上汽大通g20后桥总成，实物拍摄，拍下即发，邮费到付。不卖汽 车五大总成。,100.0,左***左,2,https://www.goofish.com/item?id=828704195891&categoryId=126860808
家用电器电源线，每桶都是不一样的接口。，因闲置出售，只限石家 庄同城自提的。也可以把图片发过来，我给你找找。,3.0,1***品,1,https://www.goofish.com/item?id=800076154523&categoryId=126856621
适配戴森Dyson卷发棒扩散风嘴，闲置处理  感兴趣的话点“我想要”和我私聊吧～,18.8,忘***子,0,https://www.goofish.com/item?id=962204833779&categoryId=126860226
5吨切管机千斤顶消防管道切管机用千斤顶  全新配件 全国包邮 优惠处理了,75.0,游***鱼,1,https://www.goofish.com/item?id=921506686014&categoryId=126912128
雷斯达萨克斯哨片Reedstar碳纤维材质哨片  全新 德国雷斯达专业树脂哨片！ 品牌型号 中音，次中音 新旧程度 全新,198.0,一***8,260,https://www.goofish.com/item?id=674978821487&categoryId=126858888
全新编织纹理地胶便宜出，灰色款，材质结实耐用。适合商铺、仓库 、工厂等场所使用，表面防滑耐磨。现货库存处理，价格超值，量,20.0,各***应,128,https://www.goofish.com/item?id=948451040442&categoryId=126860917
电动车车筐加大版  感兴趣的话点“我想要”和我私聊吧～,25.0,胖***哒,40,https://www.goofish.com/item?id=802913340199&categoryId=126856149
东彩 单人气压高箱床卧室简约现代储物床收纳日式床 1米*1. 9米 丰台角门西附近自取 网图 需要的话拍实拍图,150.0,君***下,0,https://www.goofish.com/item?id=967249220014&categoryId=126866716
闲置首饰盒2元起，价格在图上，自提  打包40包邮 海淀区牡丹园地铁站自提,40.0,是***爱,7,https://www.goofish.com/item?id=698409888418&categoryId=126914218
闲鸟车载床垫汽车车内后排睡垫车用折叠床自驾野营旅行床轿车SU V后座,150.0,心***来,0,https://www.goofish.com/item?id=919374799457&categoryId=126860913
德国WIDIA 镗刀头 PTFNR16CA-16  感兴趣的话点“我想要”和我私聊吧～,100.0,上***店,9,https://www.goofish.com/item?id=642443487789&categoryId=201458207
【9.8包邮】新款竹炭速燃碳无烟烧烤煮茶围炉碳  新款速燃果木炭，1秒引燃，2分钟开始烧烤，90分钟有效使用时间！  大,9.8,t***4,0,https://www.goofish.com/item?id=961828721982&categoryId=126856025
【24斤】爱护婴儿抑菌洗衣液新生儿洗衣液宝宝专用抑菌洗衣液2 L*6瓶,105.0,@***1,169,https://www.goofish.com/item?id=692771322595&categoryId=126864873
