标题,价格(元),所在地,想要人数,商品URL
iPad到手刀老玩家了 所谓安全小卫士 防骗中心 谨防上当受 骗都是同一个骗子 恶意诋毁自己用其他号收回去到手刀  给大家扒出来了自行分辨吧,2345.0,山东,5,https://www.goofish.com/item?id=953036196866&categoryId=126860614
iPadPRO防骗知识，安全小卫士，iPad骗子到手刀。 注意此人是骗子，在闲鱼卖ipad平板的注意啦!有套路! 有一位IP河南的，现在的昵称为安全小卫士，之前就叫防骗中心。套路如下：发一大堆文字说你的平板被骗子买了，需要你截图，看完必须回复!截图完就说这个人多么多么不靠谱，怎么骗你。就是利用卖...,3000.0,四川,3,https://www.goofish.com/item?id=951441357451&categoryId=126860614
全新正品虎贝尔 e360pro安全座椅儿童0-7-12岁 [红圆][红圆]标价是老款e360旧的价格，需要其他型号询问  产品介绍 [上]新生儿脊椎小卫士组合式的分龄护脊内衬垫，贴合不同阶段宝宝背部曲线 更好承托腰背，反向170°超大躺角 搭配可调节头枕 真正做到舒适不窝脖！ [下]...,1880.0,北京,27,https://www.goofish.com/item?id=892545005024&categoryId=126864817
welldon惠尔顿智转2PRO+智能通风儿童安全座椅0-7 岁车载宝宝isize#安全座椅 #安全行车必备 [钉子][钉子]惠尔顿智转系列提供7年质保 ，终身维修。事故换新服务，全新未拆，正品带防伪【智转2pro+智能双通风安全座椅】[右]升级的分龄智能双通风系统就像随身携带了小空调，双风口循环送风，手机app和按键2种操控模式[右]贴身是兰精天丝面料 排湿导汗、透气又舒服	[右]除了舒适度 安全感buff也是拉满了Hawk-eye鹰眼智能监测系统 就像有个小卫士时刻盯着 会提示是不是装好了[右]手机app还可以智能操控通风、实时查看座椅安装使用状态、还有成长管家和防遗忘提醒~~[红圆][红圆]燕麦妈妈补充一条：咸鱼所有价格均为大件跑量，利润微薄，请所有客户下单前自行做好产品功课，所有产品非质量真假问题不退不换。买家个人原因的不喜欢不合适等等，恕不支持也不不接受无理由退换货！如果您是完美主义，想要无理由试用，建议绕路旗舰店。下单即默认，不接受事后扯皮！谢谢,1999.0,浙江,9999,https://www.goofish.com/item?id=964205573123&categoryId=126864817
忍痛割爱！超高端智能跟随婴儿车甩卖 带娃出行还在手忙脚乱 这款婴儿车绝对是你的救星！  智能跟随黑科技：融合先进的传感器与精准算法，开启跟随模式后，它就像宝宝的专属小卫士，紧紧跟在你身后，保持安全又贴心的距离 。逛街、遛弯，再也不用一手抱娃一手推车，彻底解放双手！座椅依照...,5400.0,湖南,0,https://www.goofish.com/item?id=895089999406&categoryId=126864856
出bebebus天文家Pro安全座椅 宝宝大了换大童座椅啦，出闲置bebebus天文家Pro安全座椅。   这款安全座椅是宝宝的贴心小卫士，安全性能拉满！通过了i-size和3c双重认证 ，还有isofix接口+支撑腿形成三角形结构保护，稳稳当当。全新升级的侧防盾，就像给...,1930.0,江西,2,https://www.goofish.com/item?id=950356283145&categoryId=126864817
新型袖珍式气体报警器－SNOOPER mini，又称为“泄漏 侦探小卫士”，是德国坚威公司专门为燃气管线施工和维护者、室内外管线燃气检漏人员、抄表员以及其他可能进入燃气场所的人员的人身安全而设计。仪器轻便小巧，可以放在衣服口袋里随身携带。,4000.0,山东,1,https://www.goofish.com/item?id=934911520728&categoryId=126864691
2025国防小卫士军事夏令营，专业军事训练营，7天到30天不 同课程可选。专业军事教官带队，军事训练+素质拓展，让孩子体验军旅生活。营地环境优美，配套设施齐全，安全有保障。价格实惠，7天1980起，详询客服。欢迎各位家长咨询，让孩子度过一个有意义的暑假！,1880.0,河南,1980,https://www.goofish.com/item?id=932019211238&categoryId=201461105
【官仓直发】HBR虎贝尔E360pro儿童安全座椅0-7-1 2岁宝宝婴儿车载汽车用通风全新  ✅正品带防伪可查，当天秒单  ✅标价为e360九九新  产品新升级特点：  1️⃣【新生儿脊椎小卫士】 ✔️组合式的分龄护脊内衬垫 贴合不同阶段宝宝背部曲线 更好承托腰背 ✔️反向170°超大躺角 ...,1880.0,北京,1,https://www.goofish.com/item?id=900691296201&categoryId=126864817
官仓直发HBR虎贝尔E360pro儿童安全座椅，0-12岁宝 宝适用，全新。  正品带防伪，当天秒单。  标价为e360，99新，详情咨询  产品亮点： 1️⃣ 新生儿脊椎小卫士：分龄护脊内衬，贴合宝宝背部曲线，反向170°超大躺角，头枕可调，舒适不窝脖。 2️⃣ 安全感满满：德国E1 i-S...,1880.0,上海,0,https://www.goofish.com/item?id=900556913954&categoryId=126864817
小米车主看过来！给爱车贴上车衣，秒变“防护小卫士”。防刮蹭、 抗紫外线，抵御石子、树胶侵扰，原厂车漆长久如新。贴完瞬间提亮车身光泽，高级感拉满。专业团队施工，无痕贴合。现在下单享优惠，还送福利，让爱车颜值与安全双在线，别错过，速来！进口原材料车衣低价处理。,1999.0,四川,0,https://www.goofish.com/item?id=943821291852&categoryId=126860711
HBR虎贝尔E360pro儿童安全座椅0-12岁宝宝婴儿车载 汽车【龙队同款】 E360Pro【新品上市】  可选颜色：棋盘格绿 | 棋盘格黑 正品可查防伪，售后质保同旗舰店，支持七天无理由  【新生儿脊椎小卫士】 ✔️组合式的分龄护脊内衬垫 贴合不同阶段宝宝背部曲线 更好承托腰背 ✔️反向170&d...,2550.0,辽宁,0,https://www.goofish.com/item?id=895952521273&categoryId=126864817
消防员山姆安全小卫士图书8本全册 其中有三本最后一页的游戏被孩子用画笔画完了 已经拍图列出来了，其他书页完好 20自取二手商品售出不退不换，玻璃心勿扰生日聚会之争/跟消防员山姆学做安全小卫士倒塌的树屋/跟消防员山姆学做安全小卫士海上观赏鲸鱼/跟消防员山姆学做安全小卫士诺曼的化石探险之旅/跟消防员山姆学做安全小卫士平安岛寻宝/跟消防员山姆学做安全小卫士诺曼的魔术表演/跟消防员山姆学做安全小卫士平安杯赛车大会/跟消防员山姆学做安全小卫士冬日乐园溜冰记/跟消防员山姆学做安全小卫士,20.0,黑龙江,1,https://www.goofish.com/item?id=916070789200&categoryId=127832004
【全新正版】 我是安全小卫士 家庭安全 江西高校出版社 沃野学前 编码：WX1202600959 书名：我是安全小卫士 家庭安全 ISBN：9787576223675 作者：沃野学前教育研发中心 编 编者： 出版社：江西高校出版社 出版日期：2022-03-01 包册数： 字数：30000 页数：40...,10.57,内蒙古,0,https://www.goofish.com/item?id=961267155056&categoryId=201544601
跟消防员山姆学做安全小卫士 四本八元 没字迹 九成新 满五十包邮,8.0,天津,0,https://www.goofish.com/item?id=932683795352&categoryId=127812005
米家漏电保护开关，安全用电的智能小卫士，超低价出！ 装修买多啦，全新未拆封米家漏电保护开关转让！品牌：米家，小米旗下，智能家居界扛把子，品质有保障，和小米智能生态无缝衔接，智能生活轻松开启。功能超强大：• 漏电保护：一旦检测到漏电，瞬间切断电源，反应速度快到超乎想象，给家人全方位安全守护。• 过欠压保护：电压不稳不用怕，自动调节，电器寿命直接延长，再也不担心电压异常烧坏电器。规格参数：适用于大多数家庭电路，兼容性超棒。产品情况：全新的，包装都没拆，配件说明书齐全，和你在店里买的一模一样。价格美丽：官网[80]元，我这里[49.9]元就出，直接省下好几十，性价比爆棚。发货快：下单后48小时内发货  偏远地区不包邮别犹豫啦，赶紧私聊我下单，让安全与智能走进你家！,49.9,山东,80,https://www.goofish.com/item?id=946795333473&categoryId=126856379
幼儿园安全教案包括安全小卫士教师用书1-6册PDF文档，包含 第1-6册教学课件PPT，幼儿园安全教育动画109个，幼儿园安全教育专题资源包。内容很全，适合幼儿园教师日常教学参考。百度网盘发货，拍下即可获得链接。资料清晰完整，一经售出不退不换。需要的直接点我想要，立即购买就可以，打开链接保存到自己网盘，可永久观看。,6.0,山东,0,https://www.goofish.com/item?id=965253663391&categoryId=202036301
正版跟消防员山姆学做安全小卫士系列图书，浙江少年儿童出版社出 版，包含生日聚会之争、平安岛寻宝、倒塌的树屋等多个有趣的安全教育故事。全新彩绘版本，画面精美，内容丰富，适合小朋友阅读。当时买的时候很贵的80一套。现在低价出售 喜欢的可以私聊，同城自提~诺曼的化石探险之旅/跟消防员山姆学做安全小卫士,35.0,河南,80,https://www.goofish.com/item?id=953445735186&categoryId=127832004
跟消防员山姆学做安全小卫士 全套8册 几乎全新,39.0,福建,0,https://www.goofish.com/item?id=944506927658&categoryId=127832004
诺曼的魔术表演/跟消防员山姆学做安全小卫士  8册 感兴趣的话点“我想要”和我私聊吧～,60.0,浙江,144,https://www.goofish.com/item?id=932095079757&categoryId=127832004
安全守护小卫士：食品级304不锈钢材质，0有害析出，耐高温耐 腐蚀，宝宝啃咬也安心！ ​        防摔抗打超耐造：加厚不锈钢一体成型，从餐椅跌落也不易变形碎裂，告别玻璃陶瓷的易碎烦恼！ ​        分格设计超贴心：科学分区不串味，主食、蔬菜、水果各就其位，培养宝宝自主进食好习惯！ ​   ...,8.0,广东,0,https://www.goofish.com/item?id=944422951512&categoryId=126864816
安全小卫士 感兴趣的话点“我想要”和我私聊吧～,50.0,陕西,0,https://www.goofish.com/item?id=942565241287&categoryId=126864451
幼儿园小班暑假安全教案+PPT  安全小卫士上线啦 幼师姐妹看过来  刚给小班整的暑假安全教案+配套PPT新鲜出炉！   教案里把水边、马路、陌生人、家里烫物这些暑假常见危险，用超简单的方式教娃识别 像教防溺水，拿带红叉的小河池塘图，配合夸张表情动作，娃一下就记住不能靠近～   PPT...,9.9,天津,0,https://www.goofish.com/item?id=952357652687&categoryId=202036301
（秒发）汽车世界之安全小卫士全集国语无文幕高清1080p 佰度网盘自动秒发！注意:点击直接购买，无需等待，自动发货！,0.01,广东,0,https://www.goofish.com/item?id=958438104600&categoryId=126864807
安全小卫士教师用书1-6册PDF文档，包含第1-6册教学课件 PPT，幼儿园安全教育动画109个，还有幼儿园安全教育专题资源包。内容齐全实用，适合老师日常教学参考。百度网盘发货，拍下即可获得链接，想要的都可发我，售出概不退货。需要的直接点我想要，立即购买就可以，打开链接保存到自己网盘，可永久观看。,6.0,山东,0,https://www.goofish.com/item?id=966436333663&categoryId=202036301
【全新正版】 我是安全小卫士 幼儿园安全 江西高校出版社 沃野学 编码：WX1202600006 书名：我是安全小卫士 幼儿园安全 ISBN：9787576223682 作者：沃野学前教育研发中心 编 编者： 出版社：江西高校出版社 出版日期：2022-03-01 包册数： 字数：30000 页数：4...,10.56,河南,0,https://www.goofish.com/item?id=961273043421&categoryId=201544601
米家漏电保护开关，安全用电的智能小卫士，超低价出！可讲价 买 多优惠偏远地区不包邮,49.9,山东,80,https://www.goofish.com/item?id=944754020377&categoryId=126856379
知乎版，十万个为什么（安全小卫士、漫游太空、养成好习惯、生活 中的魔法、动物派对）五本18包邮,18.0,上海,0,https://www.goofish.com/item?id=964352713614&categoryId=127832004
谨防上当受骗  防骗中心(安全小卫士) 此人ip河南郑州/江 苏，冒充咸鱼平台客服，疑似诬陷多名咸鱼用户，小心为上。不信谣不传谣，他的话不代表咸鱼平台人工客服。大家小心这个骗子！他想要，先恐吓，后面自己拍或者换自己小号来拍     关联iPad/ipadpro/ipadair/ipad mini/iP...,999.0,山东,8,https://www.goofish.com/item?id=949828352667&categoryId=201461105
互联网安全小卫士上线啦！ 加密流量检测、入侵检测、恶意流量检测，木马检测、cs检测，均可联系我 让网络空间更安全，为你保驾护航,20.0,宁夏,1,https://www.goofish.com/item?id=950506477214&categoryId=201451013
【全新正版】 我是安全小卫士 安全常识 江西高校出版社 沃野学前 编码：WX1202600007 书名：我是安全小卫士 安全常识 ISBN：9787576223705 作者：沃野学前教育研发中心 编 编者： 出版社：江西高校出版社 出版日期：2022-03-01 包册数： 字数：30000 页数：40...,10.1,山东,0,https://www.goofish.com/item?id=961759710772&categoryId=201544601
幼儿园优质公开课中班安全消防小卫士视频教案课件ppt 感兴趣的话点“我想要”和我私聊吧～,2.8,四川,1,https://www.goofish.com/item?id=907674460584&categoryId=202036301
儿童安全座椅，宝贝出行安全小卫士 家人们，出九成新儿童安全座椅！适用体重15 - 36公斤的小朋友，处于GROUP II - III组别阶段的宝贝都能坐。   座椅整体成色很新，没有明显磨损，小熊图案超可爱，孩子喜欢。安全带牢固，调节方便，还有水杯明显处，设计贴心。底...,51.0,广东,0,https://www.goofish.com/item?id=925147078611&categoryId=126864817
米家漏电保护开关，安全用电的智能小卫士，超低价出！ 装修买多啦，全新未拆封米家漏电保护开关转让！  品牌：米家，小米旗下，智能家居界扛把子，品质有保障，和小米智能生态无缝衔接，智能生活轻松开启。  功能超强大：  • 漏电保护：一旦检测到漏电，瞬间切断电源，反应速度快到超乎想象...,49.9,河南,0,https://www.goofish.com/item?id=939193699407&categoryId=126856379
防骗中心(安全小卫士) 此人ip河南郑州/江苏，冒充咸鱼平台 客服，疑似诬陷多名咸鱼用户，小心为上。不信谣不传谣，他的话不代表咸鱼平台人工客服。大家小心这个骗子！他想要，先恐吓，后面自己拍或者换自己小号来拍     关联iPad/ipadpro/ipadair/ipad mini/iPhone,99.0,山东,9,https://www.goofish.com/item?id=903446609532&categoryId=201461105
小卫士，安全防护小孩必备品，隐形纱窗一体 感兴趣的话点“我想要”和我私聊吧～,45.0,浙江,0,https://www.goofish.com/item?id=817103928992&categoryId=126858759
【小小警长巡逻套装】让宝贝化身正义小卫士，守护玩具城的安全！ 男宝女宝都抢着玩！  爆款核心卖点： ✓ 炫酷声光特效：红蓝爆闪警灯+逼真警笛声沉浸式出警体验！ ✔️ 安全认证：车门圆角防磕碰，摔打不变形！ ♂️ 教育亮点： 1：模拟交通事故处理培养规则意识 2：角色扮...,29.5,山西,66,https://www.goofish.com/item?id=910537715425&categoryId=126862761
防骗中心(安全小卫士) 此人ip河南郑州/江苏，冒充咸鱼平台 客服，疑似诬陷多名咸鱼用户，小心为上。不信谣不传谣，他的话不代表咸鱼平台人工客服。大家小心这个骗子！他想要，先恐吓，后面自己拍或者换自己小号来拍     关联iPad/ipadpro/ipadair/ipad mini/iPhone,99.0,河南,1,https://www.goofish.com/item?id=905635351338&categoryId=126860377
全新反锁插销夜光黑      安全小卫士来咯 闲置2套反锁插销，夜光黑配色，实用又美观～   自带免钉胶辅助贴，安装超简单，不用打孔破坏家具。免钉胶固化前怕移位？辅助贴先固定，48 - 72小时后撕掉就行，胶痕也能轻松处理。不管是装在抽屉、柜门，给重要物品加层防护；还是用在宿舍、...,9.0,山西,0,https://www.goofish.com/item?id=951353423148&categoryId=126856994
6本2元北京自提安全小卫士 感兴趣的话点“我想要”和我私聊吧～,2.0,北京,0,https://www.goofish.com/item?id=937864427417&categoryId=127832004
【深圳广告设计】安全小卫士活动来打卡咯，让宝贝们的安全意识提 高！ 安全逃生体验屋✅ 模拟灭火小体验✅ 安全碰撞小体验✅ 安全互动问答区✅ 安全骑行体验区✅,9.9,广东,0,https://www.goofish.com/item?id=827021303024&categoryId=201452208
【全新正版】 我是安全小卫士 家庭安全 沃野学前教育研发中心 编 编码：WX1202600959 书名：我是安全小卫士 家庭安全 ISBN：9787576223675 作者：沃野学前教育研发中心 编 编者： 出版社：江西高校出版社 出版日期：2022-03-01 包册数： 字数：30000 页数：40...,10.55,青海,0,https://www.goofish.com/item?id=961266791625&categoryId=201544601
简舒WiFi安全小卫士，型号G908，白色球形设计，功能完好 。外观成色不错，有轻微使用痕迹，适合家庭使用。支持WiFi连接，带S-mart标识。裸机出售，充电配件。售出不退不换，介意勿拍。,15.0,海南,0,https://www.goofish.com/item?id=965563818940&categoryId=126862919
#便民#小卫士儿童防护一体纱窗、三趟推拉金钢网纱窗，安全防护 ，防蚊虫，持久耐用 承接家装，酒店，办公楼等工程  安全又耐用是温馨家庭的守护者  定金88元，以测量实际尺寸为准,88.0,浙江,19,https://www.goofish.com/item?id=641539318919&categoryId=126858759
承接金钢纱窗  安全小卫士  量大价格优惠 感兴趣的话点“我想要”和我私聊吧～,64.0,浙江,0,https://www.goofish.com/item?id=708728010281&categoryId=126858759
米家漏电保护开关，   安全用电的智能小卫士，超低价出！ 装修买多啦，全新未拆封米家漏电保护开关转让！  品牌：米家，小米旗下，智能家居界扛把子，品质有保障，和小米智能生态无缝衔接，智能生活轻松开启。  功能超强大：  • 漏电保护：一旦检测到漏电，瞬间切断电源，反应速度快到超乎想象...,49.99,山东,0,https://www.goofish.com/item?id=947397362906&categoryId=126856379
白菜价出！FRANK循环定时插座，用电安全小卫士 品牌型号：FRANK FRKB - 24循环定时款插座   核心功能：   - 超长循环定时：0 - 24小时随心设置，机械旋钮操作简便，像给电动车充电，能精准设定时长，防止过充，有效延长电池使用寿命，还能避免因过充引发的火灾等安全问...,15.0,安徽,1,https://www.goofish.com/item?id=952680522452&categoryId=126854881
【小小警长巡逻套装】让宝贝化身正义小卫士，守护玩具城的安全！ 男宝女宝都抢着玩！  爆款核心卖点： ✓ 炫酷声光特效：红蓝爆闪警灯+逼真警笛声沉浸式出警体验！ ✓ 安全加倍：无棱角ABS材质，啃咬级安全，小手抓握超顺手！ ✓ 安全认证：车门圆角防磕碰，摔打不变形！ 教育亮点： 1...,32.9,山西,89,https://www.goofish.com/item?id=910537135815&categoryId=126912059
防骗中心(安全小卫士) 此人ip河南郑州/江苏，冒充咸鱼平台 客服，疑似诬陷多名咸鱼用户，小心为上。不信谣不传谣，他的话不代表咸鱼平台人工客服。大家小心这个骗子！他想要，先恐吓，后面自己拍或者换自己小号来拍    遇见此人的请当空气 关联iPad/ipadpro/ipadair/ipad mini/i...,99.0,河南,0,https://www.goofish.com/item?id=905928526481&categoryId=201461105
森瑞梦儿童护具四件套，运动安全小卫士[火] 森瑞梦/SUNRIMOON 滑步车护具全新上架！专为 2 - 10 岁宝贝设计，平衡车、轮滑、骑行等多场景适用✅ 硬核防护：EVA + 潜水衣材质 + 氯丁橡胶，抗冲击、耐磨，给膝盖、手肘筑牢安全屏障✅ 贴心设计：每面 3 条绑带 + 魔术贴，贴合牢固不易掉，20 - 60 斤宝贝都能穿，适配年龄长✅ 颜值在线：粉白雪人、迷彩卡通、蓝色宇航员、红色国潮 4 款潮酷花色，孩子超爱，运动也能耍帅护膝2 + 护肘2 四件套，全新正品！下单秒发，给孩子的运动安全加份保障，宝妈宝爸别错过～特价促销，非质量问题不退不换,88.0,江苏,168,https://www.goofish.com/item?id=964702659827&categoryId=126918124
正版书海上观赏鲸鱼/跟消防员山姆学做安全小卫士 书籍品相：正版7-9新，发货择优发出 找其它书：可以给我书名+主编名或书码又或书的封面图片 售后保障：质量问题我方承担，个人问题买方承担。1.已经发出的快递则无法修改地址，因已支付运费，退货则需要买家承担该运费。2.二手书利润低，不接受...,17.83,浙江,0,https://www.goofish.com/item?id=942072314935&categoryId=126854088
消防员山姆，全册8本，和山姆叔叔学做消防安全小卫士，寓教于乐 ，很有意义的好书。 家住武汉市江岸区百步亭，欢迎自提。海上观赏鲸鱼/跟消防员山姆学做安全小卫士,42.0,湖北,0,https://www.goofish.com/item?id=914482558994&categoryId=127832004
国家安全竖版儿童画电子模板 小学国防安全教育日爱国小卫士 0 81,2.0,四川,9,https://www.goofish.com/item?id=906242455864&categoryId=201454708
【全新正版】 我是安全小卫士 幼儿园安全 沃野学前教育研发中心 编码：WX1202600006 书名：我是安全小卫士 幼儿园安全 ISBN：9787576223682 作者：沃野学前教育研发中心 编 编者： 出版社：江西高校出版社 出版日期：2022-03-01 包册数： 字数：30000 页数：4...,10.94,广东,0,https://www.goofish.com/item?id=963027860634&categoryId=201544601
#香囊防蚊驱虫小卫士上线！天然草本配方，安全无害，守护家人安 心入眠。挂于床头、车内，或别在背包，实用又美观，细节之处皆是关怀。,19.9,河北,0,https://www.goofish.com/item?id=933869425510&categoryId=126858773
我的第一套安全书校园安全 做自己的安全小卫士培养自我保护意识 校园安全/我的第一套安全书,8.8,河北,0,https://www.goofish.com/item?id=776043233892&categoryId=127832004
【微瑕】海上观赏鲸鱼/跟消防员山姆学做安全小卫士【二手】 #涉及套装书或多册的图书，请咨询客服确认本数后再下单，以咨询结果为准;暂无商品描述#若原书涉及附件的，请已咨询客服回复结果为准; 已发货订单物流信息如未更新，可以咨询客服查询实时物流信息，快递如有破损，或者收到的书籍有质量问题，请联系客服售后。,10.59,四川,18,https://www.goofish.com/item?id=905647042266&categoryId=201544601
跟消防员山姆学做安全小卫士全套8册 儿童教育自救…八成新，消 防员山姆电视剧图书。印刷很好。孩子现在不看了。转卖回血。顺德容桂自提。海上观赏鲸鱼/跟消防员山姆学做安全小卫士,20.0,广东,0,https://www.goofish.com/item?id=727733090821&categoryId=127832004
承接金钢纱窗  安全小卫士  量大价格优惠 感兴趣的话点“我想要”和我私聊吧～,64.0,浙江,0,https://www.goofish.com/item?id=708727966809&categoryId=126858759
# 燃气安全小卫士！费加罗燃气探测器配件出售！ 宝子们看过来！出一套费加罗燃气探测器相关配件。全新未拆封，包装完好。费加罗可是燃气探测领域的知名品牌，以精准灵敏著称。   这套配件，无论是用于更换旧部件，还是备用以防不时之需都超合适！能为你和家人的安全多添一重保障。安装方便，适配性强。...,28.0,天津,0,https://www.goofish.com/item?id=928007857020&categoryId=126864691
宝妈必看！大圣驾到婴幼儿手口湿巾，宝宝的安全小卫士！ 家有萌宝，日常清洁是不是让你操碎了心？别担心，大圣驾到婴幼儿手口湿巾来救场啦，为宝宝的每一次探索保驾护航！食品级安全标准，舔咬无忧：宝宝处于口欲期，啥都往嘴里放。大圣驾到湿巾采用食品级原料，通过口腔黏膜刺激性测试，就算宝宝啃咬湿巾边缘，老母亲也能淡定自若，完全不慌！99% EDI 净化纯水，温和滋润：7层净化的EDI纯水占比高达99%，给宝宝肌肤带来如母婴级纯净水般的温柔呵护。轻轻一擦，带走污渍的同时，还留下水润触感，拒绝干燥紧绷！洋甘菊与金银花提取物，带来自然清香，无酒精、荧光剂、防腐剂的刺鼻干扰，宝宝用得开心，家长放心。,8.0,山东,0,https://www.goofish.com/item?id=965151442408&categoryId=126864853
