标题,价格(元),所在地,想要人数,商品URL
电动球场画划线机油漆冷喷漆地坪公路停车位场操场油漆沣江涂料耐  颜色分类: 电动涂漆&电动喷漆二合一划线机,864.0,大***^,0,https://www.goofish.com/item?id=933934431433&categoryId=126866379
老人床上靠背神器瘫痪老年人护理卧床用品病人坐睡起身支架靠背垫 ，几乎全新。,50.0,T***7,3,https://www.goofish.com/item?id=948612124668&categoryId=126858725
全自动连续捕鼠笼，超强力灭鼠神器！单门设计，老鼠进去就出不来 了。，不锈钢材质，坚固耐用。家用商用都有效，一次搞定老鼠烦,5.18,刚***有,0,https://www.goofish.com/item?id=953299193005&categoryId=126858758
正品LP木制Clave拉丁节奏棒，8英寸长，窑干异国硬木制作 ，适合演奏拉丁音乐基本节奏。两根棒尺寸相同，做工精细，手感,165.0,旗***商,0,https://www.goofish.com/item?id=932737251944&categoryId=126858896
全新易格斯IGUS线缆拖链，型号2600.12.125，长度 19米，还有22米的2600.07.125和KENYON ,79.0,t***x,5,https://www.goofish.com/item?id=851763206231&categoryId=201458403
奥威特观光自行车双排20辆，河南发货  感兴趣的话点“我想要”和我私聊吧～,123.0,欣***5,3,https://www.goofish.com/item?id=945761200695&categoryId=126866902
JOYOU中宇卫浴JY06301快开龙头，装修买多了，特价处 理（10个150元包邮）不多先到先得！,15.0,喵***物,16,https://www.goofish.com/item?id=892217527061&categoryId=126858483
【25岁男一年半长高6cm】成功圆梦185 国内顶尖的运动训 练体系帮你突破身高基因遗传限制 让你的身高迅速突破！！！！,50.4,身***k,5,https://www.goofish.com/item?id=848291687978&categoryId=126856655
单位发的洗护套装根本用不完，原装未拆封，有效期到2027年1 1月 感兴趣的话点“我想要”和我私聊吧～,89.0,x***8,1,https://www.goofish.com/item?id=856733418844&categoryId=126860136
打气筒出门携带方便，便宜处理，货在兴义东站附近上门自提  感兴趣的话点“我想要”和我私聊吧～,30.0,兴***货,0,https://www.goofish.com/item?id=935530135553&categoryId=126864628
练习管  没有嘴儿 旧的 喜欢私了 外观看上去保养的还可以 望遇有缘人,270.0,宇***爷,7000,https://www.goofish.com/item?id=748458099889&categoryId=126858908
有没有需要颜色浆的ak兄弟们，有需要的找我预定，什么颜色都有  感兴趣的话点“我想要”和我私聊吧～,650.0,衣***啦,999,https://www.goofish.com/item?id=735267583172&categoryId=126858171
【LP+同款牛铃】  高品优质音色！！ 音色还原能达到百分之95以上，与原版几乎一样， 价格超级便宜，五分之一的价格，得,49.0,七***器,0,https://www.goofish.com/item?id=954405286925&categoryId=126862838
四厘米宽紧绳器，金属材质，结实耐用  尺寸：宽度4厘米 适用场景：货车捆绑、货物固定 成色：用过一次，有的很新，有的有点,5.0,老***铺,0,https://www.goofish.com/item?id=949135555665&categoryId=201451204
五子棋  感兴趣的话点“我想要”和我私聊吧～,8.0,暖***铺,0,https://www.goofish.com/item?id=951851587819&categoryId=126860371
高铝匣铂匣钵坩埚匣泊匣波，耐高温砖、防火砖、保温砖、高铝砖， 耐火砖工厂拆迁，千吨库存耐火砖现货出售！价格实惠，量大可到,45.0,音***声,95,https://www.goofish.com/item?id=562891593820&categoryId=201452803
老相机、胶片单反相机、老相机 华西S-80胶片单反相机    功能正常   品相如图  镜头微霉丝    二手有瑕疵  ,400.0,雪***狼,9,https://www.goofish.com/item?id=547900363100&categoryId=126864784
野生羊肚菌干货 特级品质 纯野生无添加  产地直发 保质期2年  每一朵都是精挑细选 品相完好 假一赔十 支持验货 不退,900.0,王***g,1188,https://www.goofish.com/item?id=921479028402&categoryId=201454616
杜鹃花树瘤 小墩墩 当壶承 花台   感兴趣的话点“我想要”和我私聊吧～ 闲置物品 一经售出不退不换！！！,360.0,苦***哥,1,https://www.goofish.com/item?id=716208756627&categoryId=126866753
10赛欧门碗ABS电镀防刮保护贴改装饰亮，  一套4个装， 整套包邮价格， 特价商品，赔钱处理，售出不退不换,11.0,闲***货,25,https://www.goofish.com/item?id=891551779356&categoryId=126860662
