标题,价格(元),所在地,想要人数,商品URL
低价代购淮安苏宁影城任意场次电影票，通通一律20元起一张！ 淮安苏宁影城，2D/3D特惠电影票，任何电影，任何场次都可以看。  《志愿军：雄兵出击》、《坚如磐石》、《莫斯科行动》、《前任四：英年早婚》、《汪汪队立大功2》、《好像也没那么热血沸腾》、《我是哪吒2之英雄归来》、《贝肯熊：火星任务》、...,38.0,江苏,88,https://www.goofish.com/item?id=740019374508&categoryId=201459411
低价代购南通苏宁影城任意场次电影票，通通一律20元起一张！ 南通苏宁影城，2D/3D特惠电影票，任何电影，任何场次都可以看。  《志愿军：雄兵出击》、《坚如磐石》、《莫斯科行动》、《前任四：英年早婚》、《汪汪队立大功2》、《好像也没那么热血沸腾》、《我是哪吒2之英雄归来》、《贝肯熊：火星任务》、...,38.0,江苏,88,https://www.goofish.com/item?id=739868721025&categoryId=201459411
低价代购重庆金逸影城任意场次电影票，通通一律20元起一张！ 重庆金逸影城，2D/3D特惠电影票，任何电影，任何场次都可以看。  《志愿军：雄兵出击》、《坚如磐石》、《莫斯科行动》、《前任四：英年早婚》、《汪汪队立大功2》、《好像也没那么热血沸腾》、《我是哪吒2之英雄归来》、《贝肯熊：火星任务》、...,20.0,重庆,51,https://www.goofish.com/item?id=744692130775&categoryId=201456914
收电影，追缉，最好的相遇，无价之宝，迷你特工队之汉堡大作战， 我爸没说的那件事，普通男女，，迷你特工队，无价之宝，我爸没说的那件事，拯救嫌疑人，二手杰作，白塔之光河边的错误，困兽，莫斯科行动，贝肯熊:火星任务，志愿军:雄兵出击，前任4:英年早婚，电影，兑换，通兑，淘票票，猫眼，淘票票电影，猫眼电影，淘...,35.0,北京,29,https://www.goofish.com/item?id=745505487287&categoryId=126864806
收淘票票贝肯熊电影票 ，河边的错误，困兽，，最好的相遇，贝肯 熊，贝肯熊火星任务，电影票，淘票票50通兑，淘票票电影，淘票票兑换，淘票票60通兑，坚如磐石，志愿军，莫斯科，前任，英年早婚，汪汪队立大功，莫斯科行动，好像也没那么热血沸腾，坚如磐石电影，坚如磐石猫眼，坚如磐石70，淘票票60，猫眼60，,35.0,北京,1,https://www.goofish.com/item?id=744008494122&categoryId=126864806
收电影，汪汪队立大功，莫斯科行动，我是哪吒2之英雄归来，好像 也没那么热血沸腾，坚如磐石，贝肯熊:火星任务，志愿军:雄兵出击，前任4:英年早婚，敢死队4:最终章，鹦鹉杀，威尼斯惊魂夜，永安镇故事集，第八个嫌疑人，意外人生，奥本海默，踢球吧少年，三贵情史，第八个嫌疑人，不虚此行，，电影，兑换，通兑，淘票...,35.0,北京,4,https://www.goofish.com/item?id=741306943366&categoryId=126864806
收电影，信誉好！不会骗人！！！贝肯熊，坚如磐石，敢死队，热血 沸腾，前任4，前任4英年早婚，志愿军，莫斯科行动，好像也没那么热血沸腾，贝肯熊火星任务，汪汪队，汪汪队立大功大电影，我是哪吒2，我是哪吒2之英雄归来，小美人鱼之大海怪，敢死队，鹦鹉杀，不虚此行，坚如磐石，志愿军，志愿军雄兵出击，贝肯熊火星最...,35.0,北京,11,https://www.goofish.com/item?id=741887913485&categoryId=126864806
低价代购抚顺苏宁影城任意场次电影票，通通一律20元起一张！ 抚顺苏宁影城，2D/3D特惠电影票，任何电影，任何场次都可以看。  《志愿军：雄兵出击》、《坚如磐石》、《莫斯科行动》、《前任四：英年早婚》、《汪汪队立大功2》、《好像也没那么热血沸腾》、《我是哪吒2之英雄归来》、《贝肯熊：火星任务》、...,38.0,辽宁,88,https://www.goofish.com/item?id=739558881131&categoryId=201459411
收电影，最好的相遇，二手杰作，白塔之光河边的错误，困兽，汪汪 队立大功，莫斯科行动，我是哪吒2之英雄归来，好像也没那么热血沸腾，坚如磐石，贝肯熊:火星任务，志愿军:雄兵出击，前任4:英年早婚，电影，兑换，通兑，淘票票，猫眼，淘票票电影，猫眼电影，淘票票兑换，淘票票通兑，猫眼兑换，猫眼通兑，电影60，电...,35.0,北京,12,https://www.goofish.com/item?id=745150019754&categoryId=126864806
收电影，信誉好！不会骗人！！！贝肯熊，坚如磐石，敢死队，热血 沸腾，前任4，前任4英年早婚，志愿军，莫斯科行动，好像也没那么热血沸腾，贝肯熊火星任务，汪汪队，汪汪队立大功大电影，我是哪吒2，我是哪吒2之英雄归来，小美人鱼之大海怪，敢死队，鹦鹉杀，不虚此行，坚如磐石，志愿军，志愿军雄兵出击，贝肯熊火星最...,35.0,北京,16,https://www.goofish.com/item?id=741124700513&categoryId=126864806
低价代购日照苏宁影城任意场次电影票，通通一律20元起一张！ 日照苏宁影城，2D/3D特惠电影票，任何电影，任何场次都可以看。  《志愿军：雄兵出击》、《坚如磐石》、《莫斯科行动》、《前任四：英年早婚》、《汪汪队立大功2》、《好像也没那么热血沸腾》、《我是哪吒2之英雄归来》、《贝肯熊：火星任务》、...,38.0,山东,88,https://www.goofish.com/item?id=740067372858&categoryId=201459411
收淘票票贝肯熊电影票 ，河边的错误，困兽，，最好的相遇，贝肯 熊，贝肯熊火星任务，电影票，淘票票50通兑，淘票票电影，淘票票兑换，淘票票60通兑，坚如磐石，志愿军，莫斯科，前任，英年早婚，汪汪队立大功，莫斯科行动，好像也没那么热血沸腾，坚如磐石电影，坚如磐石猫眼，坚如磐石70，淘票票60，猫眼60，,35.0,北京,11,https://www.goofish.com/item?id=743853506612&categoryId=126864806
收电影，最好的相遇，二手杰作，白塔之光河边的错误，困兽，汪汪 队立大功，莫斯科行动，我是哪吒2之英雄归来，好像也没那么热血沸腾，坚如磐石，贝肯熊:火星任务，志愿军:雄兵出击，前任4:英年早婚，电影，兑换，通兑，淘票票，猫眼，淘票票电影，猫眼电影，淘票票兑换，淘票票通兑，猫眼兑换，猫眼通兑，电影60，电...,35.0,北京,6,https://www.goofish.com/item?id=745407442750&categoryId=126864806
收电影，汪汪队立大功，莫斯科行动，我是哪吒2之英雄归来，好像 也没那么热血沸腾，坚如磐石，贝肯熊:火星任务，志愿军:雄兵出击，前任4:英年早婚，敢死队4:最终章，鹦鹉杀，威尼斯惊魂夜，永安镇故事集，第八个嫌疑人，意外人生，奥本海默，踢球吧少年，三贵情史，第八个嫌疑人，不虚此行，，电影，兑换，通兑，淘票...,35.0,北京,5,https://www.goofish.com/item?id=741157198012&categoryId=126864806
