标题,价格(元),所在地,想要人数,商品URL
电影《贝肯熊》1、2，国语配音版。高清。【百度网盘发货】 [钉子]《贝肯熊2：金牌特工》讲述了特工熊贝肯意外遗失超级芯片变回普通北极熊后，为实现特工梦与伙伴海豹小迪一起踏上寻找芯片的冒险之旅，在经历一系列乌龙事件的同时领悟友谊与成长真谛的故事。 [钉子]《贝肯熊：火星任务》讲述了特工贝肯熊为获认...,4.0,广东,19,https://www.goofish.com/item?id=952109902685&categoryId=126864806
贝肯熊1-6季全集 电影火星任务倒霉熊动画片高清视频动漫网盘 速发,3.2,宁夏,1,https://www.goofish.com/item?id=904679430902&categoryId=126864807
贝肯熊 火星任务 官方正版儿童书包 仅此一个， 全新未使用  29.9包邮,29.9,江苏,0,https://www.goofish.com/item?id=900996946482&categoryId=126862779
国庆档最新动画 《贝肯熊：火星任务》电影正版灯箱海报 一张 大小105✖️75厘米  特殊商品售出不退不换  介意勿拍 感兴趣的话点“我想要”和我私聊吧～,6.0,湖南,2,https://www.goofish.com/item?id=739807360876&categoryId=126862263
贝肯熊火星任务儿童双肩背包，紫色+薄荷绿配色，超可爱卡通图案 ，全新未使用。适合3-6岁小朋友背着出门玩耍，轻便实用，男女宝都可以背。背包尺寸合适，做工精致，背带结实。售出不退不换,18.0,山东,0,https://www.goofish.com/item?id=945465624648&categoryId=126862779
30包顺丰 贝肯熊 火星任务 周边 书包 儿童大小 感兴趣的话点“我想要”和我私聊吧～,26.0,浙江,0,https://www.goofish.com/item?id=758462994496&categoryId=126862779
低价代购南充UME影城任意场次电影票，通通一律20元起一张！ 南充UME影城，2D/3D特惠电影票，任何电影，任何场次都可以看。  《志愿军：雄兵出击》、《坚如磐石》、《莫斯科行动》、《前任四：英年早婚》、《汪汪队立大功2》、《好像也没那么热血沸腾》、《我是哪吒2之英雄归来》、《贝肯熊：火星任务》...,38.0,四川,88,https://www.goofish.com/item?id=734748472243&categoryId=201418301
贝肯熊 火星任务 书包，全新，售出不退不换！价格不包邮！,25.0,北京,2,https://www.goofish.com/item?id=757830366438&categoryId=126862779
背包书包双肩包《贝肯熊:火星任务》周边纪念品 小 感兴趣的话点“我想要”和我私聊吧～,20.0,海南,0,https://www.goofish.com/item?id=838623410268&categoryId=126864800
《贝肯熊火星任务》电影周边双肩背包，咕卡(DIY自己制作挂件 )，尺子，贴纸倒霉熊，官方正品，衍生品 背包（约40×26)，30元包邮 咕卡套盒 20元包邮 塑料尺 5元1把 贴纸套装 3元一套 满25元包邮,5.0,广东,3,https://www.goofish.com/item?id=741195618522&categoryId=126864800
贝肯熊火星任务贴纸包，全新未拆封，一套15张，卡通造型，男女 通用。电影周边，感兴趣的朋友可以点“我想要”私聊哦～不包邮,1.0,广东,0,https://www.goofish.com/item?id=839525560660&categoryId=126912144
amg海上明珠影城合肥星光天地店 低价电影票代下，低至25元起，特惠代下全国低价电影票，问价不亏，欢迎咨询  前任四☆坚若磐石☆莫斯科行动☆志愿军:雄兵出击☆好像也没那么热血沸腾☆封神第一部☆孤注一掷☆威尼斯惊魂夜☆汪汪队立大功大电影☆贝肯熊:火星任务  买票流程 1....,35.0,安徽,67,https://www.goofish.com/item?id=741575778895&categoryId=201418301
贝肯熊：火星任务 官方正版周边 儿童书包20*40*10cm 全新正品包邮直拍,29.9,四川,2,https://www.goofish.com/item?id=743866036603&categoryId=126862779
电影周边：《贝肯熊火星任务》灯箱报 海报一张：105cm×75cm 全开海报纸质偏软，默认有轻微折痕和瑕疵，完美主义者请慎拍！     纸质商品售出不退不换，快递前如需细节图可指定拍摄。 海报筒发货,19.0,广东,0,https://www.goofish.com/item?id=880851078995&categoryId=126862263
贝肯熊火星任务贴纸 3元一套，共2套 杭州地区可自提。,3.0,浙江,0,https://www.goofish.com/item?id=740995148939&categoryId=126916166
电影《坚如磐石》16.8元起一张[超便宜] 《前任4：英年早婚》《志愿军：雄兵出击》 《莫斯科行动》《好像也没那么热血沸腾》 《贝肯熊：火星任务》  全国影院均可下单，购票优惠5-50不等，24小时票务，询价不亏，电影院有的都可以看[号外][号外][号外]  推荐选择全国连锁式影院...,16.8,贵州,11,https://www.goofish.com/item?id=741149308193&categoryId=201418301
低价代购大连苏宁影城任意场次电影票，通通一律20元起一张！ 大连苏宁影城，2D/3D特惠电影票，任何电影，任何场次都可以看。  《志愿军：雄兵出击》、《坚如磐石》、《莫斯科行动》、《前任四：英年早婚》、《汪汪队立大功2》、《好像也没那么热血沸腾》、《我是哪吒2之英雄归来》、《贝肯熊：火星任务》、...,38.0,辽宁,88,https://www.goofish.com/item?id=739507309570&categoryId=201459411
贝肯熊火星任务儿童背包，两个颜色可选：紫色+薄荷绿、橙色+灰 色。全新未拆封，超轻便设计，适合小朋友背着出门玩耍。单个15元，有两个薄荷绿和一个橙色，三个一起拍40包邮哦～ 有意者联系我！不退不换。,15.0,北京,0,https://www.goofish.com/item?id=962230272125&categoryId=126864800
低价代购大连苏宁影城任意场次电影票，通通一律20元起一张！ 大连苏宁影城，2D/3D特惠电影票，任何电影，任何场次都可以看。  《志愿军：雄兵出击》、《坚如磐石》、《莫斯科行动》、《前任四：英年早婚》、《汪汪队立大功2》、《好像也没那么热血沸腾》、《我是哪吒2之英雄归来》、《贝肯熊：火星任务》、...,25.0,辽宁,45,https://www.goofish.com/item?id=744087426874&categoryId=201456914
【出】电影贝肯熊火星任务 官方周边 同款贴纸套装 不少于10张很厚实 全新未拆，10元出不包邮  主页实物买满150包邮,10.0,北京,0,https://www.goofish.com/item?id=763657085969&categoryId=126858273
儿童书包《贝肯熊：火星任务》，原价40元/个，淘宝上买的。因 小孩书多换了可行走的书包，原二个书包在家闲署，几乎全新现低价处理，15元/个。市区内免费送上门或自提，自提点：江岸区二七北路航务一院。  感兴趣的话点“我想要”和我私聊吧～,15.0,湖北,0,https://www.goofish.com/item?id=850314181261&categoryId=126862779
《贝肯熊：火星任务》影院正版易拉宝展架海报 电影正版海报 易拉宝材质 大小2米✖️1.2米，现在左上破损如图 特殊商品 售出不退不换 如需海报筒需加5元 感兴趣的话点“我想要”和我私聊吧～～,9.9,湖南,3,https://www.goofish.com/item?id=739986009650&categoryId=126862010
贝肯熊火星任务周边 咕噜卡一套，尺子一把，贴纸一套,20.0,北京,0,https://www.goofish.com/item?id=775014334288&categoryId=126912144
贝肯熊火星任务贴纸，一套有15张，具体看图片二，只有一套，不 包邮,5.0,广东,1,https://www.goofish.com/item?id=783528992448&categoryId=126912144
《贝肯熊：火星任务》首映官方正版纪念品肯贝熊周边限量版书包文 件袋贴纸 超可爱 书包+文件袋+贴纸，打包59包邮。 书包39包邮 文件袋33包邮 概况:限量款！官方正品！闺蜜送的，一样一个，卖完没有。 电影周边产品，做工和专柜品牌不能比，介意慎拍！玻璃心住手！就这一个哈！ 新旧：全新，实拍图。不包原厂...,33.0,北京,999,https://www.goofish.com/item?id=751987798191&categoryId=126862779
【全新未拆】电影《贝肯熊火星任务》官方周边T恤，M号，男女均 可穿～,75.0,北京,0,https://www.goofish.com/item?id=764061088338&categoryId=126910002
电影票代买 看不见的顶峰，二手杰作，白塔之光，一个和四个，困兽，失而复得，坚如磐石，志愿军:雄兵出击，莫斯科行动，前任4英年早婚，贝肯熊:火星任务，汪汪队立功大电影，好像也没那么热血沸腾，我是哪吒2英雄归来，小美人鱼之大海怪传说，功夫王之萌虎上山，...,18.0,天津,50,https://www.goofish.com/item?id=672424291776&categoryId=126864806
恒大嘉凯影城19.9起，电影通兑券，特价电影票，全国电影票代 购  《前任4:英年早婚》《志愿军:雄兵出击》《坚如磐石》《哪吒2之英雄归来》 《好像也没有那么热血沸腾》《莫斯科行动》  《鹦鹉杀》《威尼斯惊魂夜》《汪汪队立大功》《小美人鱼之大海怪传说》《贝肯熊:火星任务》《疯狂大营救》《功夫王之萌虎上...,17.0,浙江,0,https://www.goofish.com/item?id=742150187873&categoryId=126864806
低价代购湖州苏宁影城任意场次电影票，通通一律20元起一张！ 湖州苏宁影城，2D/3D特惠电影票，任何电影，任何场次都可以看。  《志愿军：雄兵出击》、《坚如磐石》、《莫斯科行动》、《前任四：英年早婚》、《汪汪队立大功2》、《好像也没那么热血沸腾》、《我是哪吒2之英雄归来》、《贝肯熊：火星任务》、...,38.0,浙江,88,https://www.goofish.com/item?id=739997829722&categoryId=201459411
国庆档最新动画 《贝肯熊：火星任务》电影正版展架海报 一张 大小120✖️200厘米 ，有一个角破损，如图 特殊商品售出不退不换  介意勿拍 感兴趣的话点“我想要”和我私聊吧～,9.9,湖南,1,https://www.goofish.com/item?id=742209771894&categoryId=126862010
低价代购包头苏宁影城任意场次电影票，通通一律20元起一张！ 包头苏宁影城，2D/3D特惠电影票，任何电影，任何场次都可以看。  《志愿军：雄兵出击》、《坚如磐石》、《莫斯科行动》、《前任四：英年早婚》、《汪汪队立大功2》、《好像也没那么热血沸腾》、《我是哪吒2之英雄归来》、《贝肯熊：火星任务》、...,38.0,内蒙古,88,https://www.goofish.com/item?id=739705035896&categoryId=201459411
《贝肯熊：火星任务》首映官方正版纪念品肯贝熊周边限量版书包文 件袋贴纸 超可爱 书包+文件袋+贴纸，打包60包邮。 书包39包邮 文件袋39包邮 概况:限量款！官方正品！闺蜜送的，一样一个，卖完没有。 电影周边产品，做工和专柜品牌不能比，介意慎拍！玻璃心住手！就这一个哈！ 新旧：全新，实拍图。不包原厂...,59.99,北京,999,https://www.goofish.com/item?id=741115481051&categoryId=126864800
贝肯熊火星任务周边双肩背包贝肯熊儿童背包倒霉熊背包 官方正品，全新原装 大小：约40×26 橙色的，30元全国包邮,30.0,四川,0,https://www.goofish.com/item?id=771054353706&categoryId=126862779
低价代购重庆金逸影城任意场次电影票，超低特价 重庆金逸影城，2D/3D特惠电影票，任何电影，任何场次都可以看。  《志愿军：雄兵出击》、《坚如磐石》、《莫斯科行动》、《前任四：英年早婚》、《汪汪队立大功2》、《好像也没那么热血沸腾》、《我是哪吒2之英雄归来》、《贝肯熊：火星任务》、...,20.0,重庆,20,https://www.goofish.com/item?id=744446948527&categoryId=201456914
天津电影票代买， 坚如磐石，志愿军:雄兵出击，莫斯科行动，前任4英年早婚，贝肯熊:火星任务，汪汪队立功大电影，好像也没那么热血沸腾，我是哪吒2英雄归来，小美人鱼之大海怪传说，功夫王之萌虎上山， CGV万达寰映橙天大地SFC...连锁影院优惠多多 发图报价，...,18.0,天津,0,https://www.goofish.com/item?id=698183934036&categoryId=126864806
收淘票票贝肯熊电影票 ，贝肯熊，贝肯熊火星任务，电影票，淘票 票50通兑，淘票票电影，淘票票兑换，淘票票60通兑，坚如磐石，志愿军，莫斯科，前任，英年早婚，汪汪队立大功，莫斯科行动，好像也没那么热血沸腾，坚如磐石电影，坚如磐石猫眼，坚如磐石70，淘票票60，猫眼60，,30.0,北京,10,https://www.goofish.com/item?id=742289429555&categoryId=126864806
国庆档最新动画 《贝肯熊：火星任务》电影正版灯箱海报 一张， 另有其他版本，可以一起打包 大小105✖️75厘米  特殊商品售出不退不换  介意勿拍 感兴趣的话点“我想要”和我私聊吧～,20.0,江苏,0,https://www.goofish.com/item?id=740878317206&categoryId=126862263
四川太平洋影城电影票低价代买，电影票优惠买，特价电影票，便宜 电影票，全部19.9元起！  目前热映:前任4:英年早婚★坚如磐石★志愿军：雄兵出击★93国际列车大劫案：莫斯科行动★永安镇故事集★汪汪队大立功★贝肯熊：火星任务★功夫王之猛虎上山★敢死队4★ 鹦鹉杀★威尼斯惊魂夜★好像也没那么热血沸腾★封...,17.0,重庆,0,https://www.goofish.com/item?id=741192213434&categoryId=201418301
低价代购北京米瑞酷影城任意场次电影票，通通一律20元起一张！ 北京米瑞酷影城，2D/3D特惠电影票，任何电影，任何场次都可以看。  《志愿军：雄兵出击》、《坚如磐石》、《莫斯科行动》、《前任四：英年早婚》、《汪汪队立大功2》、《好像也没那么热血沸腾》、《我是哪吒2之英雄归来》、《贝肯熊：火星任务》...,38.0,北京,99,https://www.goofish.com/item?id=696869832203&categoryId=201418301
汪汪队立大功 正版 全套8张 包邮周边电影 票根 超能大冒险 阿奇贝贝 海报 纪念 卡通 儿童   全套8张实物更好看， 双面彩虹膜票根。 留下童真，留下回忆，值得收藏。 票根数量有限，先到先得， 库存数为虚标，没货将主动联系。  近日动画电影票根： 《贝肯熊火星任务》， 《汪汪队立大功》， 《Pi...,27.0,湖北,0,https://www.goofish.com/item?id=741470339961&categoryId=126862263
低价代购苏州苏宁影城任意场次电影票，通通一律20元起一张！ 苏州苏宁影城，2D/3D特惠电影票，任何电影，任何场次都可以看。  《志愿军：雄兵出击》、《坚如磐石》、《莫斯科行动》、《前任四：英年早婚》、《汪汪队立大功2》、《好像也没那么热血沸腾》、《我是哪吒2之英雄归来》、《贝肯熊：火星任务》、...,13.0,江苏,0,https://www.goofish.com/item?id=744001573610&categoryId=201456914
贝肯熊倒霉熊火星任务电影周边 如图全新，见图一二汇总，含书包一个，T恤一件，咕噜卡一套，贴纸两套，文件袋三个。 衣服没量尺寸，s码，目测偏大，不以大小为由退换。 不包任何出厂瑕疵。  无发票，售出不退换。,60.0,北京,1,https://www.goofish.com/item?id=785347625833&categoryId=126860292
低价代购眉山万达影城任意场次电影票，通通一律20元起一张！ 眉山万达影城，2D/3D特惠电影票，任何电影，任何场次都可以看。  《志愿军：雄兵出击》、《坚如磐石》、《莫斯科行动》、《前任四：英年早婚》、《汪汪队立大功2》、《好像也没那么热血沸腾》、《我是哪吒2之英雄归来》、《贝肯熊：火星任务》、...,15.0,海南,0,https://www.goofish.com/item?id=886186958214&categoryId=201418301
全国金逸影城电影票代下，特惠电影票，特价电影票代订，低价代购 全国金逸影院电影票，优惠多多，欢迎来咨询问价。  目前热映电影：【奥本海默】【孤注一掷】【封神第一部】【第八个嫌疑人】【巨齿鲨2】【不虚此行】【敢死队4:最终章】【鹦鹉杀】【威尼斯惊魂夜】【贝肯熊:火星任务】【汪汪队立大功大电影2:超能大冒...,36.0,广东,3,https://www.goofish.com/item?id=743618891398&categoryId=201456914
贝肯熊火星任务.倒霉熊电影海报200*120cm超大版.仅此 一份.X展架易拉宝电影海报贴纸宣传画.  二手物品存在瑕疵，如裂口.磨损等，完美主义者绕行. 明星周边收藏. 图片实拍 #影视戏剧音像 #超火明星周边,179.0,北京,0,https://www.goofish.com/item?id=892305889025&categoryId=126862263
【全套包邮】电影贝肯熊火星任务 周边 咕卡套盒  尺子 贴纸套装,59.0,上海,3,https://www.goofish.com/item?id=742675342128&categoryId=126860292
收淘票票贝肯熊电影票 ，贝肯熊，贝肯熊火星任务，电影票，淘票 票50通兑，淘票票电影，淘票票兑换，淘票票60通兑，坚如磐石，志愿军，莫斯科，前任，英年早婚，汪汪队立大功，莫斯科行动，好像也没那么热血沸腾，坚如磐石电影，坚如磐石猫眼，坚如磐石70，淘票票60，猫眼60，,35.0,北京,25,https://www.goofish.com/item?id=741522551740&categoryId=126864806
全国卢米埃影城影院低价代买，低价折扣票，特惠电影票19起 前任4:英年早婚★坚如磐石★志愿军:雄兵出击★93国际列车大劫案：莫斯科行动★汪汪队立大功大电影★贝肯熊:火星任务★功夫王之萌虎上山★第八个嫌疑人★好像也没那么热血沸腾★奥本海默★等热门电影 ✔选好影院座位截图给我，告知城市（地级市） ✔...,15.0,浙江,0,https://www.goofish.com/item?id=741286990652&categoryId=201418301
完美世界影城【情侣厅电动vip厅】电影票  冉家坝 爱融荟 适用【大重庆 成都 云南】所有完美世界影城，在线购票，自助取票。 可购买 前任4：英年早婚 93国际列车大劫案 奥本海默 威尼斯惊魂夜 好像也没那么热血沸腾 第八个嫌疑人 敢死队4 坚如磐石  志愿军：雄兵出击 贝肯熊：火星任务&hell...,12.0,重庆,13,https://www.goofish.com/item?id=741833414861&categoryId=201456914
贝肯熊火星任务周边 贴纸,5.0,四川,0,https://www.goofish.com/item?id=775307619626&categoryId=126916166
低价代购眉山万达影城任意场次电影票，通通一律20元起一张！ 眉山万达影城，2D/3D特惠电影票，任何电影，任何场次都可以看。  《志愿军：雄兵出击》、《坚如磐石》、《莫斯科行动》、《前任四：英年早婚》、《汪汪队立大功2》、《好像也没那么热血沸腾》、《我是哪吒2之英雄归来》、《贝肯熊：火星任务》、...,38.0,四川,88,https://www.goofish.com/item?id=718740128207&categoryId=201418301
电影票绍兴中影雅图影城上虞悦城店 绍兴上虞中影雅图影城 《前任4:英年早婚》 《坚如磐石》 《志愿军：雄兵出击》《贝肯熊：火星任务》《93国际列车大劫案：莫斯科行动》 《汪汪队立大功大电影2:超能大冒险》 《贝肯熊：火星任务》 《我是哪吒2之英雄归来》 《好像也没那么热血...,18.0,浙江,4,https://www.goofish.com/item?id=741746162989&categoryId=126864806
天津电影票，坚如磐石，志愿军:雄兵出击，莫斯科行动，前任4英 年早婚，贝肯熊:火星任务，汪汪队立功大电影，好像也没那么热血沸腾，我是哪吒2英雄归来，小美人鱼之大海怪传说，功夫王之萌虎上山， 代购代买 有想要的可以咨询 发码后不退不换,19.0,天津,0,https://www.goofish.com/item?id=741025182243&categoryId=201418301
低价代购日照苏宁影城任意场次电影票，通通一律20元起一张！ 日照苏宁影城，2D/3D特惠电影票，任何电影，任何场次都可以看。  《我是哪吒2之英雄归来》、《贝肯熊：火星任务》、《第八个嫌疑人》等热门电影票都可以！  给我最后那张完整的选座截图，即可出票，直接到影院自助取票机扫码取票即可。  特价...,66.0,山东,0,https://www.goofish.com/item?id=882830214478&categoryId=201418301
收淘票票贝肯熊电影票 ，贝肯熊，贝肯熊火星任务，电影票，淘票 票50通兑，淘票票电影，淘票票兑换，淘票票60通兑,35.0,北京,24,https://www.goofish.com/item?id=741094166437&categoryId=126864806
低价代购全国UME影城任意场次电影票，通通一律20元起一张！ 全国UME影城，2D/3D特惠电影票，任何电影，任何场次都可以看。  《志愿军：雄兵出击》、《坚如磐石》、《莫斯科行动》、《前任四：英年早婚》、《汪汪队立大功2》、《好像也没那么热血沸腾》、《我是哪吒2之英雄归来》、《贝肯熊：火星任务》...,19.9,广东,99,https://www.goofish.com/item?id=754123868605&categoryId=201418301
四川太平洋影城电影票低价代买，电影票优惠买，特价电影票，便宜 电影票，全部19.9元起！  目前热映:前任4:英年早婚★坚如磐石★志愿军：雄兵出击★93国际列车大劫案：莫斯科行动★永安镇故事集★汪汪队大立功★贝肯熊：火星任务★功夫王之猛虎上山★敢死队4★ 鹦鹉杀★威尼斯惊魂夜★好像也没那么热血沸腾★封...,22.0,重庆,8,https://www.goofish.com/item?id=741258986504&categoryId=201418301
前任4  志愿军  坚如磐石   莫斯科行动  好像也没有那 么沸腾  贝肯熊火星任务，汪汪队立大功，哪吒，热映电影  全国电影代买 选好影院座位截图给我 告知城市 我帮您查询报价格 提供影响场次座位截图，看到很快给您报价！ 右上角拍下不要付款，我来改价格后再付款！ 稍等几分钟我来出票  我给您出票号...,20.0,广东,0,https://www.goofish.com/item?id=741567864112&categoryId=201456914
低价代购沈阳苏宁影城任意场次电影票，通通一律20元起一张！ 沈阳苏宁影城，2D/3D特惠电影票，任何电影，任何场次都可以看。  《志愿军：雄兵出击》、《坚如磐石》、《莫斯科行动》、《前任四：英年早婚》、《汪汪队立大功2》、《好像也没那么热血沸腾》、《我是哪吒2之英雄归来》、《贝肯熊：火星任务》、...,38.0,辽宁,88,https://www.goofish.com/item?id=739307100892&categoryId=201459411
低价代购合肥UME影城任意场次电影票，通通一律20元起一张！ 合肥UME影城，2D/3D特惠电影票，任何电影，任何场次都可以看。  《志愿军：雄兵出击》、《坚如磐石》、《莫斯科行动》、《前任四：英年早婚》、《汪汪队立大功2》、《好像也没那么热血沸腾》、《我是哪吒2之英雄归来》、《贝肯熊：火星任务》...,38.0,安徽,88,https://www.goofish.com/item?id=734842393284&categoryId=201418301
收电影，信誉好！不会骗人！！！贝肯熊，敢死队，前任4，前任4 英年早婚，志愿军，莫斯科行动，好像也没那么热血沸腾，贝肯熊火星任务，汪汪队，汪汪队立大功大电影，我是哪吒2，我是哪吒2之英雄归来，小美人鱼之大海怪，敢死队，鹦鹉杀，不虚此行，坚如磐石，志愿军，志愿军雄兵出击，贝肯熊火星最后的真相，电影，电影...,35.0,北京,12,https://www.goofish.com/item?id=741057220815&categoryId=126864806
低价代购无锡德信影城任意场次电影票，通通一律20元起一张！ 无锡德信影城，2D/3D特惠电影票，任何电影，任何场次都可以看。  《志愿军：雄兵出击》、《坚如磐石》、《莫斯科行动》、《前任四：英年早婚》、《汪汪队立大功2》、《好像也没那么热血沸腾》、《我是哪吒2之英雄归来》、《贝肯熊：火星任务》、...,38.0,江苏,88,https://www.goofish.com/item?id=734115856780&categoryId=201418301
低价代购重庆万达影城任意场次电影票，通通一律20元起一张！ 重庆万达影城，2D/3D特惠电影票，任何电影，任何场次都可以看。  《拯救嫌疑人》、《涉过愤怒的海》、《贝肯熊：火星任务》、《最好的相遇》、《惊奇队长2》等热门电影票都可以！  给我最后那张完整的选座截图，即可出票，直接到影院自助取票机...,20.0,重庆,2,https://www.goofish.com/item?id=751621527025&categoryId=201456914
四川太平洋影城电影票低价代买，电影票优惠买，特价电影票，便宜 电影票，全部19.9元起！  目前热映:前任4:英年早婚★坚如磐石★志愿军：雄兵出击★93国际列车大劫案：莫斯科行动★永安镇故事集★汪汪队大立功★贝肯熊：火星任务★功夫王之猛虎上山★敢死队4★ 鹦鹉杀★威尼斯惊魂夜★好像也没那么热血沸腾★封...,22.5,四川,5,https://www.goofish.com/item?id=741401763958&categoryId=201418301
收电影，信誉好！不会骗人！！！贝肯熊，坚如磐石，敢死队，热血 沸腾，前任4，前任4英年早婚，志愿军，莫斯科行动，好像也没那么热血沸腾，贝肯熊火星任务，汪汪队，汪汪队立大功大电影，我是哪吒2，我是哪吒2之英雄归来，小美人鱼之大海怪，敢死队，鹦鹉杀，不虚此行，坚如磐石，志愿军，志愿军雄兵出击，贝肯熊火星最...,35.0,北京,13,https://www.goofish.com/item?id=741814794003&categoryId=126864806
