标题,价格(元),所在地,想要人数,商品URL
xin计划xin服稳定脚本独家(百分百过验证接入人工智能大模 型！刷加格明暗雷和卢比明暗雷解决长时间卡顿问题，附赠独家交易行辅助可批量上架批量下架自动买货！脚本联动计数器统计你的出货量[钉子]全功能支持4.8和7.0，兼容6.9，6.8等，有视频教学，不会可以远程一对一帮忙配置！[new][new][new]脚本联动计数器功能已上线！[new][new][new]扎克尼尔是否捕捉，或高个体捕捉，用户由您自己勾选决定！[new][new][new]捕捉胶囊由用户自行选择！[new][new][new]验证码过验功能已实装，使用AI技术[new][new][new]刷加格，卢比时间长卡顿问题已解决可刷一整天[1]安全第一：[灯泡]1.软件进程名可根据您的需求进行伪装[灯泡]2.自动仿真拒绝他人对战请求，防止有心人恶意举报！[灯泡]3.自动填写验证码过验证，百分百过！不信的可以在主界面自己试[灯泡]4.电池挂到红色自动下线功能可选择开启[hot][hot][hot]脚本功能：1.全地图所有精灵精准高个体捕捉同时捕捉异色，包括埃闻2.稀有精灵切图，原地识别3.稀有精灵仙人掌捕捉(计算pp值碰到难抓的回pp)4.普通精灵明雷+暗雷捕捉，稳定小鳍鱼和卡卡不弹飞不掉洞5.边刷材料边抓异色明暗雷(自设回血次数)6.支持全部带稀有精灵的地图边刷普通精灵明暗雷边抓稀有！如莫比毛毛，小豆芽仙人球，橙毛紫毛等！7.自定义学习力次数回血球，弹窗输入！8.自定义爬塔！快速慢速两种！[火]每天都在更新有记录，最新验证码刚出来就破解了，购买后远程一对一服务！[new][hot]本店还配有非外面大家用的套壳二次收费加速器，以及交易行辅助客户端，有需求可以了解下。[new][hot]新店开业活动1.前10名购买本店游戏辅助脚本季卡(90天)赠送交易行辅助工具30天卡密[火][火]，先到先得后续仅可获得7天2.前10名购买本店游戏辅助脚本月卡(30天)赠送交易行辅助工具7天卡密[火][火]，先到先得后续仅可获得3天3.购买本店任何天数任意辅助卡密附赠同等天数加速器卡密(进程名不含加速，非市面上的套壳二次收费)[火][火]店铺vip[五角星]:购买可同时获3种软件卡密，附加每月3次定制机会(视难度，工作量浮动)，交易行辅助新功能体验机会该游戏脚本月卡45元，季卡98元，不售永久不炒概念不跑路，买了进群享受更新，一对一服务。店铺vip月卡60元，vip季卡120元，购买可享本店全部软件同等时长！以及定制，抢先体验机会[钉子]软件包售后，但虚拟物品不退不换，敬请谅解。未成年禁止购买！引流：xin服，xin计划异色，xin服代肝，xin服爬塔，xin服稀有，xin服账号，xin服交易行，脚本，辅助,45.0,北京,46,https://www.goofish.com/item?id=951469403600&categoryId=202036001
赛尔号精灵传说系列，第三季《永远的守护者》，图书品相如图。江 苏少年儿童出版社出版，ISBN: 978-7-5346-5354-9。定价15元，不包邮。感兴趣的朋友可以私聊哦～  二手书正版实拍幼儿绘本儿童课外书读物必读书目，实价可直接拍，多单只收一份运费，多本超重情况下需补续重运费，欢迎感兴趣的朋友...,4.0,江苏,0,https://www.goofish.com/item?id=864031571428&categoryId=127838003
赛尔号  精灵传说 第一季第二季 第一季有 1 2 3 4 7 10 12 第二季有 2 3 4 5 6  每本4块  邮费实收赛尔号精灵传说  可同城自提,4.0,辽宁,0,https://www.goofish.com/item?id=780569866890&categoryId=127838003
赛尔号精灵传说 第二季（7-12） 作者：叶洛洛 长江少年儿童出版社 2014年出版 7魔君的使徒 8永不回头的决斗 9虚空！吞噬之光 10诸神的尊严 11逆战之尊 12用不落幕的传说 正版图书，时间较长略有发黄（第7册有点散了，不缺页，见图9），无笔迹无折页，介意勿扰，售...,29.8,广东,1,https://www.goofish.com/item?id=877061039482&categoryId=127838003
"正版二手图书赛尔号精灵传说  第2季  4  爆发！神魔之战叶洛洛出 ▲正版二手7-9成新笔记量随机发，无破损不缺页，不含光盘、小册子等。▲只卖正版二手书，盗版全额退款。▲一般当天订单当天发货，最迟不超过48小时，绝不拖延。▲全国非偏远地区都包邮（新疆西藏不接单，不支持指定快递）。▲书发出后，因为顾客原因取消，需要承担四元快递费，谢谢！▲拍错地址不支持改地址,只能从拍!!一定核对好地址再下单",7.99,北京,0,https://www.goofish.com/item?id=966894420222&categoryId=201544601
赛尔号 精灵传说 少儿图书 4元一本，两本起，我自贴书钱一半作运费  有想要的宝宝们可以来看看 拍前请务必看好，不支持七天无理由退货 赛尔号精灵传说第一季(7决裂光与暗之战） 赛尔号精灵传说第二季（4爆发！神魔之战） 赛尔号精灵传说第二季（6审判！轮回之...,4.0,河北,0,https://www.goofish.com/item?id=727676970266&categoryId=127838003
赛尔号杀豪华版全新未拆封第7季宇宙之眼 全新仅一盒，森林动漫出品，售出前问好看好，售出后不退不换,18.0,河南,0,https://www.goofish.com/item?id=903619844010&categoryId=126860375
赛尔号卡游，进军神殿。超特殊强化包，全新未拆封，一盒36包， 一包7张卡，相当于5张普通卡，发货后不退不换无售后，标价包邮非偏远。,49.9,江苏,1,https://www.goofish.com/item?id=960782665284&categoryId=126860375
赛尔号xin计划xin服稳定脚本(百分百过文字验证，注意视频 中鼠标位置)附赠独家交易行辅助可批量上架批量下架自动买货！[hot]福利多多：买月卡送7天交易行辅助，送永久进程变速器[new][new][new]脚本联动计数器已上线[new][new][new]验证码过验功能已实装[new][new][new]加格明暗雷卡顿已解决可刷一整天[new][new][new]异色截图保存本地，可以拿出去装绿玩[1][1]安全第一：[灯泡]1.软件进程名可根据您的需求进行伪装[灯泡]2.自动仿真拒绝他人对战请求，防止有心人恶意举报！[灯泡]3.自动填写验证码过验证，百分百过！不信的可以在主界面自己试[灯泡]4.电池挂到红色自动下线功能可选择开启[火][火][火]脚本功能：1.高个体精灵+异色+高个体尼尔，包含埃闻，按用户输入的名字进行刷怪，保证稳定不会抓错2.稀有精灵切图，原地识别3.稀有精灵仙人掌捕捉(计算pp值碰到难抓的回pp)4.普通精灵明雷+暗雷捕捉，稳定小鳍鱼和卡卡不弹飞不掉洞5.边刷材料边抓异色明暗雷(自设回血次数)6.支持全部带稀有精灵的地图边刷普通精灵明暗雷边抓稀有！如莫比毛毛，小豆芽仙人球，橙毛紫毛等！7.自定义学习力次数回血球，弹窗输入！8.自定义爬塔！[火]每天都在更新有记录，最新验证码刚出来就破解了，购买后远程一对一服务！[new][new][new]新店开业活动1.前10名购买本店游戏辅助脚本季卡(90天)赠送交易行辅助工具30天卡密[火][火]，先到先得后续仅可获得7天2.前10名购买本店游戏辅助脚本月卡(30天)赠送交易行辅助工具7天卡密[火][火][火]，先到先得后续仅可获得3天3.购买本店任何天数任意辅助卡密附赠永久加速器(进程名不含加速，非市面上的套壳二次收费)[火][火]店铺vip[五角星]:购买可同时获3种软件卡密，附加每月3次定制机会(视难度，工作量浮动)，交易行辅助新功能体验机会该游戏脚本月卡45元，季卡98元，不售永久不炒概念不跑路，买了进群享受更新，一对一服务。店铺vip月卡60元，vip季卡120元，购买可享本店全部软件同等时长！以及定制，抢先体验机会[钉子]软件包售后，但虚拟物品不退不换，敬请谅解。未成年禁止购买！引流：xin服，xin计划异色，xin服代肝，xin服爬塔，xin服稀有，xin服账号，xin服交易行，脚本，辅助,45.0,北京,34,https://www.goofish.com/item?id=953898082401&categoryId=202036001
赛尔号第六季超特殊强化包，全新未拆封，淘米正版授权。每盒36 包，每包7张卡牌，相当于5张普通卡！全新原厂塑封完好！标价为一盒价格，售出不退不换，偏远地区不包邮。,50.0,江苏,0,https://www.goofish.com/item?id=959496559738&categoryId=126860375
赛尔号s7季新巅峰圣皇一天可上超高效率接 直接报段位分数，可 直接发常用PVP背包截图，低配能上，详情私聊 宇宙圣皇 狂野竞技   无大姐二姐邪魇佛机械塔克林倪克斯也可上               ⭐已完结496单，好评查看评论区⭐大概价格区间：                王者50-圣皇（50-70）                王者0-圣皇（70-110）            王者以下开始开始请私聊问价—————————————————————               ⭐历史最高圣皇3200星⭐        ⭐100%好评认准优质代肝小铺！⭐                ⭐效率！安全！极速！⭐                ⭐带图好评查看评论区⭐                   ⭐双开三开第一人⭐感兴趣的话点“我想要”和我私聊吧～相关搜索：赛尔号巅峰 赛尔号狂野上分 圣战奖章 巅峰姬 毒液套装 笑傲套装 无敌猛将 宇宙圣皇 巅峰刷币 赛尔号巅峰脚本 巅峰手操 赛尔号精灵 巅峰姬 赛尔号巅峰 赛尔号狂野上分 圣战奖章 巅峰姬 毒液套装 笑傲套装 无敌猛将 宇宙圣皇 巅峰刷币 赛尔号巅峰脚本 竞技圣皇 上星 上分 荣耀铸币 赛尔号低保 巅峰姬 卫岳 周年庆 水晶 星核 密令 瞬杀芯片 ，坚硬芯片精神芯片 手打圣皇～,50.0,浙江,5,https://www.goofish.com/item?id=908511470757&categoryId=201403106
前十 Nameless Saga收藏集 久远之诗Nameless Saga黑魔PA 7号卡片编号可用于哔哩哔哩动态卡片，空间头图，评论卡片展示哔哩哔哩 个性装扮 一号tag:生日号编号 倾海之约 原神  芙宁娜 走路摇zly 涤心独舞 玉之けだま_毛玉收藏集 旅行日记 旅途风花 前十 1号 毛玉牛乳 小小魅魔收藏集 随性躺卧露露姆嬉水露露姆夏日休憩 一起泡温泉 斯黛拉好热 小才不是夸人用的 玉之けだま_Official ro姬收藏集 黎歌收藏集 典藏卡 幻星乐园收藏集 洛天依收藏集，哔哩哔哩收藏集 千璃Chili收藏集 耀月收藏集岁末欢聚 小丸official收藏集 猫大人收藏集 劉了了收藏集 归汉收藏集 嗨嗨多吃点收藏集 扇宝收藏集 画猫收藏集 中国绊爱 2233群星闪耀时摩羯座 江明月收藏集 斋藤直葵收藏集 三丽鸥收藏集 夕兔收藏集 鸽一品天才集 百变狐狐收藏集 皮卡少个丘收藏集 秋绘收藏集 夏露露Ruru收藏集 星河Sagi收藏集 全力幻想少年收藏集  画师D收藏集 真白花音收藏集 库莉姆奶油集 抖个姬灵收藏集 柯南收藏集 杠杠收藏集 鲸鱼娘西丝特收藏集无限实验室收藏集 画猫收藏集 醒爷收藏集 扇宝收藏集 T5-茨舞收藏集 鬼刀系列收藏集 萨克万收藏集 嗷金宝收藏集 洛天依收藏集 是姬拉kira收藏集 熙往收藏集 白金宝贝收藏集 Jency&pink收藏集 胶囊计划收藏集sonny brisko收藏集 铃音收藏集 夏诺雅收藏集 A-soul收藏集 薄荷miint收藏集 地下城堡收藏集 花想云裳收藏集 kieed收藏集 熙往收藏集爱上她的理由收藏集 阿里鸭Alya收藏集 画猫.历史宝藏收藏集  艾恺特AKT收藏集双生境 百目境  玄冥境 2233群星闪耀时·双子座  巨蟹座  大D特D收藏集  装扮小姐姐中华锦绣 幻星集 收藏集 世界&星星 愚者魔法师 节制&隐士 真白花音收藏集 轻纱花语 铃芽之旅收藏集 梦音茶糯收藏集 烟雾旗袍 纱耶收藏集 梦游仙境  2233奇书异闻录 女娲补天  永雏塔菲美女收藏集  洛天依收藏集 钟与花的窗棂收藏集 桃宫七七收藏集 初音未来收藏集 主播女孩超天酱收藏集 八木百货社长收藏集 鲸鱼娘收藏集 果宝收藏集 春池醉梦花花haya收藏集 纱依收藏集 千璃Chili收藏集 真百花音收藏集 可洛收藏集 是幼情呀收藏集 安晴Ankil生活集小隐藏大隐藏前十1号coser cosplay 一颗小兔娘收藏集 真白花音收藏集 大D特D收藏集 普通小狗收藏集 2233群星闪耀时收藏集 永雏塔菲美女集 耀月集 洛天依收藏集 早凉收藏集 安可星瞳扇宝收藏集 冥冥收藏集 小铃久绘收藏集 初音未来收藏集 泠鸢yousa收藏集 四禧丸子收藏集 秋绘璀璨星辰收藏集 ASOUL绽放收藏集 早稻叽月下舞会收藏集 醒醒加班收藏集 织月黛黛收藏集 朝华缘拾收藏集 RO姬偶像收藏集 斋藤直葵收藏集 中国绊爱收藏集 纱依收藏集 黎歌收藏集 猫雷收藏集 鬼刀收藏集 Vsinger收藏集 绘之音收藏集 安晴生活集 大D特D第二弹 旅行日记收藏集 主播女孩重度依赖收藏集 春池醉梦花花Haya收藏集 咩栗呜米收藏集 可爱小猪Asaki收藏集 Hiiro收藏集春晖庆典 乐正绫九周年纪念收藏集 浅川玉乃收藏集 兰音的衣柜奇缘收藏集 折原露露收藏集 幻夏恋歌收藏集 hololive0期生收藏集 星空列车与白的旅行收藏集 雪狐桑倾心慕风收藏集 雪绘Yukie收藏集 米虫尼奈收藏集 洛天依再生收藏集 陆鳐lulu收藏集 宇宙无敌美少女雫lulu收藏集 兔眠可可夏色恋忆收藏集 洛天依心律共鸣收藏集 MyGO收藏集 东雪莲收藏集 希丝奈cisne收藏集 希月萌奈收藏集 幻星乐园收藏集 毛玉收藏集 hololive ID收藏集 奈姬niki收藏集 Neuro-sama收藏集 少女乐队的呐喊收藏集 东方收藏集浮生若梦 哔哩哔哩收藏集 全图鉴出框头像 纸嫁衣收藏集，甜夕sweet收藏集，雪狐桑收藏集，一点荧惑收藏集，卡拉彼丘收藏集，兰音的衣柜收藏集，量子猫收藏集，小铃久绘收藏集，陆鳐LuLu收藏集，兔眠可可收藏集，秋蒂夏日无际收藏集，然若星辰收藏集，尘白禁区收藏集，2233幻境序曲收藏集，切茜娅收藏集，唐九夏收藏集，雪域收藏集，东雪莲收藏集，明日方舟收藏集，Mygo收藏集，饿殍收藏集，泠鸢收藏集，洛天依收藏集，薇桃杠蔻伟情缘收藏集，瑞娅Rhea收藏集，花与梦收藏集，魔女与神兵收藏集，希丝奈cisne收藏集，白蛇浮生收藏集，Ro姬偶像收藏集，希月萌奈收藏集，阳阳不想熬夜收藏集，初音未来收藏集，随一Suiii收藏集，鬼刀收藏集，主播女孩重度依赖收藏集，绫光濑收藏集 朗星集 耀光集 皓月集 真白花音收藏集 大D特D收藏集 第二弹 普通小狗收藏集 2233群星闪耀时收藏集 永雏塔菲美女集 某科学的超电磁炮T收藏集 耀月集 洛天依收藏集 早凉收藏集 安可星瞳扇宝收藏集 爱上她的理由动画收藏集 冥冥收藏集 小铃久绘收藏集 穆小冷收藏集 初音未来收藏集 岱川收藏集 泠鸢收藏集 钉宫妮妮收藏集 鎏金之夜收藏集 星月夜收藏集 雪域收藏集 天官赐福动画收藏集 2233异世集 P＋收藏集艾尔莎收藏集 知薇入梦收藏集 psplive山珍收藏集 万圣学院收藏集 雪狐桑收藏集 幻夜魔法收藏集 KK輝気收藏集 奈奈莉娅收藏集 美月收藏集 银杏星川铃阿绿收藏集 露早GOGO收藏集 梅兰芳万象承华收藏集 Minicatty收藏集 兰音Reine收藏集 星瞳梦幻童话收藏集 四禧丸子收藏集 白粥nina收藏集 Twinkle.Star收藏集 psplive海味收藏集 Akie秋绘璀璨星辰收藏集 Kieed收藏集 花丸晴琉收藏集 铃音收藏集 夏诺雅收藏集 A-SOUL绽放收藏集 早稻叽月下舞会收藏集 醒醒加班收藏集 杠杠收藏集 织月黛黛收藏集 朝华缘拾收藏集 RO姬偶像收藏集 星河Sagi收藏集 夏露露Ruru收藏集 鸽一品天才集 斋藤直葵收藏集 中国绊爱收藏集 可洛Cro收藏集 幻境之夜纱依收藏集 米诺高分少女收藏集 次元异梦咲间妮娜收藏集  装扮小姐姐生日庆典 树礼suki收藏集 黎歌Neeko收藏集 猫雷NyaRu收藏集 公主茶话会iStella收藏集 初音未来单人收藏集 岁末欢聚 岁末夜宴 胡桃 旅行日记 原神 奥特曼收藏集 百妖谱收藏集 可爱小猪Asaki收藏集 Vox Akuma收藏集 功夫熊猫收藏集 机动战士高达收藏集 鬼刀收藏集 防道少女团收藏集 咩栗呜米收藏集 四季的少女收藏集 花花haya收藏集 纸迷金醉  兔眠可可收藏集 萝莉一凡个人收藏集  Hirro收藏集春晖庆典 宇宙无敌超级美少女雫lulu收藏集 折原露露收藏集 陆鳐lulu收藏集 饿殍·明末千里行收藏集 MyGO!!!!!收藏集 东雪莲收藏集 明日方舟收藏集 唐九夏-伴你一夏收藏集 尘白禁区收藏集与繁星共舞 库莉姆Cream《约会日》，奈奈莉娅《圣娅喵喵叫》，Skrillex《OC系列》，五更妖音《永不毕业》，小铃久绘Official《绘想童话》，话梅糖_Mei《玻璃纸季节》，文宝Eleven_《星轨交映》，氵六青《香草青青》，桃几OvO《家有萌猫》，Venus Vacation PRISM收藏集，早稻叽《云朵捕获计划》甜梦收容，丝塔莉《繁星缀梦》，i御十二《恋语花誓》，北久Kyuu的绮梦《心跳梦境》，甜夕sweet《夕时神约》，狸酱lino《喵狸个咪》，传奇仙女龙dd《有龙则灵》，白桃味の蛋挞《爱我还是挞》，酸柚粥sayo《妹妹养成手册》，是幼情呀《睡眠采耳店》，伊莎蓓尔Isabel《精灵物语》，冥冥meichan《爱执欲意》，Mygo!!!!!收藏集，rurudo_るるどらいおん《箱庭少女之梦》，黎歌Neeko《幻夏恋歌》，VirtuaReal《想去海边》偶像大师收藏集 BanG Dream收藏集 RAS收藏集 瑜瑜驯养手册收藏集 洛天依·珍藏集 VirtuaReal皓月集，VirtuaReal朗星集，VirtuaReal耀光集，普通小狗·梦幻塔罗收藏集，2233·奇书异闻录，纱耶sayako收藏集，小只芋收藏集，圣斗士星矢收藏集，bml10周年收藏集，时光代理人收藏集，赘婿动画收藏集，暹罗厘普收藏集，有兽焉动画收藏集，永生动画收藏集，保卫萝卜收藏集，2233群星闪耀时·双子座，巨蟹座收藏集，大D特D收藏集，DM袋猫收藏集，装扮小姐姐中华锦绣，幻星集收藏集，ksr与他的伙伴萌收藏集，真白花音收藏集，风灵玉秀动画收藏集，铃芽之旅收藏集，狮子座收藏集，BLG信念干杯收藏集，梦音茶糯收藏集，艾恺特AKT收藏集，雾山五行收藏集，镇魂街收藏集，菌子宝宝收藏集，百变菌宝收藏集，莓可收藏集，真里子收藏集，永雏塔菲美女集，晓丹收藏集，小黄人收藏集，蜘蛛侠：纵横宇宙收藏集，江壹纯收藏集，某科学的超电磁炮T收藏集，VirtuaReal耀月集，幻星集-命运的选择，阿萨Aza收藏集，早凉收藏集，洛天依收藏集，植物大战僵尸2收藏集，安可星瞳扇宝收藏集，爱上她的理由动画收藏集，2233·群星闪耀时-处女座，泰蕾莎收藏集，司稽人间幽灵收藏集，卡拉彼丘收藏集，红蓝巴萨，Krenz光影少女收藏集，斗破苍穹收藏集，波喵喵喵收藏集，阿里鸭收藏集 海天盛筵·夏日集 思小柒UMI收藏集 2233·宅舞嘉年华2025 居居boom 尘白禁区收藏集 流光协奏 八音奇响 莎布Shub欲望时刻收藏集 Renus收藏集 无尽耀 麻辣烤兔子收藏集 池咲的美少年收藏集 守护甜心收藏集 SHUGO CHARA! 糯米SnuomiQ收藏集 SNK-女神大乱斗 夏日缤果收藏集 宫濑真寻东方集 风舞早苗录 哪吒之魔童闹海收藏集 陆鳐lulu·心电同频 四茶·异世界冒险 灵笼破局·棋局之上 赛尔号巅峰之战系列 Yuimisu收藏集 爱上火车收藏集 一杆青空2025 少女前线收藏集 相伴格里芬 2233·元素协奏-寻疆 夏梦希语-希丝奈,10.0,四川,0,https://www.goofish.com/item?id=951811011556&categoryId=126860375
