标题,价格(元),所在地,想要人数,商品URL
新款三宝百变战陀2超变战坨陀螺玩具儿童男孩5发光坨螺枪战斗盘 二品牌:三宝，包邮，全新未拆封！基础版和标准版套装包装盒发射器样式仅供参考，以实际为主（见图5）点“立即购买”可查看具体款式价格！基础发光版【光焰龙骑】 基础发光版【幻雷战骑】 基础发光版【圣翼战凰】 基础发光版【次元天马】 基础发光版【暗焰龙牙】  高级发光版【圣霆战神】 高级发光版【陨落星神】 光焰龙骑VS暗焰龙牙标准对战套装 偏远地区不包邮！,25.8,河南,0,https://www.goofish.com/item?id=815231349594&categoryId=126862751
（孤品特价）正版三宝百变战陀超变战陀5，威焰龙骑-合金陀螺型 号:330101，全新清库存！实拍看图，仅此二套！所见即所得！ 特价：25元一套，谢绝还价！ 特价商品售出不退不换，介意勿拍！ 产品功能都是测试好的，拒绝扯皮！,25.0,江苏,0,https://www.goofish.com/item?id=927270378145&categoryId=126862751
全新未拆封三宝百变战陀超变战陀5，雷霆战神款！包装内含百变战 陀X1和百变发射器X1。适合儿童陀螺爱好者，金属质感十足，支持对战。现货即拍即发，偏远地区需补邮费。感兴趣的朋友请点“我想要”和我私聊吧～,22.4,广东,3,https://www.goofish.com/item?id=894695418654&categoryId=126862751
新款三宝超变战陀5之百变战陀威焰龙骑真极炎龙儿童男孩陀螺对战 真极炎龙-升级合金版,35.0,江苏,0,https://www.goofish.com/item?id=790166113076&categoryId=126862751
三宝百变战陀超变战陀5，全新未拆封，原装包装完整轻磨 售出不退不换， 单款35元，全国包邮（偏远地区除外）。,35.0,辽宁,0,https://www.goofish.com/item?id=958698871044&categoryId=126914167
三宝百变战陀2光纹觉醒极焰龙神儿童男孩超变5发光陀螺玩具第二 季   单出发射器   全新无包装,15.0,江苏,0,https://www.goofish.com/item?id=955722549145&categoryId=126862751
正品全新百变战陀儿童陀螺玩具超变战陀5对战陀螺套装 直接拍就可以，全新未拆封 标准版一款29包邮 升级版一款45包邮 快速对战套装55包邮 豪华对战套装75包邮,29.0,广东,0,https://www.goofish.com/item?id=742150889163&categoryId=126862751
新款三宝百变战陀儿童陀螺玩具超变战陀5男孩对战旋转坨螺战斗 四款可选,28.5,广东,1,https://www.goofish.com/item?id=822121508357&categoryId=126862751
三宝百变战陀5超变儿童升级版合金魔幻对战爆甲陀螺玩具，真极炎 龙2版本。配备高速轴承百变发射器，可变中轴两种形态，合金陀螺材质。带弹跳陀尖和金属圆型设计，四种属性可变。全新未拆封，包装完整。适合儿童玩耍，对战体验感强。感兴趣的朋友可以联系我哦～,20.0,江苏,0,https://www.goofish.com/item?id=938066733246&categoryId=126862751
三宝百变战陀新款超变战陀5玩具对战合金对战威焰龙骑御风神凰 正版三宝百变战陀网红儿童陀螺玩具男孩旋转对战斗盘套装 实体店购入，低价转，周边满50包邮 随机送小玩具，都是闲置的，确认后下单不退不换。,15.0,江苏,7,https://www.goofish.com/item?id=891674508853&categoryId=126862751
三宝2024新款超变战陀之百变战陀2光纹觉醒旋转陀螺玩具儿童 男孩 基础版（图1-5）…33元包邮 加强版（图6-8）…53元包邮 全新未拆封，保证正品,33.0,山西,5,https://www.goofish.com/item?id=807617179560&categoryId=126862751
三宝百变战陀超变战陀5，全新未拆封，带发射器和陀螺组合，低轴 高轴两种模式，金属材质，适合儿童对战玩耍。盒子完好，包装完整。 看好下单不退不换！ 偏远地区不包邮！,35.0,辽宁,0,https://www.goofish.com/item?id=961740989470&categoryId=126862751
（孤品）正版三宝百变战陀超变战陀5，威焰龙骑-合金陀螺型号: 330101，全新清库存！实拍看图，仅此二套！随机发！所见即所得！ 特价：25元一套，谢绝还价！ 特价商品售出不退不换，介意勿拍！ 产品功能都是测试好的，拒绝扯皮！,25.0,江苏,2,https://www.goofish.com/item?id=928599764757&categoryId=126862751
三宝正版百变陀螺超变战陀5儿童合金陀螺玩具 包装完好 特价 售出不退不换   感兴趣的话点“我想要”和我私聊吧～,25.8,安徽,0,https://www.goofish.com/item?id=939592459374&categoryId=126862751
三宝正版百变陀螺超变战陀5儿童合金陀螺玩具 感兴趣的话点“我想要”和我私聊吧～,26.0,湖北,1,https://www.goofish.com/item?id=853816770465&categoryId=126862751
三宝百变战陀新款儿童超变战陀螺5玩具男女孩对战合金坨螺套装 三宝新品上市，全新未拆封正品发货！   威焰龙骑-合金版——42元包邮  御风神凰-合金版——42元包邮  雷霆战神-合金板——42元包邮  无极幻魔-合金版&m...,42.0,江苏,25,https://www.goofish.com/item?id=740985545669&categoryId=126862751
三宝百变战陀儿童陀螺玩具超变战陀5双甲男孩对战旋转坨螺 【标准版】御风神凰,25.0,江西,0,https://www.goofish.com/item?id=762526151897&categoryId=126862751
三宝正版百变陀螺超变战陀5儿童合金陀螺玩具 盒损 特价 售出 不退不换 感兴趣的话点“我想要”和我私聊吧～,26.0,天津,0,https://www.goofish.com/item?id=891131760849&categoryId=126862751
雷霆战神，三宝新款超变战陀之百变战陀2光纹觉醒旋转陀螺玩具儿 童男孩  [1]【适用人群】1岁，2岁，3岁，4岁，5岁，6岁，7岁宝宝适用！早教启蒙/益智开发/亲子互动首选，安全材质无异味，家长放心购！ ⚠️【温馨提示】玩具已通过安全检测，无棱角设计，适合低龄宝宝抓握。部分含小零件，请在家长监护下使用...,30.0,北京,66,https://www.goofish.com/item?id=906653291433&categoryId=126862751
三宝百变战陀真极炎龙，全新拆封未使用，包装盒完好无损！儿童陀 螺，可变形对战，超级炫酷！现货，喜欢的直接拍下，当天发货。放心购买，售出不退不换，盒损,27.0,湖南,0,https://www.goofish.com/item?id=885157395479&categoryId=126860303
（全新特价）正版三宝百变战陀超变战陀5，威焰龙骑-合金陀螺型 号:330101，全新清库存！实拍看图，仅此二套！所见即所得！ 特价：25元一套，谢绝还价！ 特价商品售出不退不换，介意勿拍！ 产品功能都是测试好的，拒绝扯皮！,25.0,江苏,1,https://www.goofish.com/item?id=928019939290&categoryId=126862751
百变战陀威焰龙骑标准版！家里买了个重复的！ 全新带发射器 超变战陀5系列，男孩最爱 包装完整，配件齐全 包邮除偏远地区！ 不议价！,35.58,浙江,0,https://www.goofish.com/item?id=950213276843&categoryId=126860303
正版全新超变战陀之百变战陀5爆甲双甲对战陀螺男孩儿童玩具真极 炎龙  点击我想要-立即购买-选择款式  标准版一款26包邮  升级版一款39包邮(真极炎龙，烈空雷神，破岚巨神)  标准版对战套装58包邮 豪华对战套装78包邮,26.0,广东,0,https://www.goofish.com/item?id=749517709333&categoryId=126862751
三宝百变战陀 超变战陀螺5:对战合金坨螺套装以及升级版 真极 炎龙等。 330101 威焰龙骑—合金版陀螺28元。 330102雷霆战神—合金版陀螺28元。 330103御风神凰—合金版陀螺28元。 330104无极幻魔—合金版陀螺28元。 330301...,28.0,江苏,0,https://www.goofish.com/item?id=898494025887&categoryId=126862751
三宝百变战陀儿童陀螺玩具超变战陀5双甲男孩对战旋转坨螺战斗盘 【标准版】威焰龙骑                   33元 【标准版】雷霆战神                   33元 【标准版】御风神凰                   33元 【标准版】无极幻魔              ...,33.0,山东,1,https://www.goofish.com/item?id=915209135832&categoryId=126862751
赔本贱卖 三宝百变战陀玩具超变战陀5双层金属战斗陀螺爆甲坨螺儿童4男孩 前四个23.9 后三个39.9,23.9,北京,14,https://www.goofish.com/item?id=773918170991&categoryId=126862751
正版三宝最新款百变战陀超变战陀5可以变形对战的陀螺 真极炎龙      55.5包邮 破岚巨神      55.5包邮 烈空龙神      55.5包邮 威焰龙骑      39包邮 御风神凰      39包邮 雷霆战神      39包邮 无极幻魔      39包邮  现货现发有...,39.0,上海,7,https://www.goofish.com/item?id=742375756858&categoryId=126862751
正版三宝百变战陀新款超变战陀5对战合金陀螺真极炎龙威焰龙骑快 速对战套装儿童玩具男  全新三宝百变战陀对战套装  标准版快速对战套装59.9元（威焰龙骑vs雷霆战神）  豪华对战套装89.9元（真极炎龙vs破岚巨神）  选择款式，直接拍下即可,59.9,广东,0,https://www.goofish.com/item?id=776485900553&categoryId=126862751
新款三宝百变战陀儿童陀螺玩具超变战陀5男孩对战旋转坨螺战斗 感兴趣的话点“我想要”和我私聊吧～,29.0,广东,1,https://www.goofish.com/item?id=850078730482&categoryId=126862751
三宝百变战陀，超变战陀5，颜色炫酷，适合儿童玩耍。这个陀螺几 乎全新，只是偶尔用来消遣，现在娃大了，闲置出手。功能完好，无损坏。附赠说明书，全国包邮（偏远地区除外）。感兴趣的朋友可以私聊我哦～,20.0,北京,89,https://www.goofish.com/item?id=919404555428&categoryId=126862751
三宝百变战陀豪华对战套装，全新未拆封，真极炎龙VS破岚巨神对 决！水晶版发射器+战斗盘，适合5岁以上小朋友玩耍。豪华套装包含真极炎龙和破岚巨神两个陀螺，支持高低轴模式切换，战斗效果震撼。全国包邮，偏远地区除外。售出不退不换，介意勿拍。,65.0,河南,159,https://www.goofish.com/item?id=962004122002&categoryId=126862751
正版三宝百变战陀新款超变战陀5对战合金陀螺真极炎龙儿童玩具男 感兴趣的话点“我想要”和我私聊吧～,38.5,广东,0,https://www.goofish.com/item?id=822438056224&categoryId=126862751
百变战陀玩具超变战陀5真极炎龙威焰龙骑战斗陀螺双爆甲儿童送男 孩礼物  多个款式可选，配件齐全，正版玩具，现货，一盒也是批发价。点“我想要”可拍下带走。 #男孩玩具 #儿童玩具好货捡漏 #淘宝心选,35.5,重庆,0,https://www.goofish.com/item?id=766706900388&categoryId=126862751
三宝百变战陀超变战陀5威焰龙骑儿童爆甲2枪型陀螺玩具双甲男孩 感兴趣的话点“我想要”和我私聊吧～,25.0,广东,0,https://www.goofish.com/item?id=923433834392&categoryId=126862751
新款三宝百变战陀儿童陀螺玩具超变战陀5男孩对战旋转坨螺战斗盘 真极炎龙 -- 55 烈空雷神 -- 55 破岚巨神 -- 55 豪华对战套装 -- 120,55.0,江苏,13,https://www.goofish.com/item?id=751760795920&categoryId=126862751
2024新款百变战陀2玩具...高级版双人对战礼盒 极焰龙神 +陨落星神+对战盘 豪华套装，带发射器和对战盘，炫光陀螺旋转超帅！ 全新未拆封，官方正版授权，适合男孩玩耍。 【备注】港澳台不发；新疆，甘肃，青海，宁夏，西藏，内蒙需补运费（根据快递收费标准）,74.0,浙江,0,https://www.goofish.com/item?id=956489278992&categoryId=126862751
三宝正版百变陀螺超变战陀5儿童合金陀螺玩具男孩生日礼物 感兴趣的话点“我想要”和我私聊吧～,29.8,广东,0,https://www.goofish.com/item?id=822722432730&categoryId=126862751
三宝 百变战陀 超变战陀5爆甲2双甲威焰龙骑合金陀螺玩具儿童 男孩  全新未拆封  全国包邮（偏远地区除外）  款式：         威焰龙骑-合金陀螺（图1，37元）         雷霆战神-合金陀螺（图2，37元）         御风神凰-合金陀螺（图3，37元）         无极幻魔-...,37.0,天津,88,https://www.goofish.com/item?id=748325795313&categoryId=126862751
正版三宝百变战陀新款超变战陀5对战合金陀螺儿童玩具男 感兴趣的话点“我想要”和我私聊吧～,32.0,广东,0,https://www.goofish.com/item?id=823605576088&categoryId=126862751
新款三宝百变战陀2 超变战坨陀螺玩具 儿童男孩5炫彩坨螺枪光焰龙骑  分基础款和 升级款，具体看图片，拍时备注要哪个款  正品！咱家只卖正品！正品保证！不是正品我吃了！！  咱家正版动漫流行玩具啥都有，很多正流行款都没时间上，可私聊找货,36.9,河北,5,https://www.goofish.com/item?id=796665295145&categoryId=126862751
现货全新 三宝正版百变战陀5玩具超变战陀爆旋战陀螺金属战斗对 战儿童男孩 感兴趣的话点“我想要”和我私聊吧～,35.0,广东,0,https://www.goofish.com/item?id=825368099963&categoryId=126862751
三宝百变战陀五超变战陀5豪华套装，两个发射器，两个陀螺，一个 比赛盘,119.0,河北,199,https://www.goofish.com/item?id=850380772215&categoryId=126862751
春节正常发货24小时内三宝陀螺正版百变战陀超变5威焰龙骑儿童 爆甲2枪型玩具男孩双甲 随机一个可备注颜色,49.9,河北,1,https://www.goofish.com/item?id=767544564662&categoryId=126862751
新款三宝超变战陀之百变战陀5爆甲双甲对战陀螺男孩儿童玩具正版 感兴趣的话点“我想要”和我私聊吧～,41.8,广东,0,https://www.goofish.com/item?id=822631231447&categoryId=126862751
新款三宝百变战陀2超变战坨陀螺玩具儿童男孩5炫彩坨螺枪光焰龙 骑,36.49,上海,0,https://www.goofish.com/item?id=887880311735&categoryId=126862751
正版三宝百变战陀新款超变战陀5对战合金陀螺儿童玩具男 感兴趣的话点“我想要”和我私聊吧～,28.9,广东,1,https://www.goofish.com/item?id=823472937523&categoryId=126862751
【全新全新，就是盒子被扔了[捂脸哭][捂脸哭][捂脸哭][捂 脸哭][捂脸哭]】三宝百变战陀玩具超变战陀5双层金属战斗陀螺爆甲坨螺儿童男孩 感兴趣的话点“我想要”和我私聊吧～,38.0,福建,0,https://www.goofish.com/item?id=776376050814&categoryId=126862751
三宝百变战陀儿童陀螺玩具超变战陀5双甲男孩对战旋转坨螺 百变战陀2个套装   无极幻魔和雷霆战神 两个陀螺，两个发射器，非偏远包邮,59.0,浙江,120,https://www.goofish.com/item?id=754843374761&categoryId=126862751
三宝百变战陀5男孩儿童陀螺玩具超变对战旋转高级坨螺战斗盘 威焰龙骑￥35.9 雷霆战神￥35.9 御风神凰￥35.9 无极幻魔￥35.9 真极炎龙-升级版￥49.9 烈空雷神-升级版￥49.9 破岚巨神-升级版￥49.9 威焰龙骑VS雷霆战神快速对战套装￥79.9 真极炎龙VS破岚巨神豪华对战...,39.9,江苏,99,https://www.goofish.com/item?id=763517321616&categoryId=126862751
三宝超变战陀，全新未拆封，适合儿童玩耍的金属材质陀螺。现有烈 空雷神、破岚巨神、真极炎龙三种款式，都是百变组合可变形，超级炫酷好玩！  当天拍下当天发货，包装完好无损。喜欢的朋友不要错过哦！  分类: 儿童陀螺 成色: 全新,53.0,辽宁,0,https://www.goofish.com/item?id=905696962024&categoryId=126862751
百变战陀超变战陀5，真极炎龙VS威焰巨神豪华对战套装！玩具状 态极佳，适合战斗陀螺爱好者！有明显使用痕迹，孩子升级其他玩具，闲置转让。有意者联系，不退不换。不包邮。,65.0,福建,0,https://www.goofish.com/item?id=900748565271&categoryId=126862751
三宝百变战陀豪华对战套装，全新未拆封，真极炎龙VS破岚巨神对 决！水晶版发射器+战斗盘，适合5岁以上小朋友玩耍。豪华套装包含真极炎龙和破岚巨神两个陀螺，支持高低轴模式切换，战斗效果震撼。全国包邮，偏远地区除外。售出不退不换，介意勿拍。,65.0,河南,159,https://www.goofish.com/item?id=962004122002&categoryId=126862751
正版三宝百变战陀新款超变战陀5对战合金陀螺真极炎龙儿童玩具男 感兴趣的话点“我想要”和我私聊吧～,38.5,广东,0,https://www.goofish.com/item?id=822438056224&categoryId=126862751
百变战陀玩具超变战陀5真极炎龙威焰龙骑战斗陀螺双爆甲儿童送男 孩礼物  多个款式可选，配件齐全，正版玩具，现货，一盒也是批发价。点“我想要”可拍下带走。 #男孩玩具 #儿童玩具好货捡漏 #淘宝心选,35.5,重庆,0,https://www.goofish.com/item?id=766706900388&categoryId=126862751
三宝百变战陀超变战陀5威焰龙骑儿童爆甲2枪型陀螺玩具双甲男孩 感兴趣的话点“我想要”和我私聊吧～,25.0,广东,0,https://www.goofish.com/item?id=923433834392&categoryId=126862751
新款三宝百变战陀儿童陀螺玩具超变战陀5男孩对战旋转坨螺战斗盘 真极炎龙 -- 55 烈空雷神 -- 55 破岚巨神 -- 55 豪华对战套装 -- 120,55.0,江苏,13,https://www.goofish.com/item?id=751760795920&categoryId=126862751
2024新款百变战陀2玩具...高级版双人对战礼盒 极焰龙神 +陨落星神+对战盘 豪华套装，带发射器和对战盘，炫光陀螺旋转超帅！ 全新未拆封，官方正版授权，适合男孩玩耍。 【备注】港澳台不发；新疆，甘肃，青海，宁夏，西藏，内蒙需补运费（根据快递收费标准）,74.0,浙江,0,https://www.goofish.com/item?id=956489278992&categoryId=126862751
三宝正版百变陀螺超变战陀5儿童合金陀螺玩具男孩生日礼物 感兴趣的话点“我想要”和我私聊吧～,29.8,广东,0,https://www.goofish.com/item?id=822722432730&categoryId=126862751
三宝 百变战陀 超变战陀5爆甲2双甲威焰龙骑合金陀螺玩具儿童 男孩  全新未拆封  全国包邮（偏远地区除外）  款式：         威焰龙骑-合金陀螺（图1，37元）         雷霆战神-合金陀螺（图2，37元）         御风神凰-合金陀螺（图3，37元）         无极幻魔-...,37.0,天津,88,https://www.goofish.com/item?id=748325795313&categoryId=126862751
正版三宝百变战陀新款超变战陀5对战合金陀螺儿童玩具男 感兴趣的话点“我想要”和我私聊吧～,32.0,广东,0,https://www.goofish.com/item?id=823605576088&categoryId=126862751
新款三宝百变战陀2 超变战坨陀螺玩具 儿童男孩5炫彩坨螺枪光焰龙骑  分基础款和 升级款，具体看图片，拍时备注要哪个款  正品！咱家只卖正品！正品保证！不是正品我吃了！！  咱家正版动漫流行玩具啥都有，很多正流行款都没时间上，可私聊找货,36.9,河北,5,https://www.goofish.com/item?id=796665295145&categoryId=126862751
现货全新 三宝正版百变战陀5玩具超变战陀爆旋战陀螺金属战斗对 战儿童男孩 感兴趣的话点“我想要”和我私聊吧～,35.0,广东,0,https://www.goofish.com/item?id=825368099963&categoryId=126862751
三宝百变战陀五超变战陀5豪华套装，两个发射器，两个陀螺，一个 比赛盘,119.0,河北,199,https://www.goofish.com/item?id=850380772215&categoryId=126862751
春节正常发货24小时内三宝陀螺正版百变战陀超变5威焰龙骑儿童 爆甲2枪型玩具男孩双甲 随机一个可备注颜色,49.9,河北,1,https://www.goofish.com/item?id=767544564662&categoryId=126862751
新款三宝超变战陀之百变战陀5爆甲双甲对战陀螺男孩儿童玩具正版 感兴趣的话点“我想要”和我私聊吧～,41.8,广东,0,https://www.goofish.com/item?id=822631231447&categoryId=126862751
新款三宝百变战陀2超变战坨陀螺玩具儿童男孩5炫彩坨螺枪光焰龙 骑,36.49,上海,0,https://www.goofish.com/item?id=887880311735&categoryId=126862751
正版三宝百变战陀新款超变战陀5对战合金陀螺儿童玩具男 感兴趣的话点“我想要”和我私聊吧～,28.9,广东,1,https://www.goofish.com/item?id=823472937523&categoryId=126862751
【全新全新，就是盒子被扔了[捂脸哭][捂脸哭][捂脸哭][捂 脸哭][捂脸哭]】三宝百变战陀玩具超变战陀5双层金属战斗陀螺爆甲坨螺儿童男孩 感兴趣的话点“我想要”和我私聊吧～,38.0,福建,0,https://www.goofish.com/item?id=776376050814&categoryId=126862751
三宝百变战陀儿童陀螺玩具超变战陀5双甲男孩对战旋转坨螺 百变战陀2个套装   无极幻魔和雷霆战神 两个陀螺，两个发射器，非偏远包邮,59.0,浙江,120,https://www.goofish.com/item?id=754843374761&categoryId=126862751
三宝百变战陀5男孩儿童陀螺玩具超变对战旋转高级坨螺战斗盘 威焰龙骑￥35.9 雷霆战神￥35.9 御风神凰￥35.9 无极幻魔￥35.9 真极炎龙-升级版￥49.9 烈空雷神-升级版￥49.9 破岚巨神-升级版￥49.9 威焰龙骑VS雷霆战神快速对战套装￥79.9 真极炎龙VS破岚巨神豪华对战...,39.9,江苏,99,https://www.goofish.com/item?id=763517321616&categoryId=126862751
三宝超变战陀，全新未拆封，适合儿童玩耍的金属材质陀螺。现有烈 空雷神、破岚巨神、真极炎龙三种款式，都是百变组合可变形，超级炫酷好玩！  当天拍下当天发货，包装完好无损。喜欢的朋友不要错过哦！  分类: 儿童陀螺 成色: 全新,53.0,辽宁,0,https://www.goofish.com/item?id=905696962024&categoryId=126862751
百变战陀超变战陀5，真极炎龙VS威焰巨神豪华对战套装！玩具状 态极佳，适合战斗陀螺爱好者！有明显使用痕迹，孩子升级其他玩具，闲置转让。有意者联系，不退不换。不包邮。,65.0,福建,0,https://www.goofish.com/item?id=900748565271&categoryId=126862751
