标题,价格(元),所在地,想要人数,商品URL
全新邦驰洗车机自动开关盒，适用于多种型号如702/803/1 145/1450/2500。微动开关，品质保证，适合需要自,35.0,一***保,2,https://www.goofish.com/item?id=888983150899&categoryId=126856560
烙铁头套筒~威乐Weller～WSP80焊笔使用套筒专用，手 柄使用，库存不多，用得上的联系，实物拍摄，不含邮费！,36.0,阿***店,70,https://www.goofish.com/item?id=895884721077&categoryId=126864567
两个舒尔会议室有线话筒。型号Mx418D/C 接口看清楚 一 个全新 一个仅拆封。两个一起打包3500  售出非产品质量,3500.0,伊***无,4800,https://www.goofish.com/item?id=743494740458&categoryId=126858797
清代竹臂搁，尺寸品相如图。欢迎成为粉丝，互相交流学习，本号定 期抽奖回馈新老粉丝。,900.0,养***馆,3000,https://www.goofish.com/item?id=676482296565&categoryId=126862335
提升家居品味大象造型牙膏架牙刷架挂钩沥水四合一免打孔香皂盒肥 皂盒 时尚美观与实用并存，错过后悔一年无敌好用的香皂盒防潮,11.99,晟***存,19,https://www.goofish.com/item?id=807707326887&categoryId=126858324
精选挑选明前龙丼茶500一斤的高碎，现在只要98一斤。只剩1 8斤。绿茶皇后；冲泡后，香气清高持久，香馥若兰；清澈明亮，,98.0,芊***发,5000,https://www.goofish.com/item?id=714968031060&categoryId=126854657
2瓶13.9元，单瓶8.2元老管家植物除菌除螨喷雾家用床被子 免洗去除螨虫床垫子灭杀螨非包  猫超市发货,8.2,温***铺,0,https://www.goofish.com/item?id=934409066163&categoryId=126858253
全新感应式防走失牵引绳。闲置物品 仅此一个，不退不换。  感兴趣的话点“我想要”和我私聊吧～,99.0,琰***儿,0,https://www.goofish.com/item?id=939502450414&categoryId=126858546
铜包铝透明高保真音响线  非标    喇叭线  感兴趣的话点“我想要”和我私聊吧～,88.0,天***发,2,https://www.goofish.com/item?id=746276116378&categoryId=126856377
Kindle oasis 1/2/3通用手工定制皮套  意大利植鞣革协会Mbox原色植鞣革 纯手工制作，可以免费烫印英文,299.0,砍***年,4,https://www.goofish.com/item?id=707064686288&categoryId=126854126
【厂家直销】扩散体 吸声体 赫姆霍兹板MLS反射板  新品三角尖劈扩散板带led背光灯   适用于各种录音棚、影音间、h,1200.0,山***学,1,https://www.goofish.com/item?id=779972657496&categoryId=126858157
亏本清 30公斤臂力器50公斤臂力棒40公斤锻炼手臂60公斤 健身器材  朋友之前做的体育用品店不开了，现在全新赔本出，,29.0,健***3,99,https://www.goofish.com/item?id=778297592352&categoryId=126866602
幼儿园午休床，塑料材质，闲置  转给有需要的人 仅限自提 地址：广州市、花都区、狮岭镇、南航碧小区,65.0,q***9,11,https://www.goofish.com/item?id=859115427185&categoryId=126864955
淮安本地洗衣机伴侣定制 洗衣机伴侣洗衣柜 机上盆洗衣机伴侣合 金材质带搓衣板石英石一体盆  柜体是太空铝制作，新型铝材，,372.0,卫***店,7,https://www.goofish.com/item?id=842738801725&categoryId=201457510
全新钓桶  带提手   不带夹层  颜色：黑色   蓝色,18.0,t***5,35,https://www.goofish.com/item?id=872972041317&categoryId=126856714
猫咪大战吸水贴，特厚款2.2mm，防霉防水效果好。白色底色配 黑色猫咪图案，可爱又实用。适用于窗户、玻璃、墙面等表面，贴,24.5,爱***n,0,https://www.goofish.com/item?id=958538078393&categoryId=126858212
工厂价～门头发光字，自家工厂制作出售，需要的亲们可以私聊我。  感兴趣的话点“我想要”和我私聊吧～,100.0,永***鱼,1,https://www.goofish.com/item?id=694080002618&categoryId=201452701
各种奶茶纸袋子 保温袋 周边  感兴趣的话点“我想要”和我私聊吧～,5.0,夏***吗,1,https://www.goofish.com/item?id=818045907810&categoryId=126854526
原装进口棘轮螺丝刀！美国产.博世旗下的另一个品牌:“SKlL ”.非全新！手柄包胶部分有轻微使用磨损痕迹！包胶无损坏！丁,99.0,希***家,2,https://www.goofish.com/item?id=775198269913&categoryId=126864619
猫爪暖手宝USB充电女生暖宝宝生日礼物电暖宝儿童暖手神器粉色 ，，，，全新，未使用过,12.0,x***9,27,https://www.goofish.com/item?id=946657903116&categoryId=126854022
